EMERGING_RISK_ID,TITLE,PUBLISHED_DATE,LINK,SENTIMENT,POLARITY,LAST_RUN_TIMESTAMP
15,IBM's quantum computer now at Rensselaer Polytechnic Institute - Axios,2024-04-06,https://www.axios.com/2024/04/06/ibm-quantum-computer-rpi-new-york-school-college-rensselaer,positive,0.074,
7,Biden hauls in $90 million in March as campaign embarks on general election blitz - CNN,2024-04-06,https://www.cnn.com/2024/04/06/politics/biden-fundraising-march/index.html,positive,0.044,
6,The Taylor Swift gig economy is so big itÇƒÙs even causing geopolitical tensions - The Guardian,2024-04-06,https://www.theguardian.com/commentisfree/2024/apr/06/the-taylor-swift-gig-economy-is-so-big-its-even-causing-geopolitical-tensions,positive,0.123,
7,Pellegrini wins Slovak presidential election in boost for pro-Russian PM Fico - Reuters,2024-04-06,https://www.reuters.com/world/europe/government-backed-pellegrini-takes-lead-slovak-presidential-election-2024-04-06/,neutral,0.0,
7,"Biden could face obstacle getting on OhioÇƒÙs ballot, secretary of stateÇƒÙs office says - CNN",2024-04-06,https://www.cnn.com/2024/04/06/politics/biden-ohio-ballot-election-conflict/index.html,positive,0.069,
15,Microsoft makes major quantum computing breakthrough ÇƒÓ development of most stable qubits might actually make the ... - TechRadar,2024-04-06,https://www.techradar.com/pro/microsoft-makes-major-quantum-computing-breakthrough-development-of-most-stable-qubits-might-actually-make-the-technology-viable-for-many-but-will-anyone-be-able-to-afford-it,positive,0.066,
10,Janet Yellen warns China of 'significant consequences' if its companies support Russia's war - Financial Times,2024-04-06,https://www.ft.com/content/ba524406-ee6c-4c39-9ac2-110a2549569a,negative,-0.074,
11,Truth Social Trading Frenzy Shouldn't Concern The SEC - Forbes,2024-04-06,https://www.forbes.com/sites/jamesbroughel/2024/04/06/truth-social-trading-frenzy-shouldnt-concern-the-sec/,positive,0.076,
23,How to detect AI deepfakes - The Washington Post,2024-04-05,https://www.washingtonpost.com/technology/2024/04/05/ai-deepfakes-detection/,positive,0.079,
23,"Meta overhauls rules on deepfakes, other altered media - Reuters",2024-04-05,https://www.reuters.com/technology/cybersecurity/meta-overhauls-rules-deepfakes-other-altered-media-2024-04-05/,neutral,0.0,
7,Overseas Conflicts Encroaching on the 2024 Presidential Campaign - Bloomberg,2024-04-05,https://www.bloomberg.com/news/newsletters/2024-04-05/overseas-conflicts-encroaching-on-the-2024-presidential-campaign,neutral,1.0,
7,"Biden visits Baltimore to survey bridge collapse, recovery - The Washington Post",2024-04-05,https://www.washingtonpost.com/politics/2024/04/05/election-2024-campaign-updates-2/,positive,0.029,
23,Meta will label AI content to help prevent deepfakes on Facebook and Instagram - Axios,2024-04-05,https://www.axios.com/2024/04/05/meta-broader-ai-labeling,negative,-0.023,
13,US looking at report that Israel used AI to identify bombing targets in Gaza - Reuters,2024-04-05,https://www.reuters.com/world/middle-east/us-looking-report-that-israel-used-ai-identify-bombing-targets-gaza-2024-04-04/,neutral,0.0,
23,Social media stars face off against deepfake scammers - Financial Times,2024-04-05,https://www.ft.com/content/04dcc944-49a4-4a2d-808c-26551681a222,negative,-0.074,
23,"MetaÇƒÙs new AI deepfake playbook: More labels, fewer takedowns - TechCrunch",2024-04-05,https://techcrunch.com/2024/04/05/meta-deepfake-labels/,negative,-0.089,
13,"AI will shrink workforces within five years, say company execs - CNN",2024-04-05,https://www.cnn.com/2024/04/05/business/ai-job-losses/index.html,positive,0.057,
15,Quantum Computing Market worth $5.3 billion by 2029 - Exclusive Report by MarketsandMarketsÇ—¢ - PR Newswire,2024-04-05,https://www.prnewswire.com/news-releases/quantum-computing-market-worth-5-3-billion-by-2029---exclusive-report-by-marketsandmarkets-302109164.html,positive,0.055,
6,Oil prices climb more than $1 per barrel on supply risk - Reuters,2024-04-05,https://www.reuters.com/markets/commodities/oil-prices-bound-second-weekly-gain-geopolitical-tension-supply-concerns-2024-04-05/,neutral,0.0,
13,"AI seen cutting worker numbers, survey by staffing company Adecco shows - Reuters",2024-04-05,https://www.reuters.com/technology/ai-seen-cutting-worker-numbers-survey-by-staffing-company-adecco-shows-2024-04-05/,neutral,0.0,
6,Brent settles above $90 for first time since October on geopolitical tension - Reuters,2024-04-05,https://www.reuters.com/markets/commodities/oil-prices-rise-concerns-lower-supply-signs-us-economic-growth-2024-04-04/,neutral,0.0,
6,"Oil prices bound for second weekly gain on geopolitical tension, supply concerns - CNBC",2024-04-05,https://www.cnbc.com/2024/04/05/oil-prices-bound-for-second-weekly-gain-on-geopolitical-tension-supply-concerns.html,positive,0.248,
7,"Why It Matters: Cobb County, Georgia, and the 2024 Election | America 2024 | U.S. News - U.S. News & World Report",2024-04-04,https://www.usnews.com/news/elections/articles/why-it-matters-cobb-county-georgia-and-the-2024-election,positive,0.019,
6,"Today's market moves were largely due to geopolitical tensions, says Wells Fargo's Scott Wren - CNBC",2024-04-04,https://www.cnbc.com/video/2024/04/04/todays-market-moves-were-largely-due-to-geopolitical-tensions-says-wells-fargos-scott-wren.html,positive,0.261,
6,Treasurys rally as geopolitical tensions flare - MarketWatch,2024-04-04,https://www.marketwatch.com/story/treasury-yields-nudge-higher-with-payrolls-report-viewed-as-next-big-catalyst-7085b8bc,neutral,0.0,
7,No Labels Ditches Plans for Third-Party 'Unity' Ticket - U.S. News & World Report,2024-04-04,https://www.usnews.com/news/national-news/articles/2024-04-04/no-labels-ditches-plans-for-a-third-party-unity-ticket-further-solidifying-biden-trump-rematch,positive,0.061,
7,Texas Democratic and Republican primary election results and maps 2024 - CNN,2024-04-04,https://www.cnn.com/election/2024/primaries-and-caucuses/results/texas,neutral,1.0,
23,Deepfake Expert Henry Ajder to Keynote Infosecurity Europe 2024 on AI - Infosecurity Magazine,2024-04-04,https://www.infosecurity-magazine.com/news/henry-ajder-keynote-infosecurity/,positive,0.055,
7,Centrist group No Labels won't field a ticket in presidential election - The Washington Post,2024-04-04,https://www.washingtonpost.com/politics/2024/04/04/no-labels-no-presidential-ticket/,negative,-0.077,
7,Harris returns to N.C. as Democrats seek to put state in play - The Washington Post,2024-04-04,https://www.washingtonpost.com/elections/2024/04/04/election-2024-campaign-updates/,positive,0.029,
13,"Israel is using artificial intelligence to help pick bombing targets in Gaza, report says - CNN",2024-04-04,https://www.cnn.com/2024/04/03/middleeast/israel-gaza-artificial-intelligence-bombing-intl/index.html,negative,-0.14,
7,No Labels Will Not Put Forward A Unity Ticket - Forbes,2024-04-04,https://www.forbes.com/sites/mollybohannon/2024/04/04/no-labels-abandons-effort-for-unity-ticket-in-2024-presidential-election/,negative,-0.1,
6,U.S. crude oil breaks $86 as tensions mount between Israel and Iran - CNBC,2024-04-04,https://www.cnbc.com/2024/04/04/us-crude-oil-hovers-around-85-as-traders-take-stock-of-rally.html,negative,-0.199,
8,Somalia Expels Ethiopian Ambassador Over Gulf of Aden Port Spat - Bloomberg,2024-04-04,https://www.bloomberg.com/news/articles/2024-04-04/somalia-expels-ethiopian-ambassador-over-gulf-of-aden-port-spat,positive,0.043,
7,No Labels abandons 2024 presidential effort - The Hill,2024-04-04,https://thehill.com/homenews/campaign/4575052-no-labels-party-passes-2024-election-candidate/,negative,-0.088,
8,Israel braces for Tehran's response after deadly Damascus strike - The Washington Post,2024-04-04,https://www.washingtonpost.com/world/2024/04/04/israel-iran-syria-consulate-strike/,negative,-0.231,
7,No Labels ditches plans for 2024 third-party ticket - Axios,2024-04-04,https://www.axios.com/2024/04/04/no-labels-2024-presidential-campaign-cancelled,negative,-0.086,
6,"Latest Oil Prices, Market News and Analysis for April 5 - Bloomberg",2024-04-04,https://www.bloomberg.com/news/articles/2024-04-04/latest-oil-market-news-and-analysis-for-april-5,negative,-0.252,
2,America's Best Banks 2024 - Forbes,2024-04-04,https://www.forbes.com/lists/americas-best-banks/,positive,0.163,
10,Senior US diplomat links AUKUS submarine pact to Taiwan - Reuters,2024-04-04,https://www.reuters.com/world/senior-us-diplomat-links-aukus-submarine-pact-taiwan-2024-04-03/,neutral,0.0,
11,Investment News: Investors Flock To US Equity Funds As UK Falls Out Of Favour - Forbes,2024-04-04,https://www.forbes.com/uk/advisor/investing/2024/04/04/investment-market-updates/,positive,0.12,
11,Reddit Stock Already Down 39% From Peak As Analysts Balk At Valuation - Forbes,2024-04-04,https://www.forbes.com/sites/dereksaul/2024/04/04/poor-mans-twitter-reddit-gets-lukewarm-wall-street-welcome/,positive,0.094,
5,"Taiwan quake to hit some chip output, disrupt supply chain, analysts say - Reuters",2024-04-04,https://www.reuters.com/markets/asia/taiwan-quake-hit-some-chip-output-cause-asia-supply-chain-disruptions-analysts-2024-04-03/,neutral,0.0,
15,Quantinuum Partners with Microsoft in New Phase of Reliable Quantum Computing with Breakthrough Demonstration ... - PR Newswire,2024-04-03,https://www.prnewswire.com/news-releases/quantinuum-partners-with-microsoft-in-new-phase-of-reliable-quantum-computing-with-breakthrough-demonstration-of-reliable-logical-qubits-302106318.html,positive,0.129,
13,OneTrust Joins Responsible Artificial Intelligence Institute - PR Newswire,2024-04-03,https://www.prnewswire.com/news-releases/onetrust-joins-responsible-artificial-intelligence-institute-302106693.html,positive,0.305,
15,"Microsoft, Quantinuum claim breakthrough in quantum computing - Reuters",2024-04-03,https://www.reuters.com/technology/microsoft-quantinuum-claim-breakthrough-quantum-computing-2024-04-03/,neutral,0.0,
23,AI Election Deepfake Measure at Risk in NY Budget Negotiations - Bloomberg Law,2024-04-03,https://news.bloomberglaw.com/artificial-intelligence/ai-election-deepfake-measure-at-risk-in-ny-budget-negotiations,negative,-0.046,
15,Microsoft and Quantinuum say theyÇƒÙve ushered in the next era of quantum computing - TechCrunch,2024-04-03,https://techcrunch.com/2024/04/03/microsoft-and-quantinuum-say-theyve-ushered-in-the-next-era-of-quantum-computing/,negative,-0.114,
13,7 Top AI Stocks: April 2024 - NerdWallet,2024-04-03,https://www.nerdwallet.com/article/investing/ai-stocks-invest-in-artificial-intelligence,positive,0.063,
3,S&P 500: Rising Rates Threaten To Burst The Bubble (SP500) - Seeking Alpha,2024-04-03,https://seekingalpha.com/article/4681899-sp500-rising-rates-threaten-to-burst-bubble,neutral,0.0,
7,How TrumpÇƒÙs greatest policy triumph could derail his bid to win back the White House - CNN,2024-04-03,https://www.cnn.com/2024/04/02/politics/trump-abortion-florida-2024/index.html,positive,0.192,
17,"Global Regulatory Brief: Risk, capital and financial stability, April edition | Insights - Bloomberg",2024-04-03,https://www.bloomberg.com/professional/insights/regulation/global-regulatory-brief-risk-capital-and-financial-stability-april-edition-1/,positive,0.139,
1,BCE is a very defensive name to own in an economic downturn: portfolio manager - BNN Bloomberg,2024-04-03,https://www.bnnbloomberg.ca/investing/video/bce-is-a-very-defensive-name-to-own-in-an-economic-downturn-portfolio-manager~2896980,negative,-0.083,
7,Washington Democratic and Republican primary election results and maps 2024 - CNN,2024-04-03,https://www.cnn.com/election/2024/primaries-and-caucuses/results/washington,neutral,1.0,
7,"Why It Matters: Maricopa County, Arizona, and the 2024 Election | America 2024 | U.S. News - U.S. News & World Report",2024-04-03,https://www.usnews.com/news/elections/articles/why-it-matters-maricopa-county-arizona-and-the-2024-election,positive,0.166,
6,"Oil holds to gains as market monitors OPEC+ policy, geopolitical tensions - CNBC",2024-04-03,https://www.cnbc.com/2024/04/03/crude-oil-prices-today.html,negative,-0.109,
7,7 Swing States That Could Decide the 2024 Presidential Election | America 2024 | U.S. News - U.S. News & World Report,2024-04-03,https://www.usnews.com/news/elections/articles/7-swing-states-that-could-decide-the-2024-presidential-election,neutral,1.0,
7,"Trump leads Biden in battleground US states, WSJ poll finds - Reuters",2024-04-03,https://www.reuters.com/world/us/trump-leads-biden-battleground-us-states-wsj-poll-finds-2024-04-03/,neutral,0.0,
5,Supply Chain Latest: Taiwan Quake Causes Chip Disruptions - Bloomberg,2024-04-03,https://www.bloomberg.com/news/newsletters/2024-04-03/supply-chain-latest-taiwan-quake-causes-chip-disruptions,negative,-0.087,
5,La Ni?±a And AI Will Shape Supply Chain Response To Hurricane Season - Forbes,2024-04-03,https://www.forbes.com/sites/rennyvandewege/2024/04/03/la-nina-and-ai-will-shape-supply-chain-response-to-hurricane-season/,positive,0.188,
13,Top 10 Artificial Intelligence (AI) Cryptocurrencies ÇƒÏ Forbes Advisor UK - Forbes,2024-04-02,https://www.forbes.com/uk/advisor/investing/cryptocurrency/top-10-artificial-intelligence-ai-cryptocurrencies/,positive,0.086,
6,U.S. crude oil cracks $85 to hit highest level since October as geopolitical tensions mount - CNBC,2024-04-02,https://www.cnbc.com/2024/04/02/oil-prices-climb-to-five-month-high-on-escalating-middle-east-tensions.html,negative,-0.169,
6,Global oil price hits seven-month high as Middle East tensions rise - CNN,2024-04-02,https://www.cnn.com/2024/04/02/economy/oil-price-rises-middle-east-tensions/index.html,negative,-0.11,
23,WME is using AI technology to combat celebrity deepfakes - Los Angeles Times,2024-04-02,https://www.latimes.com/entertainment-arts/business/story/2024-04-02/wme-loti-deepfakes-artificial-intelligence,positive,0.092,
13,"Katy Perry, Billie Eilish, J Balvin and more lash out against ÇƒÚenormousÇƒÙ AI threats that ÇƒÚsabotage creativityÇƒÙ - CNN",2024-04-02,https://www.cnn.com/2024/04/02/business/ai-artificial-intelligence-katy-perry-j-balvin-artists/index.html,negative,-0.142,
13,US and UK announce formal partnership on artificial intelligence safety - The Guardian,2024-04-02,https://www.theguardian.com/technology/2024/apr/02/us-uk-artificial-intelligence-partnership,positive,0.177,
7,The former Trump aides who donÇƒÙt support his 2024 presidential bid - The Washington Post,2024-04-02,https://www.washingtonpost.com/politics/2024/04/02/trump-aides-wont-vote-for-him/,positive,0.139,
13,"US, Britain announce partnership on AI safety, testing - Reuters",2024-04-02,https://www.reuters.com/technology/us-britain-announce-formal-partnership-artificial-intelligence-safety-2024-04-01/,neutral,0.0,
1,Best Recession Stocks Of April 2024 ÇƒÏ Forbes Advisor - Forbes,2024-04-02,https://www.forbes.com/advisor/investing/best-recession-stocks/,negative,-0.174,
7,Joe Biden vs Donald Trump: tell us how the 2024 US election will affect you - Financial Times,2024-04-02,https://www.ft.com/content/9b353c66-4775-4d97-bac5-f2d7c5cf380d,positive,0.057,
6,Gold (XAUUSD) Hits Record on Fed Cut Outlook and Geopolitical Tension - Bloomberg,2024-04-01,https://www.bloomberg.com/news/articles/2024-04-01/gold-xauusd-hits-record-on-fed-cut-outlook-and-geopolitical-tension,positive,0.077,
23,OpenAI shares preview of new AI voice technology amid rising deepfake concerns - The Hill,2024-04-01,https://thehill.com/policy/technology/4567901-openai-shares-preview-of-new-ai-voice-technology-amid-rising-deepfake-concerns/,positive,0.075,
11,Trump Media's Business Doesn't Matter - Bloomberg,2024-04-01,https://www.bloomberg.com/opinion/articles/2024-04-01/trump-media-s-business-doesn-t-matter,positive,0.021,
7,Trump v Biden: who's ahead in the latest polls? - The Economist,2024-03-29,https://www.economist.com/interactive/us-2024-election,neutral,0.0,
7,Biden Looks South to Beat Trump in 2024 Presidential Race | The Report | U.S. News - U.S. News & World Report,2024-03-29,https://www.usnews.com/news/the-report/articles/2024-03-29/biden-looks-south-to-beat-trump-in-2024-presidential-race,positive,0.103,
7,Cesar Chavez's family wants nothing to do with Robert F. Kennedy Jr.'s presidential campaign - Los Angeles Times,2024-03-29,https://www.latimes.com/politics/story/2024-03-29/cesar-chavez-robert-f-kennedy-jr-rk-campaign,negative,-0.053,
7,Biden campaign launches ad targeting Haley voters - The Washington Post - The Washington Post,2024-03-29,https://www.washingtonpost.com/politics/2024/03/29/biden-campaign-launches-new-ad-targeting-haley-voters/,positive,0.093,
13,Artificial General Intelligence Or AGI: A Very Short History - Forbes,2024-03-29,https://www.forbes.com/sites/gilpress/2024/03/29/artificial-general-intelligence-or-agi-a-very-short-history/,positive,0.195,
13,Nine Major Proposals for Government Regulating Artificial Intelligence Favored by Very Large Bipartisan Majorities of ... - PR Newswire,2024-03-29,https://www.prnewswire.com/news-releases/nine-major-proposals-for-government-regulating-artificial-intelligence-favored-by-very-large-bipartisan-majorities-of-voters-302103221.html,positive,0.11,
13,The AI doctor will see youÇƒ∂eventually | Mar 30th 2024 - The Economist,2024-03-29,https://www.economist.com/weeklyedition/2024-03-30,negative,-0.124,
7,Election 2024 latest news: Biden wraps up lucrative New York campaign swing - The Washington Post,2024-03-29,https://www.washingtonpost.com/elections/2024/03/29/election-2024-campaign-updates/,positive,0.029,
13,Artificial intelligence (AI) | Technology - The Guardian,2024-03-29,https://www.theguardian.com/technology/artificialintelligenceai/2024/mar/29/all,positive,0.098,
13,A new prescription | Mar 30th 2024 - The Economist,2024-03-29,https://www.economist.com/technology-quarterly/2024-03-30,positive,0.171,
7,Biden campaign opens 10 field offices as part of big investment in North Carolina - Axios,2024-03-29,https://www.axios.com/local/raleigh/2024/03/28/biden-campaign-opening-10-field-offices-in-north-carolina,negative,-0.052,
7,Biden takes press to task over coverage of his polls - The Hill,2024-03-29,https://thehill.com/homenews/campaign/4562420-biden-polls-media-coverage/,negative,-0.045,
7,Axelrod: Obama doesnÇƒÙt want Trump-Biden race to be ÇƒÚtag-team matchÇƒÙ - The Hill,2024-03-29,https://thehill.com/homenews/campaign/4563403-axelrod-obama-trump-biden-race-tag-team-match/,positive,0.05,
7,Carville: RFK Jr. might hurt Trump more than Biden - The Hill,2024-03-29,https://thehill.com/homenews/campaign/4563324-carville-rfk-jr-might-hurt-trump-more-than-biden/,negative,-0.052,
7,Analysis: Supreme Court's far right could grow if Trump wins - Los Angeles Times,2024-03-29,https://www.latimes.com/politics/story/2024-03-29/supreme-court-far-right-wing-could-grow-if-trump-becomes-president-again,positive,0.151,
7,"Biden poised to raise $25 million at fundraiser with Obama, Clinton - The Washington Post",2024-03-29,https://www.washingtonpost.com/elections/2024/03/28/election-2024-campaign-updates/,positive,0.029,
11,Trader Joe's Mini Tote Craze Underscores The Rise Of 'Meme Products' - Forbes,2024-03-29,https://www.forbes.com/sites/marcuscollins/2024/03/29/trader-joes-mini-tote-craze-underscores-the-rise-of-meme-products/,positive,0.142,
7,Ben Carson is the right choice for GOP vice president | GUEST COMMENTARY - Baltimore Sun,2024-03-29,https://www.baltimoresun.com/2024/03/29/ben-carson-is-the-right-choice-for-gop-v-p-guest-commentary/,positive,0.149,
1,What Can We Learn From History About Timing Of Future Fed Rate Cuts - Forbes,2024-03-29,https://www.forbes.com/sites/paulweinstein/2024/03/29/what-can-we-learn-from-history-about-timing-of-future-fed-rate-cuts/,negative,-0.042,
1,Sungrow Powers Its Way into the Prestigious 2024 Fortune Asia Future 30 ÇƒÏ Company Announcement - FT.com - Financial Times,2024-03-29,https://markets.ft.com/data/announce/full?dockey=600-202403290534PR_NEWS_USPRX____CN74591-1,positive,0.179,
6,Infographic: OPEC+ mulls 2024 output policy amid geopolitical tensions - S&P Global,2024-03-28,https://www.spglobal.com/commodityinsights/en/market-insights/latest-news/oil/112223-infographic-opec-2024-output-policy-geopolitical-tensions-crude-sanctions-prices-russia-ukraine-africa-oil-market,positive,0.239,
7,GOP scrambles to organize early and mail voting despite Trump's attacks - The Washington Post,2024-03-28,https://www.washingtonpost.com/elections/2024/03/28/trump-mail-early-voting-republicans/,positive,0.09,
7,Transcript: Election 2024: The Post Political Roundtable - The Washington Post - The Washington Post,2024-03-28,https://www.washingtonpost.com/washington-post-live/2024/03/28/transcript-election-2024-post-political-roundtable/,positive,0.099,
7,"Trump can't match Biden's 2024 fundraising, Republican's campaign says - Reuters",2024-03-28,https://www.reuters.com/world/us/trump-cant-match-bidens-2024-fundraising-republicans-campaign-says-2024-03-28/,neutral,0.0,
7,Chris Christie turns down No Labels presidential bid after discussions - The Washington Post,2024-03-28,https://www.washingtonpost.com/politics/2024/03/27/chris-christie-no-labels-president/,positive,0.096,
7,"Election 2024: The Post's Political Roundtable with Paul Kane, Hannah Knowles and Brianna Tucker - The Washington Post",2024-03-28,https://www.washingtonpost.com/washington-post-live/2024/03/28/election-2024-posts-political-roundtable-with-paul-kane-hannah-knowles-brianna-tucker/,positive,0.108,
13,Who Pays The Bill When Medical Artificial Intelligence Harms Patients? - Forbes,2024-03-28,https://www.forbes.com/sites/paulhsieh/2024/03/28/who-pays-the-bill-when-medical-artificial-intelligence-harms-patients/,positive,0.282,
1,How BaltimoreÇƒÙs Key Bridge collapse will affect supply chains and the economy - PBS NewsHour,2024-03-28,https://www.pbs.org/newshour/nation/how-baltimores-key-bridge-collapse-will-affect-supply-chains-and-the-economy,negative,-0.11,
1,Official data confirms UK economy slipped into recession last year - Financial Times,2024-03-28,https://www.ft.com/content/f244e2af-c0aa-469e-a0c4-dab4da7a3ca7,neutral,1.0,
13,"AI fails to detect depression signs in social media posts by Black Americans, study finds - Reuters",2024-03-28,https://www.reuters.com/business/healthcare-pharmaceuticals/ai-fails-detect-depression-signs-social-media-posts-by-black-americans-study-2024-03-28/,neutral,0.0,
13,"US requiring new AI safeguards for government use, transparency - Reuters",2024-03-28,https://www.reuters.com/technology/us-requiring-new-ai-safeguards-government-use-transparency-2024-03-28/,neutral,0.0,
13,How to define artificial general intelligence - The Economist,2024-03-28,https://www.economist.com/the-economist-explains/2024/03/28/how-to-define-artificial-general-intelligence,positive,0.114,
13,Scientists harness power of artificial intelligence to battle wildfires - PBS NewsHour,2024-03-28,https://www.pbs.org/newshour/show/scientists-harness-power-of-artificial-intelligence-to-battle-wildfires,positive,0.143,
7,Biden's campaign war chest exceeds Trump's before major fundraising event - Reuters,2024-03-28,https://www.reuters.com/world/us/bidens-campaign-war-chest-exceeds-trumps-before-major-fundraising-event-2024-03-28/,neutral,0.0,
13,AI advertising start-up valued at $4bn after fundraising - Financial Times,2024-03-28,https://www.ft.com/content/4c7bee10-51d3-489b-873a-765157af8aac,neutral,1.0,
13,US Treasury Urges Financial Sector to Address AI Cybersecurity Threats - Infosecurity Magazine,2024-03-28,https://www.infosecurity-magazine.com/news/us-treasury-financial-ai/,positive,0.111,
5,"Baltimore bridge collapse to cause logistics headaches, not supply chain crisis - Reuters",2024-03-27,https://www.reuters.com/world/us/baltimore-bridge-port-blockade-wont-trigger-new-supply-chain-crisis-experts-say-2024-03-27/,neutral,0.0,
7,The 2024 Swing States: North Carolina Could Sway the 2024 Election | America 2024 | U.S. News - U.S. News & World Report,2024-03-27,https://www.usnews.com/news/elections/articles/the-2024-swing-states-north-carolina-could-sway-the-2024-election,positive,0.029,
7,Why the 2024 election is about far more than TrumpÇƒÙs legal nightmare - CNN,2024-03-27,https://www.cnn.com/2024/03/26/politics/abortion-2024-campaign-biden-trump-kennedy/index.html,positive,0.132,
11,"Inflation is bananas: after 20 years, Trader JoeÇƒÙs raises the fruitÇƒÙs price by four cents - The Guardian",2024-03-27,https://www.theguardian.com/food/2024/mar/27/trader-joes-raises-banana-price,positive,0.139,
11,Trump's media company valued at almost $8 bln in strong Wall St debut - Reuters,2024-03-27,https://www.reuters.com/markets/us/trumps-media-company-shares-jump-ahead-backdoor-nasdaq-debut-2024-03-26/,neutral,0.0,
13,U.S. Military Spending on AI Surges | TIME - TIME,2024-03-27,https://time.com/6961317/ai-artificial-intelligence-us-military-spending/,negative,-0.063,
13,7 Top AI Stocks: March 2024 - NerdWallet,2024-03-27,https://www.nerdwallet.com/article/investing/ai-stocks-invest-in-artificial-intelligence,positive,0.063,
7,RFK Jr. supporters were asked who theyÇƒÙd vote for if he was not running. Hear their responses - CNN,2024-03-27,https://www.cnn.com/videos/politics/2024/03/27/support-robert-kennedy-jr-president-voters-tuchman-ac360-vpx.cnn,neutral,1.0,
7,Election 2024 Poll: Biden Gains On Trump in Six Swing States - Bloomberg,2024-03-26,https://www.bloomberg.com/news/articles/2024-03-26/election-2024-poll-biden-gains-on-trump-in-six-swing-states,positive,0.069,
5,Auto Supply Chains Face Delays From Baltimore Bridge Collapse - Bloomberg,2024-03-26,https://www.bloomberg.com/news/articles/2024-03-26/auto-supply-chains-face-delays-from-baltimore-bridge-collapse,negative,-0.037,
