EMERGING_RISK_ID,TITLE,PUBLISHED_DATE,LINK,SENTIMENT,POLARITY,LAST_RUN_TIMESTAMP
2,Investment News: Regulator Threatens Jail For 'Finfluencers' Who Flout Ad Rules - Forbes,2024-03-26,https://www.forbes.com/uk/advisor/investing/2024/03/26/investment-market-updates/,positive,0.177,
11,TrumpÇƒÙs Truth Social is now a public company. Experts warn its multibillion-dollar valuation defies logic - CNN,2024-03-26,https://www.cnn.com/2024/03/26/markets/trump-media-stock-truth-social/index.html,positive,0.201,
11,News updates from March 26: Baltimore road bridge collapses; Trump's social media business soars in market debut - Financial Times,2024-03-26,https://www.ft.com/content/96e5dd7e-3ac2-4e48-8200-378e819eb52b,neutral,1.0,
11,Retail Investors Throw a Meme Stock Party In Face of High Rates - BNN Bloomberg,2024-03-26,https://www.bnnbloomberg.ca/retail-investors-throw-a-meme-stock-party-in-face-of-high-rates-1.2051929,positive,0.09,
11,"FTSE 100 Live: What's Moving UK Stocks (Ocado, Fevertree), Pound (GBP/USD) - Bloomberg",2024-03-26,https://www.bloomberg.com/news/live-blog/2024-03-26/ftse-100-what-s-moving-uk-markets-right-now-markets-today,positive,0.155,
13,"Hire factcheckers to fight election fake news, EU tells tech firms - The Guardian",2024-03-26,https://www.theguardian.com/media/2024/mar/26/tech-firms-poised-to-mass-hire-factcheckers-before-eu-elections,negative,-0.059,
13,Financial services counting on AI for a productivity boost - Financial Times,2024-03-26,https://www.ft.com/content/9ffe888e-2f78-4f59-9536-2e31f5bde8b7,positive,0.113,
13,"AI is accelerating the energy transition, say industry leaders - Financial Times",2024-03-26,https://www.ft.com/content/07671f2e-d7b4-4f94-836c-eb0be9f6b605,positive,0.284,
6,"Oil prices end higher, buoyed by geopolitical tensions, RussiaÇƒÙs output cuts - MarketWatch",2024-03-25,https://www.marketwatch.com/story/oil-prices-buoyed-by-geopolitical-tensions-45179e0b,neutral,0.0,
6,"Oil settles higher as Russia orders output cuts, geopolitical tensions persist - Reuters",2024-03-25,https://www.reuters.com/markets/commodities/oil-rises-heightened-geopolitical-risks-exacerbate-supply-concerns-2024-03-25/,neutral,0.0,
7,Christian TV evangelicals fire up Trump support with messianic message - Reuters,2024-03-22,https://www.reuters.com/world/us/god-gave-us-trump-christian-media-evangelicals-preach-messianic-message-2024-03-22/,neutral,0.0,
13,UN adopts first global artificial intelligence resolution - Reuters,2024-03-22,https://www.reuters.com/technology/cybersecurity/un-adopts-first-global-artificial-intelligence-resolution-2024-03-21/,neutral,0.0,
13,Baidu Global MediaGo Wins 2024 Artificial Intelligence Excellence Award - PR Newswire,2024-03-22,https://www.prnewswire.com/news-releases/baidu-global-mediago-wins-2024-artificial-intelligence-excellence-award-302096901.html,positive,0.329,
7,2024 Presidential Election: Crypto Voters Lack Washington's Attention - Bloomberg,2024-03-22,https://www.bloomberg.com/news/newsletters/2024-03-22/2024-presidential-election-crypto-voters-lack-washington-s-attention,positive,0.189,
7,"Fed needs to run U.S. economy hot into Nov. 5 presidential election, trader says - MarketWatch",2024-03-22,https://www.marketwatch.com/livecoverage/stock-market-today-dow-futures-point-to-extension-of-record-setting-run/card/fed-needs-to-run-u-s-economy-hot-into-nov-5-presidential-election-trader-says-jUoFu24z6Ch1DbkAjrhP?mod=home-page,neutral,0.0,
7,CNN polls take votersÇƒÙ pulse in two states that flipped blue in 2020 - CNN,2024-03-22,https://www.cnn.com/2024/03/22/politics/cnn-poll-michigan-pennsylvania/index.html,positive,0.071,
7,"Majorities in Michigan, Pennsylvania dissatisfied with choices in presidential race: Polling - The Hill",2024-03-22,https://thehill.com/homenews/campaign/4549296-majorities-michigan-pennsylvania-dissatisfied-presidential-candidates-polling/,positive,0.083,
7,Biden wrapping up Western swing after Houston fundraising stop - The Washington Post,2024-03-22,https://www.washingtonpost.com/elections/2024/03/21/election-2024-campaign-updates/,positive,0.029,
7,"Column: Biden's big speech didn't move the needle, nor have rising wages. But these 3 things might - Los Angeles Times",2024-03-22,https://www.latimes.com/politics/story/2024-03-22/bidens-big-speech-didnt-move-the-needle-will-anything,positive,0.148,
13,Tennessee Governor signs bill that protects musicians against artificial intelligence - The Hill,2024-03-22,https://thehill.com/homenews/state-watch/4548858-tennessee-governor-signs-bill-that-protects-musicians-against-artificial-intelligence/,positive,0.189,
7,"Joint committee allows Trump to raise money for legal bills, huge checks for RNC - The Washington Post",2024-03-22,https://www.washingtonpost.com/politics/2024/03/21/trump-joint-fundraising-committee-rnc/,positive,0.029,
13,Artificial intelligence (AI) | Technology - The Guardian,2024-03-22,https://www.theguardian.com/technology/artificialintelligenceai/2024/mar/22/all,negative,-0.212,
13,"Opinion: AI is turbocharging disinformation attacks on voters, especially in communities of color - Los Angeles Times",2024-03-22,https://www.latimes.com/opinion/story/2024-03-22/artificial-intelligence-disinformation-election-voting,negative,-0.078,
16,"Declining fertility rates will transform global economy, report says - Financial Times",2024-03-21,https://www.ft.com/content/318ff981-d189-4bd6-b608-a9709097eedc,neutral,1.0,
1,"Euro zone business activity close to stabilising in March, PMI survey shows - Reuters",2024-03-21,https://www.reuters.com/markets/europe/euro-zone-business-activity-close-stabilising-march-pmi-2024-03-21/,positive,0.074,
13,University of South Florida to launch artificial intelligence college - Axios,2024-03-21,https://www.axios.com/local/tampa-bay/2024/03/21/university-of-south-florida-ai-college-artificial-intelligence,positive,0.167,
13,"The UN adopts a resolution backing efforts to ensure artificial intelligence is ÇƒÚsafe, secure and trustworthyÇƒÙ - PBS NewsHour",2024-03-21,https://www.pbs.org/newshour/politics/the-un-adopts-a-resolution-backing-efforts-to-ensure-artificial-intelligence-is-safe-secure-and-trustworthy,positive,0.261,
2,Bril Finance Pioneers New Epoch Of Yield Optimization In Web3 - Forbes,2024-03-21,https://www.forbes.com/sites/zengernews/2024/03/21/bril-finance-pioneers-new-epoch-of-yield-optimization-in-web3/,positive,0.261,
11,Reddit shares end trading up 48% in market debut - Reuters,2024-03-21,https://www.reuters.com/markets/deals/reddit-set-hotly-anticipated-debut-after-pricing-ipo-top-range-2024-03-21/,neutral,0.0,
13,"10% of US workers are in jobs most exposed to artificial intelligence, White House says - CNN",2024-03-21,https://www.cnn.com/2024/03/21/business/ai-jobs-white-house-work-force/index.html,negative,-0.057,
7,Betting markets put BidenÇƒÙs chance of re-election at highest level in 10 months - MarketWatch,2024-03-21,https://www.marketwatch.com/story/betting-markets-put-bidens-chance-of-re-election-at-highest-level-in-10-months-f875bdfd,neutral,0.0,
7,Senegal holds presidential election as anger at delay boosts opposition - Reuters,2024-03-21,https://www.reuters.com/world/africa/senegal-holds-presidential-election-anger-delay-boosts-opposition-2024-03-21/,neutral,0.0,
7,Trump Badly Trails Biden in 2024 Campaign Fundraising - Bloomberg,2024-03-21,https://www.bloomberg.com/news/articles/2024-03-21/cash-strapped-trump-badly-trails-biden-in-2024-money-race,negative,-0.086,
7,The Plan to Save Joe Biden's Campaign | TIME - TIME,2024-03-21,https://time.com/6958784/biden-campaign-strategy-problems-2024/,negative,-0.112,
13,Rival nations seek to poach top UK and European AI start-ups - Financial Times,2024-03-20,https://www.ft.com/content/095184c2-45fe-47f5-9449-19223e3c1e03,neutral,1.0,
16,"Global fertility rates to plunge in decades ahead, new report says - CNN",2024-03-20,https://www.cnn.com/2024/03/20/health/global-fertility-rates-lancet-study/index.html,positive,0.077,
1,"The US economy is nowhere near a recession, Goldman SachsÇƒÙ top economist says - CNN",2024-03-20,https://www.cnn.com/2024/03/20/business/recession-fed-economy-goldman-sachs/index.html,negative,-0.095,
14,"Fall Protection Market size to grow by USD 3.02 billion from 2022 to 2027, market is fragmented due to the presence of ... - PR Newswire",2024-03-20,https://www.prnewswire.com/news-releases/fall-protection-market-size-to-grow-by-usd-3-02-billion-from-2022-to-2027--market-is-fragmented-due-to-the-presence-of-prominent-companies-like-3m-co-abs-safety-gmbh-and-adolf-wurth-gmbh-and-co-kg--many-more-302093522.html,positive,0.062,
7,Trump v Biden: who's ahead in the latest polls? - The Economist,2024-03-20,https://www.economist.com/interactive/us-2024-election,neutral,0.0,
6,US government warns water services are being targeted in cyberattacks - TechRadar,2024-03-20,https://www.techradar.com/pro/us-government-warns-water-services-are-being-targeted-in-cyberattacks,negative,-0.125,
7,The 2024 Swing States: Arizona Could Sway the 2024 Election | Elections | U.S. News - U.S. News & World Report,2024-03-20,https://www.usnews.com/news/elections/articles/the-2024-swing-states-arizona-could-sway-the-2024-election,positive,0.104,
7,Slovak PM Fico looms large in presidential election - Reuters,2024-03-20,https://www.reuters.com/world/europe/slovak-pm-fico-looms-large-presidential-election-2024-03-20/,neutral,0.0,
7,Nine US House of Representatives races to watch in 2024 - Reuters,2024-03-20,https://www.reuters.com/world/us/us-elections-2024-seven-house-representatives-races-watch-2024-01-05/,neutral,0.0,
5,Building a more reliable supply chain - MIT Technology Review,2024-03-20,https://www.technologyreview.com/2024/03/20/1089970/building-a-more-reliable-supply-chain/,positive,0.054,
13,7 Top AI Stocks: March 2024 - NerdWallet,2024-03-20,https://www.nerdwallet.com/article/investing/ai-stocks-invest-in-artificial-intelligence,positive,0.081,
3,How to Invest in Japan After BOJ Ends World's Last Negative Rates - Bloomberg,2024-03-19,https://www.bloomberg.com/news/articles/2024-03-18/how-to-invest-in-japan-which-etfs-to-buy-for-japan-stock-market,positive,0.141,
16,Marriages Tick Up in Asia but Long-Term Demographic Challenges Persist - TIME,2024-03-19,https://time.com/6958285/china-south-korea-marriage-statistics-trend-increase/,positive,0.043,
1,HereÇƒÙs why high interest rates havenÇƒÙt caused a US recession - CNN,2024-03-19,https://www.cnn.com/2024/03/19/economy/interest-rates-us-recession-fed/index.html,positive,0.126,
2,Banks are in limbo without a crucial lifeline. Here's where cracks may appear next - CNBC,2024-03-19,https://www.cnbc.com/2024/03/19/where-cracks-in-the-banking-sector-may-appear-without-more-ma.html,positive,0.079,
7,The 2024 Swing States: Nevada Could Sway the 2024 Election | Elections | U.S. News - U.S. News & World Report,2024-03-19,https://www.usnews.com/news/elections/articles/the-2024-swing-states-nevada-could-sway-the-presidential-election,positive,0.2,
2,Investment News: Robinhood Throws Down Gauntlet To Share-Trading Platforms - Forbes,2024-03-19,https://www.forbes.com/uk/advisor/investing/2024/03/19/investment-market-updates/,positive,0.177,
7,US 2024 election: The 10 books to read ahead of the ballot in November - Financial Times,2024-03-19,https://www.ft.com/content/9a9b50db-5595-438c-ad41-a43693c53504,neutral,1.0,
5,"Food Prices: As Dining Out Costs Climb, It May Pay to Eat In - NerdWallet",2024-03-19,https://www.nerdwallet.com/article/finance/price-of-food,positive,0.05,
13,Blue Hat Interactive Entertainment Technology Announces Corporate Refocus into AI Financial Services - PR Newswire,2024-03-19,https://www.prnewswire.com/news-releases/blue-hat-interactive-entertainment-technology-announces-corporate-refocus-into-ai-financial-services-302092668.html,positive,0.157,
13,Banking on AI: How financial institutions are deploying new tech - American Banker,2024-03-19,https://www.americanbanker.com/creditunions/list/banking-on-ai-how-financial-institutions-are-deploying-new-tech,positive,0.125,
13,Invesco wants to use generative AI to cut costs but not yet pick stocks - Financial Times,2024-03-19,https://www.ft.com/content/5ad52c6c-a76e-485f-b721-6cffc4f50008,neutral,1.0,
13,US Supreme Court seems wary of curbing US government contacts with social media platforms - Reuters,2024-03-18,https://www.reuters.com/world/us/supreme-court-scrutinizes-us-government-contacts-with-social-media-platforms-2024-03-18/,neutral,0.0,
11,Slorg Is Sorry Slerf Was Burnt - Bloomberg,2024-03-18,https://www.bloomberg.com/opinion/articles/2024-03-18/slorg-is-sorry-he-burnt-slerf,negative,-0.065,
7,Musk says he may endorse a candidate ÇƒÚin final stretchÇƒÙ of 2024 - The Hill,2024-03-18,https://thehill.com/homenews/media/4539517-elon-musk-2024-election-may-endorse-candidate-final-stretch/,positive,0.095,
13,A third of banks ban employees from using gen AI. Here's why. - American Banker,2024-03-18,https://www.americanbanker.com/news/a-third-of-banks-ban-employees-from-using-gen-ai-heres-why,negative,-0.087,
13,"Payments and Financial Services AI Market: 2024 Trends, Innovations and Global Forecast to 2031, Featuring Amazon ... - PR Newswire",2024-03-18,https://www.prnewswire.com/news-releases/payments-and-financial-services-ai-market-2024-trends-innovations-and-global-forecast-to-2031-featuring-amazon-block-euronet-fis-paypal-remitly-shopify-square-stripe-visa-and-western-union-302091206.html,positive,0.077,
7,Russia's 2024 Presidential Election: What to Know - The New York Times,2024-03-14,https://www.nytimes.com/2024/03/14/world/europe/russia-election-explained.html,negative,-0.15,
7,Putin set to sweep to fifth term as Russians head to polls - CNN,2024-03-14,https://www.cnn.com/2024/03/14/europe/polls-open-russia-presidential-election-putin-intl/index.html,positive,0.153,
5,Oracle Helps Organizations Build Smart and Efficient Operations ÇƒÏ Company Announcement - FT.com - Financial Times,2024-03-14,https://markets.ft.com/data/announce/full?dockey=600-202403140400PR_NEWS_USPRX____SF60942-1,positive,0.214,
7,"Biden has a marginal 1 point lead over Trump, Reuters/Ipsos poll shows - Reuters",2024-03-14,https://www.reuters.com/world/us/biden-has-marginal-1-point-lead-over-trump-reutersipsos-poll-shows-2024-03-14/,neutral,0.0,
13,3 Millionaire-Maker Artificial Intelligence (AI) Stocks - The Motley Fool,2024-03-14,https://www.fool.com/investing/2024/03/14/3-millionaire-artificial-intelligence-ai-stocks/,positive,0.176,
2,Financials Sector & Industry Performance - Bloomberg,2024-03-14,https://www.bloomberg.com/markets/sectors/financials,positive,0.066,
7,"Trump, Biden quickly clinch nominations for first presidential rematch since '56 - Axios",2024-03-14,https://www.axios.com/2024/03/13/trump-biden-nominations-election-rematch-history,neutral,0.0,
13,The Impact of Artificial Intelligence in Fintech - Fintech Finance,2024-03-14,https://ffnews.com/thought-leader/the-impact-of-artificial-intelligence-in-fintech/,positive,0.194,
13,Forbes Daily: How European Union's AI Act Aims To Regulate The Technology - Forbes,2024-03-14,https://www.forbes.com/sites/forbesdaily/2024/03/14/forbes-daily-how-european-unions-ai-act-aims-to-regulate-the-technology/,positive,0.062,
13,What will the EUÇƒÙs proposed act to regulate AI mean for consumers? - The Guardian,2024-03-14,https://www.theguardian.com/technology/2024/mar/14/what-will-eu-proposed-regulation-ai-mean-consumers,positive,0.056,
7,Why does Putin always win? What to know about Russia's pseudo election. - The Washington Post,2024-03-14,https://www.washingtonpost.com/world/2024/03/14/vladimir-putin-russia-presidential-election/,neutral,0.864,
7,"US ban of TikTok would rob Biden, Democrats of 2024 election tool - Reuters",2024-03-14,https://www.reuters.com/world/us/us-ban-tiktok-would-rob-biden-democrats-2024-election-tool-2024-03-14/,neutral,0.0,
7,Russians abroad have no faith in this presidential election ÇƒÏ and are divided on what they can do about it - CNN,2024-03-14,https://www.cnn.com/2024/03/13/europe/russian-election-overseas-voters-intl/index.html,negative,-0.084,
13,"This Artificial Intelligence (AI) ""Magnificent Seven"" Stock Could be a Once-in-a-Generation Investment Opportunity ... - The Motley Fool",2024-03-14,https://www.fool.com/investing/2024/03/14/this-artificial-intelligence-ai-magnificent-seven/,positive,0.208,
5,Supply Chain Latest: Red Sea Shipping Disruptions - Bloomberg,2024-03-14,https://www.bloomberg.com/news/newsletters/2024-03-14/supply-chain-latest-red-sea-shipping-disruptions,positive,0.041,
7,Putin is coasting towards another term in power. HereÇƒÙs what you need to know about RussiaÇƒÙs presidential election - CNN,2024-03-14,https://www.cnn.com/2024/03/14/europe/putin-russia-election-explainer-update-intl/index.html,positive,0.071,
7,"Trump, Biden clinch presidential nominations - The Washington Post",2024-03-14,https://www.washingtonpost.com/elections/2024/03/13/election-2024-campaign-updates/,positive,0.029,
7,Election Updates: Biden campaigns in Wisconsin after he and Trump clinch nominations. - The New York Times,2024-03-14,https://www.nytimes.com/live/2024/03/13/us/2024-election-trump-biden,positive,0.099,
7,"Trump ""floods the zone"" as general election tests desensitized voters - Axios",2024-03-14,https://www.axios.com/2024/03/13/trump-election-rhetoric-numb,neutral,0.0,
13,"Forget Nvidia: 2 Artificial Intelligence (AI) Stocks With More Upside to Buy Now, According to Wall Street - The Motley Fool",2024-03-14,https://www.fool.com/investing/2024/03/14/forget-nvidia-2-ai-stocks-more-upside-to-buy-now/,positive,0.225,
7,Slovakia Presidential Election 2024: What You Need to Know - The New York Times,2024-03-14,https://www.nytimes.com/2024/03/14/world/europe/slovakia-presidential-election-2024.html,negative,-0.126,
13,Prediction: 1 Artificial Intelligence (AI) Stock Destined for a Stock-Split in 2024 - The Motley Fool,2024-03-14,https://www.fool.com/investing/2024/03/14/prediction-1-ai-stock-destined-a-stock-split-2024/,positive,0.143,
7,Biden vs. Trump Is the Race Voters Want - POLITICO,2024-03-14,https://www.politico.com/news/magazine/2024/03/14/voters-want-biden-trump-election-rematch-00146795,neutral,0.0,
7,Florida Playbook - POLITICO - POLITICO,2024-03-14,https://www.politico.com/newsletters/floridaplaybook,neutral,0.0,
7,Election 2024 latest news: Biden to campaign in Michigan in latest visit to battleground state - The Washington Post,2024-03-14,https://www.washingtonpost.com/elections/2024/03/14/election-2024-campaign-updates/,positive,0.029,
3,Memecoin Trading at Levels Last Seen Before Crypto Bubble Burst - Bloomberg,2024-03-13,https://www.bloomberg.com/news/articles/2024-03-13/memecoin-trading-volume-rises-to-levels-last-seen-before-crypto-bubble-burst,positive,0.066,
3,Meme Coin Rise Historical Data Reignites Fears of Crypto Bubble Burst - CryptoDaily,2024-03-13,https://cryptodaily.co.uk/news-in-crypto/coingape:meme-coin-rise-historical-data-reignites-fears-of-crypto-bubble-burst,negative,-0.073,
16,Can Global Population Aging Spark New Partnership Models? - Forbes,2024-03-13,https://www.forbes.com/sites/sophieokolo/2024/03/13/can-global-population-aging-spark-new-partnership-models/,positive,0.092,
16,Middle East and Africa Cosmeceuticals Research Report 2023-2033: Demographic shift in aging registered reps (and investment advisors) and Youthful Population ... - PR Newswire,2024-03-13,https://www.prnewswire.com/news-releases/middle-east-and-africa-cosmeceuticals-research-report-2023-2033-demographic-shift-and-youthful-population-propel-demand-social-media-and-beauty-trends-influence-surge-302088022.html,positive,0.113,
1,Supreme Court urges Center to bailout Kerala amid financial crisis - The Economic Times,2024-03-13,https://m.economictimes.com/news/india/sc-urges-center-to-provide-one-time-bailout-package-to-kerala-to-navigate-financial-crisis/articleshow/108455950.cms,negative,-0.122,
1,Nigeria hit by wave of food looting as economic crisis deepens - Financial Times,2024-03-13,https://www.ft.com/content/8a69bc80-fa5a-4beb-8989-fbd04d2330ac,neutral,1.0,
1,Hopes of UK exit from recession boosted as GDP rises in January - The Guardian,2024-03-13,https://www.theguardian.com/business/2024/mar/13/hopes-of-economic-recovery-boosted-as-uk-gdp-rises-by-02-in-january,positive,0.114,
13,"AI Isn't Our Election Safety Problem, Disinformation Is - TIME",2024-03-13,https://time.com/6914961/ai-2024-election-disinformation/,positive,0.182,
13,Google restricts AI chatbot Gemini from answering queries on global elections - The Economic Times,2024-03-13,https://m.economictimes.com/tech/technology/google-restricts-ai-chatbot-gemini-from-answering-queries-on-global-elections/articleshow/108449797.cms,positive,0.247,
7,The voting bloc that could decide the US election: Swifties - The Guardian,2024-03-13,https://www.theguardian.com/music/2024/mar/13/taylor-swift-us-election-politics-joe-biden-donald-trump,positive,0.135,
7,RFK Jr. to pick running mate for 2024 election on March 26 - Reuters,2024-03-13,https://www.reuters.com/world/us/rfk-jr-pick-running-mate-2024-election-march-26-2024-03-13/,positive,0.04,
13,Europe one step away from landmark AI rules after lawmakers' vote - Reuters,2024-03-13,https://www.reuters.com/technology/eu-lawmakers-endorse-political-deal-artificial-intelligence-rules-2024-03-13/,neutral,0.0,
7,"Biden, Trump clinch nominations, kicking off bruising presidential rematch - Reuters",2024-03-13,https://www.reuters.com/world/us/biden-trump-poised-clinch-nominations-set-up-bruising-presidential-rematch-2024-03-12/,neutral,0.0,
9,Why Antitrust Regulators Are Focused On Problematic AI Algorithms - Forbes,2024-03-13,https://markets.ft.com/data/announce/detail?dockey=600-202403111605PR_NEWS_USPRX____NE57845-1,neutral,1.0,
7,Biden clinches Democratic nomination for Trump rematch in 2024 election - Axios,2024-03-13,https://www.axios.com/2024/03/12/biden-democrat-nomination-2024-trump-presidential,neutral,0.0,
2,Will the Bitcoin halving bring more institutional investors into crypto? - Cointelegraph,2024-03-13,https://cointelegraph.com/news/bitcoin-halving-institutional-investors-crypto-adoption,negative,-0.067,
7,"Biden and Trump clinch nominations, heading to another general election rematch - CNN",2024-03-13,https://www.cnn.com/2024/03/12/politics/biden-trump-presidential-nominees/index.html,positive,0.155,
7,The 2024 Swing States: Wisconsin Could Sway the Presidential Election | Elections | U.S. News - U.S. News & World Report,2024-03-13,https://www.usnews.com/news/elections/articles/the-2024-swing-states-wisconsin-could-sway-the-presidential-election,positive,0.093,
13,Analysis | Trump demonstrates why 'Artificial Intelligence' will be so useful to him - The Washington Post,2024-03-13,https://www.washingtonpost.com/politics/2024/03/13/trump-video-ai-truth-social/,positive,0.149,
7,These Are The Six Swing States Trump Needs To Take From Biden To Win In November - Forbes,2024-03-13,https://www.forbes.com/sites/saradorn/2024/03/13/these-are-the-six-swing-states-trump-needs-to-take-from-biden-to-win-in-november/,negative,-0.109,
7,The 2024 election becomes a 2-man race as Trump and Biden prepare for a rematch - PBS NewsHour,2024-03-13,https://www.pbs.org/newshour/show/the-2024-election-becomes-a-2-man-race-as-trump-and-biden-prepare-for-a-rematch,positive,0.069,
7,Georgia Republican presidential primary election results 2024 live updates - The Washington Post,2024-03-13,https://www.washingtonpost.com/elections/results/2024/03/12/georgia-president-republican-primary/,positive,0.138,
13,Paul Weiss' Digital Tech Chair On AI's Promises And Perils - Law360,2024-03-12,https://www.law360.com/pulse/dc-pulse/articles/1805890/paul-weiss-digital-tech-chair-on-ai-s-promises-and-perils,positive,0.09,
2,SwedenÇƒÙs Central Bank Chief Wants 'as Little Bitcoin as Possible' in Country's Financial System: Bloomberg - CoinDesk,2024-03-12,https://www.coindesk.com/policy/2024/03/12/swedens-central-bank-chief-wants-as-little-bitcoin-as-possible-in-countrys-financial-system-bloomberg/amp/,positive,0.06,
7,Russian election 2024: List of candidates and barred Putin challengers - Reuters,2024-03-12,https://www.reuters.com/world/europe/who-is-off-ballot-russias-presidential-election-2024-03-11/,neutral,0.0,
7,Super Tuesday 2024 results by state - The Washington Post,2024-03-12,https://www.washingtonpost.com/elections/results/2024/03/05/super-tuesday/,negative,-0.046,
7,Who Are the 2024 Presidential Election Candidates? - The New York Times,2024-03-12,https://www.nytimes.com/interactive/2023/us/politics/presidential-candidates-2024.html,neutral,0.0,
7,Biden visits N.H. in latest trip to battleground state - The Washington Post,2024-03-12,https://www.washingtonpost.com/elections/2024/03/11/live-2024-election-campaign/,positive,0.029,
7,Aaron Rodgers and Jesse Ventura Top R.F.K. Jr.'s List for Running Mate - The New York Times,2024-03-12,https://www.nytimes.com/2024/03/12/us/politics/rfk-jr-aaron-rodgers-jesse-ventura.html,positive,0.042,
6,LKQ Corporation: Potential Double-Digit Upside Amidst Geopolitical And Social Tensions - Seeking Alpha,2024-03-12,https://seekingalpha.com/article/4677737-lkq-corporation-potential-double-digit-upside-amidst-geopolitical-and-social-tensions,neutral,0.0,
2,Investment News: British ISA Falls Flat As Providers Question Need For New Account - Forbes,2024-03-11,https://www.forbes.com/uk/advisor/investing/2024/03/11/investment-market-updates/,positive,0.187,
13,The Next Phase Of The Bull Market: 5 Stocks For 2024 & Beyond - Forbes,2024-03-06,https://www.forbes.com/sites/kenberman/2024/03/05/the-next-phase-of-the-bull-market-5-stocks-for-2024--beyond/,positive,0.127,
