EMERGING_RISK_ID,TITLE,PUBLISHED_DATE,LINK,SENTIMENT,POLARITY,LAST_RUN_TIMESTAMP
11,Inside This New Zealand Winemaker's Collaboration With Sarah Jessica Parker,2024-08-03,https://www.forbes.com/sites/rachelking/2024/08/03/inside-this-new-zealand-winemakers-collaboration-with-sarah-jessica-parker/,positive,0.057,
10,How one Chinese machine tool maker is helping Russia‚Äôs war against Ukraine - The Washington Post,2024-07-26,https://www.washingtonpost.com/world/2024/07/26/russia-china-military-drones-ukraine-war/,positive,0.111,
13,How Visa employed artificial intelligence to check $40 billion in fraud as scammers also take to AI - CNBC,2024-07-26,https://www.cnbc.com/2024/07/26/ai-and-machine-learning-helped-visa-combat-40-billion-in-fraud-activity.html,negative,-0.117,
13,Why Zuckerberg‚Äôs multibillion-dollar gamble doesn‚Äôt just matter to Meta - The Guardian,2024-07-26,https://www.theguardian.com/technology/article/2024/jul/26/why-zuckerbergs-multi-billion-dollar-gamble-doesnt-just-matter-to-meta,positive,0.112,
7,Live updates: Kamala Harris kicks off 2024 election campaign - CNN,2024-07-26,https://www.cnn.com/politics/live-news/kamala-harris-trump-election-07-26-24/index.html,positive,0.042,
23,Ferrari Narrowly Dodges Deepfake Scam Simulating Deal-Hungry CEO - Bloomberg,2024-07-26,https://www.bloomberg.com/news/articles/2024-07-26/ferrari-narrowly-dodges-deepfake-scam-simulating-deal-hungry-ceo,neutral,1.0,
7,"July 25, 2024, presidential campaign news - CNN",2024-07-26,https://www.cnn.com/politics/live-news/harris-trump-election-07-25-24/index.html,negative,-0.05,
7,How Kamala Harris‚Äô warp-speed campaign launch has changed the 2024 race - CNN,2024-07-26,https://www.cnn.com/2024/07/26/politics/kamala-harris-election-campaign/index.html,positive,0.098,
13,"5 things to know for July 26: Olympics, Presidential debate, Cartel leaders, Homeless encampments, Artificial intelligence - CNN",2024-07-26,https://www.cnn.com/2024/07/26/us/5-things-to-know-for-july-26-olympics-presidential-debate-cartel-leaders-homeless-encampments-artificial-intelligence/index.html,positive,0.024,
13,Artificial intelligence (AI) - The Guardian,2024-07-26,https://www.theguardian.com/technology/artificialintelligenceai,negative,-0.149,
7,"Venezuela‚Äôs Maduro bids for a third term in power ‚Äî as U.S., Brazil warn over need for free election - CNBC",2024-07-26,https://www.cnbc.com/2024/07/26/venezuela-presidential-election-maduro-bids-for-a-third-term-in-power.html,positive,0.159,
15,Honeywell Weighs Quantinuum IPO at $10 Billion Valuation - Bloomberg,2024-07-26,https://www.bloomberg.com/news/articles/2024-07-26/honeywell-said-to-weigh-quantinuum-ipo-at-10-billion-valuation,positive,0.016,
7,Harris tops Trump by 6 points in New Hampshire polling - The Hill,2024-07-26,https://thehill.com/homenews/campaign/4794268-harris-trump-new-hampshire-surveys-biden-presidential-election-2024/,positive,0.058,
15,Chicago announces ‚Äòtransformational‚Äô quantum computer commercial development at fallow South Works site - Chicago Tribune,2024-07-25,https://www.chicagotribune.com/2024/07/25/chicago-quantum-computer-development/,positive,0.022,
13,OpenAI is taking on Google with a new artificial intelligence search engine - CNN,2024-07-25,https://www.cnn.com/2024/07/25/tech/openai-artificial-intelligence-ai-search-engine/index.html,positive,0.059,
1,The US economy is pulling off something historic - CNN,2024-07-25,https://www.cnn.com/2024/07/25/economy/us-economy-gdp-second-quarter/index.html,positive,0.133,
15,Illinois Governor Pritzker Secures $1 Billion Quantum Tech Win Before Convention - Bloomberg,2024-07-25,https://www.bloomberg.com/news/articles/2024-07-25/pritzker-secures-1-billion-quantum-tech-win-before-convention,positive,0.105,
23,"Meta must do more to address non-consensual, deepfake porn, Oversight Board says - CNN",2024-07-25,https://www.cnn.com/2024/07/25/tech/meta-non-consensual-deepfake-porn-oversight-board/index.html,negative,-0.041,
23,From politics to porn: will 2024 be the year in which deepfake fears finally become real? - The Guardian,2024-07-25,https://www.theguardian.com/commentisfree/article/2024/jul/25/ai-celebrity-deepfakes-generative-chatgpt-impact-politics-future,negative,-0.066,
23,Have you been targeted by non-consensual deepfake pornography? - CNN,2024-07-25,https://www.cnn.com/2024/07/25/tech/non-consensual-deepfake-pornography-callout/index.html,neutral,1.0,
15,‚ÄòA huge opportunity‚Äô: Quantum leap for UK as tech industry receives ¬£100m boost - The Guardian,2024-07-25,https://www.theguardian.com/science/article/2024/jul/26/quantum-leap-for-uk-as-tech-industry-receives-100m-boost,positive,0.061,
10,China‚Äôs hosting Palestinian and Ukrainian delegations this week. But can it play peace broker in global conflicts? - CNN,2024-07-25,https://www.cnn.com/2024/07/25/china/china-global-conflicts-broker-intl-hnk/index.html,negative,-0.134,
7,Biden delivers Oval Office address after dropping out of 2024 presidential race: Live updates | CNN Politics - CNN,2024-07-25,https://www.cnn.com/politics/live-news/biden-speech-harris-trump-election-07-24-24/index.html,negative,-0.021,
4,Deutsche Bank‚Äôs US Commercial Property Loans Are a Growing Drag on Its Profits - Bloomberg,2024-07-25,https://www.bloomberg.com/news/articles/2024-07-25/deutsche-bank-s-us-cre-loans-are-a-growing-drag-on-its-profits,positive,0.087,
7,Donald Trump v Kamala Harris: what the polls say - The Economist,2024-07-25,https://www.economist.com/interactive/us-2024-election/trump-harris-polls,negative,-0.064,
7,Kamala Harris debuts official TikTok account as presidential campaign picks up - CNBC,2024-07-25,https://www.cnbc.com/2024/07/25/kamala-harris-debuts-official-tiktok-account-as-presidential-campaign-picks-up.html,positive,0.061,
23,Meta oversight board: More needs to be done to fight deepfake pornography - The Hill,2024-07-25,https://thehill.com/policy/technology/4793016-meta-oversight-board-more-needs-to-be-done-to-fight-deepfake-pornography/,negative,-0.119,
10,"Hamas and Fatah sign agreement in Beijing ‚Äòending‚Äô their division, China says - CNN",2024-07-24,https://www.cnn.com/2024/07/23/china/hamas-fatah-palestinian-factions-beijing-intl-hnk/index.html,positive,0.13,
7,CNN Poll: Harris improves on Biden‚Äôs performance against Trump in early look at new matchup - CNN,2024-07-24,https://www.cnn.com/2024/07/24/politics/cnn-poll-kamala-harris-donald-trump/index.html,positive,0.134,
4,Commercial Property Stress Forces Blackstone Mortgage REIT to Cut Dividend - Bloomberg,2024-07-24,https://www.bloomberg.com/news/articles/2024-07-24/blackstone-mortgage-reit-bxmt-cuts-dividend-as-distress-increases,positive,0.184,
12,"The Best Wireless Headphones, Tested And Reviewed - Forbes",2024-07-23,https://www.forbes.com/sites/forbes-personal-shopper/article/best-wireless-headphones/,positive,0.359,
8,The religious promise of Saudi-Israel normalization - The Hill,2024-07-23,https://thehill.com/opinion/international/4785950-the-religious-promise-of-saudi-israel-normalization/,positive,0.051,
7,"July 22, 2024, presidential campaign news - CNN",2024-07-23,https://www.cnn.com/politics/live-news/joe-biden-election-drop-out-07-22-24/index.html,positive,0.14,
12,"Best Multivitamins For Women In 2024, According To Experts - Forbes",2024-07-23,https://www.forbes.com/health/womens-health/best-multivitamins-women/,positive,0.174,
10,Army chief says UK must double its lethality or be prepared for war in 2027 - The Guardian,2024-07-23,https://www.theguardian.com/uk-news/article/2024/jul/23/british-defence-chief-vows-to-triple-fighting-power-but-shies-away-from-conscription,negative,-0.136,
10,Why does China care about a rust bucket in the middle of the sea? - The Washington Post,2024-07-23,https://www.washingtonpost.com/world/2024/07/23/china-philippines-south-china-sea-sierra-madre/,positive,0.134,
7,World leaders react to Biden‚Äôs exit from the 2024 US presidential race - CNN,2024-07-22,https://www.cnn.com/2024/07/22/world/world-reaction-biden-exit-2024-us-presidential-race/index.html,positive,0.137,
7,Inside Biden‚Äôs unprecedented exit from the presidential race - CNN,2024-07-22,https://www.cnn.com/2024/07/21/politics/inside-bidens-exit-from-2024-race/index.html,positive,0.036,
7,2024 Presidential Candidates - CNN,2024-07-22,https://www.cnn.com/interactive/2024/politics/presidential-candidates-dg/,positive,0.087,
6,China and Russia Are Breaking the World Into Pieces - Bloomberg,2024-07-22,https://www.bloomberg.com/opinion/features/2024-07-21/china-and-russia-are-breaking-america-s-world-into-pieces,positive,0.057,
6,"Geopolitical risks and trade tensions are inflationary, strategist says - CNBC",2024-07-22,https://www.cnbc.com/video/2024/07/22/geopolitical-risks-and-trade-tensions-are-inflationary-strategist.html,positive,0.187,
7,"As Biden fights calls to exit race, Harris rallies supporters in North Carolina - The Washington Post",2024-07-19,https://www.washingtonpost.com/politics/2024/07/18/kamala-harris-president-biden-campaign/,negative,-0.108,
10,Opinion | What Vance gets wrong about the China challenge - The Washington Post,2024-07-19,https://www.washingtonpost.com/opinions/2024/07/19/vance-trump-china-only-foreign-policy-ukraine/,positive,0.152,
7,Analysis | A month that upended the campaign leaves Trump in his strongest position yet - The Washington Post,2024-07-19,https://www.washingtonpost.com/politics/2024/07/19/trump-biden-convention-analysis/,negative,-0.08,
7,What happens if Biden drops out of the presidential race? - The Washington Post,2024-07-19,https://www.washingtonpost.com/elections/2024/07/18/what-happens-biden-drops-out/,negative,-0.072,
7,Democrats at impasse as Biden digs in amid mounting calls to drop out - The Washington Post,2024-07-19,https://www.washingtonpost.com/politics/2024/07/19/democrats-biden-withdraw-clash/,positive,0.015,
7,Election officials frustrated Trump allies suddenly care about rhetoric - The Washington Post,2024-07-19,https://www.washingtonpost.com/politics/2024/07/19/republicans-rhetoric-shooting-blame/,negative,-0.12,
7,Pelosi has told House Democrats that Biden may soon be persuaded to exit race - The Washington Post,2024-07-19,https://www.washingtonpost.com/politics/2024/07/18/nancy-pelosi-biden-close-to-dropping-out/,neutral,0.864,
7,Biden faces fresh wave of Democratic doubt as party‚Äôs fissures deepen - The Washington Post,2024-07-19,https://www.washingtonpost.com/politics/2024/07/18/biden-new-doubts-democratic-fissures/,positive,0.112,
7,Trump‚Äôs overhaul of GOP shows his sway but leaves some on sidelines - The Washington Post,2024-07-19,https://www.washingtonpost.com/politics/2024/07/19/trump-republican-party-traditional-conservatives-milwaukee/,positive,0.145,
7,Instant analysis and commentary from night 4 of the 2024 Republican National Convention - CNN,2024-07-19,https://www.cnn.com/election/2024/analysis-commentary-rnc,neutral,1.0,
7,"Live updates: Biden campaign news, Trump shooting investigation and RNC analysis - CNN",2024-07-19,https://www.cnn.com/politics/live-news/biden-trump-rnc-07-19-24/index.html,negative,-0.037,
7,More than 30 Democrats have called on Biden to quit race against Trump - CNBC,2024-07-19,https://www.cnbc.com/2024/07/19/biden-election-democrats-election-trump.html,negative,-0.078,
7,Takeaways from the final night of the Republican National Convention - CNN,2024-07-19,https://www.cnn.com/2024/07/19/politics/takeaways-rnc-day-4/index.html,negative,-0.044,
7,"Elections 2024 live updates: Biden is ‚Äòabsolutely‚Äô staying in race, campaign chair says - The Washington Post",2024-07-19,https://www.washingtonpost.com/elections/2024/07/19/election-2024-biden-trump-campaign-updates/,positive,0.05,
13,Artificial intelligence (AI) - The Guardian,2024-07-19,https://www.theguardian.com/technology/artificialintelligenceai/2024/jul/19/all,positive,0.26,
13,Opinion | The relationship with your artificial intelligence companion - The Washington Post,2024-07-19,https://www.washingtonpost.com/opinions/2024/07/19/edith-pritchett-cartoon-ai-companion/,positive,0.131,
2,Windows global IT outage: what we know so far - The Guardian,2024-07-19,https://www.theguardian.com/technology/article/2024/jul/19/windows-global-it-outage-what-we-know-so-far,negative,-0.124,
13,"California is a battleground for AI bills, as Trump plans to curb regulation - The Washington Post",2024-07-19,https://www.washingtonpost.com/technology/2024/07/19/biden-trump-ai-regulations-tech-industry/,positive,0.156,
23,Hot AI Startup Tied to Fake Biden Robocall Aims to Combat Misuse - Bloomberg,2024-07-18,https://www.bloomberg.com/news/articles/2024-07-18/elevenlabs-partners-with-reality-defender-to-combat-deepfake-audio,positive,0.124,
23,"Portal needed for victims to report AI deepfakes, federal police union says - The Guardian",2024-07-18,https://www.theguardian.com/technology/article/2024/jul/18/ai-deepfakes-revenge-porn-reporting-portal-australia-laws,negative,-0.172,
7,What happens next if Biden drops out of the presidential race - CNBC,2024-07-18,https://www.cnbc.com/2024/07/18/biden-drops-out-what-happens-next.html,positive,0.05,
7,"Rep. Schiff calls on Biden to drop out, citing ‚Äòserious concerns‚Äô that he can‚Äôt win - Los Angeles Times",2024-07-18,https://www.latimes.com/politics/story/2024-07-17/schiff-calls-on-biden-to-drop-out-citing-serious-concerns-that-he-can-win,positive,0.047,
10,"U.S.-China tensions are not a 'new Cold War,' veteran Singapore diplomat Bilahari Kausikan says - CNBC",2024-07-18,https://www.cnbc.com/2024/07/18/us-china-tensions-are-not-a-new-cold-war-bilahari-kausikan.html,positive,0.047,
7,Obama tells allies Biden‚Äôs path to winning reelection has greatly diminished - The Washington Post,2024-07-18,https://www.washingtonpost.com/politics/2024/07/18/obama-says-biden-must-consider-viability/,negative,-0.091,
4,Watch Defying Expectations in Commercial Real Estate - Bloomberg,2024-07-18,https://www.bloomberg.com/news/videos/2024-07-18/defying-expectations-in-commercial-real-estate-video,positive,0.069,
7,Pelosi privately told Biden polls show he cannot win and will take down the House; Biden responded with defensiveness - CNN,2024-07-18,https://www.cnn.com/2024/07/17/politics/nancy-pelosi-biden-conversation/index.html,positive,0.11,
7,Trump v Biden: who‚Äôs ahead in the latest polls? - The Economist,2024-07-18,https://www.economist.com/interactive/us-2024-election/trump-biden-polls,positive,0.117,
23,"Expose Deepfakes By Treating Human Eyes Like Galaxies, Scientists Say - Forbes",2024-07-17,https://www.forbes.com/sites/jamiecartereurope/2024/07/17/expose-deepfakes-by-treating-human-eyes-like-galaxies-scientists-say/,negative,-0.067,
12,Joel Brammeier: The imperiled Great Lakes take the national stage - Chicago Tribune,2024-07-17,https://www.chicagotribune.com/2024/07/17/opinion-great-lakes-rnc-dnc-climate-change-microplastics/,positive,0.372,
7,Trump v Biden: The Economist‚Äôs presidential election prediction model - The Economist,2024-07-17,https://www.economist.com/interactive/us-2024-election/prediction-model/president,positive,0.138,
23,The People Vs. Deepfakes - Forbes,2024-07-17,https://www.forbes.com/sites/pennyabeywardena/2024/07/17/the-people-vs-deepfakes/,positive,0.094,
6,"Global chip stocks from Nvidia to ASML fall on geopolitics, Trump comments - CNBC",2024-07-17,https://www.cnbc.com/2024/07/17/global-chip-stocks-from-nvidia-to-asml-fall-as-geopolitics-trump-weigh.html,positive,0.057,
4,Marathon Asset Management CEO Sees ‚ÄòAmazing‚Äô Opportunity in Real Estate - Bloomberg,2024-07-16,https://www.bloomberg.com/news/articles/2024-07-16/marathon-ceo-richards-sees-amazing-opportunity-in-commercial-real-estate-debt,negative,-0.061,
1,Will Australia Go Into Recession In 2024? - Forbes,2024-07-16,https://www.forbes.com/advisor/au/personal-finance/will-australia-go-into-recession/,negative,-0.231,
7,How our presidential prediction model works - The Economist,2024-07-16,https://www.economist.com/interactive/us-2024-election/prediction-model/president/how-this-works,positive,0.126,
7,Trump-Biden 2024 Polls: Here‚Äôs Who‚Äôs Winning In The 6 States That Will Decide The Election - Forbes,2024-07-16,https://www.forbes.com/sites/saradorn/2024/07/16/trump-biden-2024-polls-heres-whos-winning-in-the-6-states-that-will-decide-the-election/,positive,0.092,
12,Take Nearly 30% Off An iPhone With The Best Prime Day iPhone Deals - Forbes,2024-07-16,https://www.forbes.com/sites/forbes-personal-shopper/2024/07/16/best-prime-day-iphone-deals/,positive,0.122,
7,2024 Presidential Candidates - CNN,2024-07-15,https://www.cnn.com/interactive/2024/politics/presidential-candidates-dg/,positive,0.221,
10,Stephen Roach Warns of Potentially Disastrous US Policy Towards China - Bloomberg,2024-07-15,https://www.bloomberg.com/news/articles/2024-07-15/stephen-roach-warns-of-potentially-disastrous-us-policy-towards-china,negative,-0.143,
15,When Will Quantum Computers Affect Your Competitive Landscape? - Forbes,2024-07-15,https://www.forbes.com/sites/peterbendorsamuel/2024/07/15/when-will-quantum-computers-affect-your-competitive-landscape/,negative,-0.071,
23,Deepfake clips of Gareth Southgate swearing after England match go viral - The Guardian,2024-07-14,https://www.theguardian.com/technology/article/2024/jul/14/deepfake-gareth-southgate-england-football-team-euro-2024,positive,0.083,
7,Biden faces more calls to withdraw as he visits to Michigan to rally support - The Washington Post,2024-07-12,https://www.washingtonpost.com/politics/2024/07/12/biden-news-conference-debate-michigan-rally/,negative,-0.095,
7,Biden won't drop out of election against Trump unless polls say 'there's no way you can win' - CNBC,2024-07-12,https://www.cnbc.com/2024/07/12/biden-wont-drop-out-unless-polls-say-theres-no-way-you-can-win.html,negative,-0.052,
7,Trump allies at Heritage declare 2024 election illegitimate in advance - The Washington Post,2024-07-12,https://www.washingtonpost.com/politics/2024/07/11/heritage-foundation-election-war-game/,negative,-0.086,
7,Biden shows his knowledge but stumbles over words at news conference - The Washington Post,2024-07-12,https://www.washingtonpost.com/politics/2024/07/11/biden-press-conference-performance-analysis/,positive,0.114,
13,Opinion: What‚Äôs behind the AI boom? Exploited humans - Los Angeles Times,2024-07-12,https://www.latimes.com/opinion/story/2024-07-12/artificial-intelligence-workers-labor-feeding-the-machine,positive,0.114,
13,Unpacking The GOP Two-Line Powerfully Packed Position Statement About Artificial Intelligence As Revealed In The Newly Released 2024 Republican Platform - Forbes,2024-07-12,https://www.forbes.com/sites/lanceeliot/2024/07/12/unpacking-the-gop-two-line-powerfully-packed-position-statement-about-artificial-intelligence-as-revealed-in-the-newly-released-2024-republican-platform/,positive,0.057,
7,Live updates: The latest on the 2024 campaign - CNN,2024-07-12,https://www.cnn.com/politics/live-news/election-2024-campaign-news-07-12-24/index.html,positive,0.087,
7,Nearly 20 Democrats in Congress have called on Biden to quit race - CNBC,2024-07-12,https://www.cnbc.com/2024/07/12/biden-live-updates-democrats-trump-election.html,positive,0.104,
7,Election 2024 live updates: Biden campaigns in Michigan as more House members urge him to drop out - The Washington Post,2024-07-12,https://www.washingtonpost.com/politics/2024/07/12/election-2024-biden-press-conference-reaction/,positive,0.063,
7,Here's Who's Leading Trump Vs. Biden Election Polls - Forbes,2024-07-12,https://www.forbes.com/sites/saradorn/2024/07/12/biden-vs-trump-2024-election-polls-biden-leads-trump-in-latest-survey-but-most-post-debate-polls-show-trump-winning/,positive,0.055,
10,"Confrontations in South China Sea surge, raising fears a miscalculation could lead to conflict - The Guardian",2024-07-12,https://www.theguardian.com/world/article/2024/jul/12/south-china-sea-conflict-philippines-coast-guard,negative,-0.114,
7,Analysis | The impossibility of telling Joe Biden he can‚Äôt win - The Washington Post,2024-07-12,https://www.washingtonpost.com/politics/2024/07/12/biden-polling-drop-out/,positive,0.275,
7,What Project 2025 is and the biggest changes it proposes - The Washington Post,2024-07-12,https://www.washingtonpost.com/politics/2024/07/12/project-2025-summary-trump/,positive,0.136,
7,Rep. Clyburn: Let Biden ‚Äòmake his own decision about his future‚Äô - The Washington Post,2024-07-12,https://www.washingtonpost.com/politics/2024/07/12/clyburn-biden-pelosi/,positive,0.023,
7,Presidential race nearly tied two weeks after debate: Survey - The Hill,2024-07-12,https://thehill.com/homenews/campaign/4768071-biden-trump-race-deadlock-marist-poll/,negative,-0.046,
7,"Elon Musk Donates to Trump, Tapping Vast Fortune to Swing 2024 Race - Bloomberg",2024-07-12,https://www.bloomberg.com/news/articles/2024-07-12/elon-musk-donates-to-trump-tapping-vast-fortune-to-swing-2024-race,positive,0.06,
7,Former Clinton adviser: Biden‚Äôs path to victory ‚Äòhas all but vanished‚Äô - The Hill,2024-07-12,https://thehill.com/homenews/campaign/4768835-biden-2024-election-path/,positive,0.052,
10,"China a ‚Äòdecisive enabler‚Äô of Russia‚Äôs war in Ukraine, says Nato - The Guardian",2024-07-11,https://www.theguardian.com/world/article/2024/jul/11/nato-summit-russia-ukraine-war-china-enabler,negative,-0.098,
7,Opinion | Democratic Sen. Peter Welch: Biden should withdraw for the good of the country - The Washington Post,2024-07-11,https://www.washingtonpost.com/opinions/2024/07/10/welch-biden-withdraw/,positive,0.246,
10,NATO allies call China a ‚Äòdecisive enabler‚Äô of Russia in Ukraine war as bloc eyes Asia security threats - CNN,2024-07-11,https://www.cnn.com/2024/07/11/china/nato-china-russia-ukraine-intl-hnk/index.html,positive,0.049,
9,Investment News: FCA Streamlines Stock Market Listing Process In Bid To Drive Growth - Forbes,2024-07-11,https://www.forbes.com/uk/advisor/investing/2024/07/11/investment-market-updates/,positive,0.187,
7,Trump v Biden: who‚Äôs ahead in the latest polls? - The Economist,2024-07-11,https://www.economist.com/interactive/us-2024-election/trump-biden-polls,positive,0.117,
7,"Most Democrats want Biden to drop out, but overall race is static, poll finds - The Washington Post",2024-07-11,https://www.washingtonpost.com/politics/2024/07/11/poll-biden-drop-out-election/,positive,0.183,
4,Chile Braces for a $552 Million Flood of Commercial Real Estate - Bloomberg,2024-07-11,https://www.bloomberg.com/news/articles/2024-07-11/chile-commercial-real-estate-sales-to-put-552-million-in-property-on-market,negative,-0.069,
10,NATO condemns China as a 'decisive enabler' of Russia's war in Ukraine in most serious rebuke to date - CNBC,2024-07-11,https://www.cnbc.com/2024/07/11/nato-condemns-china-as-a-decisive-enabler-of-russias-war-in-ukraine.html,positive,0.146,
4,Watch Rudin Co-CEO on Concerns Around Commercial Real Estate - Bloomberg,2024-07-11,https://www.bloomberg.com/news/videos/2024-07-11/rudin-co-ceo-on-concerns-around-commercial-real-estate-video,positive,0.154,
10,NATO Singles Out China Over Its Support for Russia in Ukraine - Bloomberg,2024-07-10,https://www.bloomberg.com/news/articles/2024-07-10/nato-set-to-call-out-china-over-support-for-russia-s-war-machine,negative,-0.14,
10,US and China Aren‚Äôt in Another Cold War. It‚Äôs Worse - Bloomberg,2024-07-10,https://www.bloomberg.com/opinion/articles/2024-07-10/us-and-china-rivalry-isn-t-another-cold-war-it-s-worse,negative,-0.205,
23,"Election deepfakes could undermine institutional credibility, Moody's warns - CNBC",2024-07-10,https://www.cnbc.com/2024/07/10/election-deepfakes-undermine-institutional-credibility-moodys.html,negative,-0.046,
10,Why is Modi sucking up to Putin? It‚Äôs simple and cynical: China and oil - The Guardian,2024-07-10,https://www.theguardian.com/commentisfree/article/2024/jul/10/modi-putin-simple-cynical-china-oil-russia-india,positive,0.154,
10,The EV trade war between China and the West heats up - The Economist,2024-07-10,https://www.economist.com/business/2024/07/10/the-ev-trade-war-between-china-and-the-west-heats-up,positive,0.053,
7,"July 9, 2024, presidential debate and election news - CNN",2024-07-10,https://www.cnn.com/politics/live-news/election-2024-campaign-news-07-09-24/index.html,negative,-0.054,
23,Let‚Äôs go after deepfake pornography sites ‚Äì and the social media giants that peddle them - The Guardian,2024-07-10,https://www.theguardian.com/commentisfree/article/2024/jul/10/lets-go-after-deepfake-pornography-sites-and-the-social-media-giants-that-peddle-them,negative,-0.214,
4,Distressed Property Buyers Seek Out ‚ÄòExceptional Bargains‚Äô - Bloomberg,2024-07-10,https://www.bloomberg.com/news/articles/2024-07-10/us-commercial-property-crash-is-set-to-deepen-the-pain-elsewhere,positive,0.149,
7,"July 8, 2024, presidential debate and election news - CNN",2024-07-09,https://www.cnn.com/politics/live-news/election-2024-campaign-news-07-08-24/index.html,positive,0.105,
10,"With Orban in China and Modi in Russia, Putin‚Äôs multipolar world takes shape - The Washington Post",2024-07-09,https://www.washingtonpost.com/world/2024/07/08/modi-orban-putin-china-russia-india/,positive,0.17,
5,Global Shipping Hammered by 30-Foot Waves and a US Hurricane - Bloomberg,2024-07-09,https://www.bloomberg.com/news/newsletters/2024-07-09/supply-chain-latest-harsh-weather-and-shipping-disruptions,negative,-0.1,
3,The Private Equity Bubble Is About to Deflate - Bloomberg,2024-07-09,https://www.bloomberg.com/opinion/articles/2024-07-09/the-private-equity-bubble-is-about-to-deflate,positive,0.109,
