EMERGING_RISK_ID,TITLE,PUBLISHED_DATE,LINK,SENTIMENT,POLARITY,LAST_RUN_TIMESTAMP
7,"Biden and Trump campaigns agreed to mic muting, podiums among rules for upcoming CNN debate - CNN",2024-06-15,https://www.cnn.com/2024/06/15/politics/trump-biden-cnn-debate-rules/index.html,positive,0.074,
7,The rules for the CNN presidential debate on June 27 - The Washington Post,2024-06-15,https://www.washingtonpost.com/politics/2024/06/15/presidential-debate-cnn-rules/,negative,-0.032,
23,"Big Tech's voluntary approach to deepfakes isn't enough, top U.S. cyberdefense official says - The Washington Post",2024-06-14,https://www.washingtonpost.com/technology/2024/06/13/easterly-cyber-ai-hacking-deepfake-voluntary/,neutral,0.866,
10,A price war breaks out among China‚Äôs AI-model builders - The Economist,2024-06-13,https://www.economist.com/business/2024/06/13/a-price-war-breaks-out-among-chinas-ai-model-builders,negative,-0.124,
23,Teenager questioned after explicit AI deepfakes of dozens of schoolgirls shared online - CNN,2024-06-13,https://www.cnn.com/2024/06/13/australia/australia-boy-arrested-deepfakes-schoolgirls-intl-hnk/index.html,negative,-0.13,
13,Steve Eisman touts a new thesis on the artificial intelligence boom - CNBC,2024-06-13,https://www.cnbc.com/2024/06/13/steve-eisman-touts-a-new-thesis-on-the-artificial-intelligence-boom-.html,positive,0.101,
7,Why Venezuela‚Äôs 2024 Presidential Election Might Actually Matter - Bloomberg,2024-06-13,https://www.bloomberg.com/news/articles/2024-06-13/why-venezuela-s-2024-presidential-election-might-actually-matter,positive,0.23,
13,Attractive Investments Beyond Artificial Intelligence Still Exist - Bloomberg,2024-06-13,https://www.bloomberg.com/news/newsletters/2024-06-13/attractive-investments-beyond-artificial-intelligence-still-exist,positive,0.23,
10,The new front in China‚Äôs cyber campaign against America - The Economist,2024-06-13,https://www.economist.com/international/2024/06/13/the-new-front-in-chinas-cyber-campaign-against-america,negative,-0.114,
10,China‚Äôs Xi Jinping calls for peace conference and ‚Äòjustice‚Äô over war in Gaza as Arab leaders visit Beijing - CNN,2024-05-31,https://www.cnn.com/2024/05/30/china/xi-jinping-arab-leaders-china-intl-hnk/index.html,positive,0.065,
7,"Biden, Trump remain in tight race nationally, latest poll finds - The Washington Post",2024-05-31,https://www.washingtonpost.com/elections/2024/05/30/election-2024-campaign-updates/,positive,0.103,
23,"Trump Deepfakes, Misinformation Flood X After Conviction - Bloomberg",2024-05-31,https://www.bloomberg.com/news/articles/2024-05-31/trump-deepfakes-misinformation-flood-x-after-conviction,positive,0.23,
23,Deepfakes In Healthcare: Addressing Dangers And Reducing Risks - Forbes,2024-05-31,https://www.forbes.com/sites/shashankagarwal/2024/05/30/deepfakes-in-healthcare-addressing-dangers-and-reducing-risks/,negative,-0.082,
13,This fine-dining restaurant is bringing artificial intelligence to the dinner table - CNN,2024-05-31,https://www.cnn.com/2024/05/30/travel/krasota-restaurant-multisensory-artificial-intelligence-hnk-spc-intl/index.html,neutral,0.916,
13,How Artificial Intelligence Is Shaping The New Media And EntertAInment Economy - Forbes,2024-05-31,https://www.forbes.com/sites/nelsongranados/2024/05/31/how-artificial-intelligence-is-shaping-the-new-media-and-entertainment-economy/,positive,0.135,
13,Artificial Intelligence And The U.N.'s Global Tax Reform - Forbes,2024-05-31,https://www.forbes.com/sites/taxnotes/2024/05/31/artificial-intelligence-and-the-uns-global-tax-reform/,positive,0.147,
10,"US Risks a 'Forever' Trade War With China, Economist Stephen Roach Says - Bloomberg",2024-05-31,https://www.bloomberg.com/news/articles/2024-05-31/us-risks-a-forever-trade-war-with-china-stephen-roach-says,positive,0.23,
7,Trump conviction heralds a somber and volatile moment in American history - CNN,2024-05-31,https://www.cnn.com/2024/05/31/politics/trump-conviction-consequences-analysis/index.html,positive,0.121,
7,What Trump being a convicted felon could mean for the 2024 race - The Washington Post - The Washington Post,2024-05-31,https://www.washingtonpost.com/politics/2024/05/30/trump-guilty-verdict-presidential-race-polls/,positive,0.093,
23,Deepfake porn; the latest invention to come out of AI - The Hill,2024-05-31,https://thehill.com/video/deepfake-porn-the-latest-invention-to-come-out-of-ai/9744503/,neutral,1.0,
4,"Commercial Real Estate Transactions for the Week of May 27, 2024 - Los Angeles Times",2024-05-31,https://www.latimes.com/b2bpublishing/business-announcements/story/2024-05-30/commercial-real-estate-transactions-for-the-week-of-may-27-2024,positive,0.089,
7,Trump v Biden: who's ahead in the latest polls? - The Economist,2024-05-31,https://www.economist.com/interactive/us-2024-election/trump-biden-polls,positive,0.117,
7,New US Voters Will Shape Trump vs. Biden 2024 Election Rematch - Bloomberg,2024-05-30,https://www.bloomberg.com/graphics/2024-new-eligible-voters-will-decide-trump-biden-rematch/,positive,0.23,
7,Here's Who's Leading Trump Vs. Biden Election Polls - Forbes,2024-05-30,https://www.forbes.com/sites/saradorn/2024/05/30/biden-vs-trump-2024-election-polls-biden-leads-trump-by-2-points-but-loses-with-rfk-jr-on-ballot-latest-survey-shows/,positive,0.1,
23,Deepfakes And A.I.: How To Fight AI Deception - Forbes,2024-05-30,https://www.forbes.com/video/51613d43-400e-4dba-bfe9-84618e972e1e/,negative,-0.084,
13,A Changing Financial World: Artificial Intelligence - Forbes,2024-05-30,https://www.forbes.com/sites/forbes-shook/2024/05/30/a-changing-financial-world-artificial-intelligence/,positive,0.203,
10,Marcos' Surprising Embrace of US Puts China on Back Foot - Bloomberg,2024-05-30,https://www.bloomberg.com/news/articles/2024-05-30/marcos-s-surprising-embrace-of-us-puts-china-on-back-foot,positive,0.23,
4,Big Banks' CRE Exposure Rises 40% When REIT Debt Is Factored in - Bloomberg,2024-05-30,https://www.bloomberg.com/news/articles/2024-05-30/us-banks-have-a-commercial-property-blind-spot-risk-study-warns,positive,0.23,
7,Trump is now a convicted felon. He can still run for president - CNN,2024-05-30,https://www.cnn.com/2024/05/30/politics/can-trump-still-run-for-president-what-matters/index.html,negative,-0.096,
7,Trump has been convicted ‚Äî but that may not weigh down his White House bid. Here's why - CNBC,2024-05-30,https://www.cnbc.com/2024/05/30/trump-guilty-verdict-election-chances-biden-polls.html,negative,-0.088,
12,Best Personal Loans Of June 2024 ‚Äì Forbes Advisor - Forbes,2024-05-29,https://www.forbes.com/advisor/personal-loans/best-personal-loans/,positive,0.378,
23,California advances measures targeting AI discrimination and deepfakes - Los Angeles Times,2024-05-29,https://www.latimes.com/business/story/2024-05-29/california-advances-measures-targeting-ai-discrimination-and-deepfakes,positive,0.1,
4,A commercial real estate crisis is hiding in plain sight - The Hill,2024-05-29,https://thehill.com/opinion/finance/4689279-the-commercial-real-estate-crisis-hiding-in-plain-sight/,negative,-0.082,
7,The unusual turnout dynamic that could decide the 2024 election - CNN,2024-05-29,https://www.cnn.com/2024/05/29/politics/turnout-2024-election-analysis/index.html,positive,0.04,
7,South Africans go to the polls in election seen as biggest test yet to ANC‚Äôs 30 years in power - CNN,2024-05-29,https://www.cnn.com/2024/05/29/africa/south-africa-elections-polls-open-intl/index.html,negative,-0.029,
7,Video: Dennis Quaid says he‚Äôs supporting Trump in upcoming election - CNN,2024-05-29,https://www.cnn.com/2024/05/29/politics/video/dennis-quaid-trump-support-lcl-digvid,neutral,1.0,
11,Five Things You Need to Know to Start Your Day: Asia - Bloomberg,2024-05-29,https://www.bloomberg.com/news/newsletters/2024-05-29/five-things-you-need-to-know-to-start-your-day-asia?srnd=homepage-americas,positive,0.23,
23,‚ÄòThis is sexual violence‚Äô: Ocasio-Cortez boosts bill to tackle AI deepfake porn - The Hill,2024-05-29,https://thehill.com/policy/technology/4692020-this-is-sexual-violence-ocasio-cortez-boosts-bill-to-tackle-ai-deepfake-porn/,positive,0.086,
23,Fashion Label Owner Says Counterfeit Brand Used AI-Generated Video Against Her - Forbes,2024-05-28,https://www.forbes.com/sites/cyrusfarivar/2024/05/28/forget-counterfeits-fashion-designers-now-face-a-new-threat-deepfakes/,negative,-0.069,
4,Slow-Moving Property Crisis Means Averting a Greater One - Bloomberg,2024-05-28,https://www.bloomberg.com/opinion/articles/2024-05-28/slow-moving-property-crisis-means-averting-a-greater-one,positive,0.23,
4,Fed's Kashkari Warns of Big Losses From Commercial Real Estate - Bloomberg,2024-05-28,https://www.bloomberg.com/news/videos/2024-05-28/fed-s-kashkari-warns-of-big-losses-from-commercial-real-estate,positive,0.23,
13,Scarlett Johansson‚Äôs OpenAI clash is just the start of legal wrangles over artificial intelligence - The Guardian,2024-05-28,https://www.theguardian.com/technology/article/2024/may/27/scarlett-johansson-openai-legal-artificial-intelligence-chatgpt,positive,0.116,
6,Latest Oil Market News and Analysis for May 29 - Bloomberg,2024-05-28,https://www.bloomberg.com/news/articles/2024-05-28/latest-oil-market-news-and-analysis-for-may-29,positive,0.23,
23,Deepfake scams have robbed companies of millions. Experts warn it could get worse - CNBC,2024-05-28,https://www.cnbc.com/2024/05/28/deepfake-scams-have-looted-millions-experts-warn-it-could-get-worse.html,negative,-0.247,
10,Washington needs to tell China ‚Äî attacking Taiwan means war with the US - The Hill,2024-05-28,https://thehill.com/opinion/international/4688802-the-us-will-defend-taiwan-against-china/,negative,-0.119,
13,Decoding generative artificial intelligence - CNN,2024-05-28,https://www.cnn.com/2024/05/28/world/video/generative-ai-decoded-spc-intl,neutral,1.0,
7,Will misinformation decide the 2024 presidential election? - The Hill,2024-05-27,https://thehill.com/opinion/campaign/4685012-misinformation-2024-presidential-election/,negative,-0.143,
12,The 8 Best Compact Cameras To Take On Your Next Adventure - Forbes,2024-05-27,https://www.forbes.com/sites/forbes-personal-shopper/article/best-compact-cameras/,positive,0.173,
13,Artificial Intelligence And U.S. Foreign Policy In Asia - Forbes,2024-05-27,https://www.forbes.com/sites/robertginsburg/2024/05/27/artificial-intelligence-and-us-foreign-policy-in-asia/,positive,0.127,
10,America‚Äôs military has the edge in space. China and Russia are in a counterspace race to disrupt it - CNN,2024-05-27,https://www.cnn.com/2024/05/27/china/counterspace-us-china-russia-intl-hnk-scn/index.html,negative,-0.056,
7,What to know about Mexico‚Äôs presidential election - The Hill,2024-05-27,https://thehill.com/policy/international/4688045-mexico-2024-presidential-election-presidential-what-to-know/,positive,0.082,
12,Best Treadmill Sales And Deals 2024 - Forbes,2024-05-26,https://www.forbes.com/sites/forbes-personal-shopper/2024/05/26/treadmill-sales/,positive,0.271,
4,Finding The Best Time To Sell Commercial Real Estate - Forbes,2024-05-26,https://www.forbes.com/sites/jamesnelson/2024/05/26/finding-the-best-time-to-sell/,positive,0.099,
3,How To Recognize Bubbles And Stay On Track Financially When They Burst - Forbes,2024-05-26,https://www.forbes.com/sites/cicelyjones/2024/05/26/how-to-recognize-bubbles-and-stay-on-track-financially-when-they-burst/,negative,-0.175,
10,Why Taiwan's Status Risks Igniting a US-China Clash - Bloomberg,2024-05-25,https://www.bloomberg.com/news/articles/2024-05-25/why-taiwan-s-status-risks-igniting-a-us-china-clash,positive,0.23,
17,ABN Amro Is Latest Bank to Suffer Breach After Hack at Supplier - Bloomberg,2024-05-24,https://www.bloomberg.com/news/articles/2024-05-24/abn-amro-is-latest-bank-to-suffer-breach-after-hack-at-supplier?srnd=good-business,positive,0.23,
10,China has launched new drills encircling Taiwan. Why now? - CNN,2024-05-24,https://www.cnn.com/2024/05/23/asia/china-taiwan-drills-explainer-intl-hnk/index.html,positive,0.055,
12,Five of the best ros√© wines to take on a picnic - The Guardian,2024-05-24,https://www.theguardian.com/food/article/2024/may/24/five-of-the-best-rose-wines-to-take-on-a-picnic-fiona-beckett,positive,0.094,
13,See How This Company Uses AI To Decode Genomic Diversity - Forbes,2024-05-24,https://www.forbes.com/sites/jenniferkitepowell/2024/05/24/see-how-this-company-uses-artificial-intelligence-to-decode-genomic-diversity/,negative,-0.038,
7,Top Republicans are already rushing to buy into Trump‚Äôs 2024 election fraud narrative - CNN,2024-05-24,https://www.cnn.com/2024/05/23/politics/republicans-2024-election-analysis/index.html,positive,0.134,
13,California Proposes New Anti-Discrimination Rules When Artificial Intelligence Impacts Hiring - Forbes,2024-05-24,https://www.forbes.com/sites/alonzomartinez/2024/05/24/california-proposes-new-anti-discrimination-rules-when-artificial-intelligence-impacts-hiring/,positive,0.093,
23,‚ÄòThis is so creepy‚Äô: Youtuber says someone cloned her image for deepfake video in China - CNN,2024-05-24,https://www.cnn.com/2024/05/22/world/video/deepfakes-china-russia-video-ebof-ripley-pkg-digvid,neutral,1.0,
23,White House pressures tech industry on sexually abusive AI deepfakes - The Hill,2024-05-23,https://thehill.com/policy/technology/4682067-white-house-pressures-tech-industry-on-sexually-abusive-ai-deepfakes/,positive,0.07,
7,Trump v Biden: who's ahead in the latest polls? - The Economist,2024-05-23,https://www.economist.com/interactive/us-2024-election/trump-biden-polls,positive,0.117,
4,A Really Bad Sign for Commercial Real Estate - Bloomberg,2024-05-23,https://www.bloomberg.com/news/newsletters/2024-05-23/bloomberg-evening-briefing-a-really-bad-sign-for-commercial-real-estate,positive,0.23,
7,Kaitlan Collins asks Ted Cruz if he‚Äôll accept the 2024 election results - CNN,2024-05-23,https://www.cnn.com/2024/05/22/politics/video/ted-cruz-election-results-kaitlan-collins-src-digvid,neutral,1.0,
7,Biden welcomes Kenyan president; Trump trial on hiatus - The Washington Post,2024-05-23,https://www.washingtonpost.com/elections/2024/05/22/election-2024-campaign-updates/,negative,-0.052,
7,Oregon Democratic and Republican primary election results and maps 2024 - CNN,2024-05-23,https://www.cnn.com/election/2024/primaries-and-caucuses/results/oregon,neutral,1.0,
7,Nikki Haley says she will vote for Trump in 2024 election - The Washington Post,2024-05-23,https://www.washingtonpost.com/politics/2024/05/22/nikki-haley-voting-donald-trump/,positive,0.144,
7,Haley will vote for the Trump ‚Äòchaos‚Äô that she once decried - CNN,2024-05-23,https://www.cnn.com/2024/05/23/politics/nikki-haley-donald-trump-analysis/index.html,negative,-0.1,
4,"Commercial Real Estate Transactions for the Week of May 20, 2024 - Los Angeles Times",2024-05-23,https://www.latimes.com/b2bpublishing/business-announcements/story/2024-05-23/commercial-real-estate-deals-of-the-week-w-o-5-20,neutral,1.0,
4,CMBS Buyers Suffer First Loss on AAA Debt Since Financial Crisis - Bloomberg,2024-05-23,https://www.bloomberg.com/news/articles/2024-05-23/cmbs-buyers-suffer-first-loss-on-aaa-debt-since-financial-crisis,positive,0.23,
7,Here's Who's Leading Trump Vs. Biden Election Polls - Forbes,2024-05-23,https://www.forbes.com/sites/saradorn/2024/05/23/biden-vs-trump-2024-election-polls-biden-leads-trump-by-only-single-digits-in-new-york-latest-survey-shows/,positive,0.102,
10,China starts ‚Äòpunishment‚Äô military drills around Taiwan days after island swears in new leader - CNN,2024-05-23,https://www.cnn.com/2024/05/22/asia/china-military-drills-taiwan-punishment-intl-hnk/index.html,positive,0.04,
23,Bipartisan senators introduce bill to fight nonconsensual ‚Äòdeepfake porn‚Äô - The Hill,2024-05-23,https://thehill.com/homenews/senate/4682884-deepfake-porn-senate-bill/,negative,-0.04,
23,Arizona lawmaker says ChatGPT helped draft new deepfakes law - The Hill,2024-05-23,https://thehill.com/policy/technology/4682722-arizona-lawmaker-chatgpt-helped-draft-deepfakes-law/,positive,0.056,
10,"Brazil, China Call for Peace Conference on Russia-Ukraine War - Bloomberg",2024-05-23,https://www.bloomberg.com/news/articles/2024-05-23/brazil-china-call-for-peace-conference-on-russia-ukraine-war,positive,0.23,
12,Best Personal Loans Of May 2024 ‚Äì Forbes Advisor - Forbes,2024-05-22,https://www.forbes.com/advisor/personal-loans/best-personal-loans/,positive,0.378,
13,7 Best Artificial Intelligence (AI) ETFs To Buy Now - Forbes,2024-05-22,https://www.forbes.com/sites/investor-hub/article/best-ai-etfs-to-buy-now/,positive,0.197,
17,Fat Finger Errors: What Are They and Why These Trades Disrupt Markets - Bloomberg,2024-05-22,https://www.bloomberg.com/news/articles/2024-05-22/fat-finger-errors-what-are-they-and-why-these-trades-disrupt-markets,positive,0.23,
10,Biden is losing World War III - The Hill,2024-05-22,https://thehill.com/opinion/national-security/4678430-biden-is-losing-world-war-iii/,negative,-0.179,
1,"Most Americans falsely think the U.S. is in recession, poll shows - CNBC",2024-05-22,https://www.cnbc.com/2024/05/22/most-americans-falsely-think-the-us-is-in-recession-poll-shows.html,negative,-0.106,
10,Biden Tariffs Revive The China Trade War But Trump's Stance Is Riskier - Forbes,2024-05-22,https://www.forbes.com/sites/nicksargen/2024/05/22/biden-tariffs-revive-the-china-trade-war-but-trumps-stance-is-riskier/,negative,-0.115,
7,"Fears of Violence, Disruption Ahead of Presidential Election - Bloomberg",2024-05-22,https://www.bloomberg.com/news/newsletters/2024-05-22/fears-of-violence-disruption-ahead-of-presidential-election,positive,0.23,
4,SF's affluent Jackson Square is city's hottest real estate market - San Francisco Chronicle,2024-05-22,https://www.sfchronicle.com/realestate/article/sf-jackson-square-19468693.php,positive,0.281,
7,Nikki Haley says who she plans to vote for in 2024 presidential election - CNN,2024-05-22,https://www.cnn.com/2024/05/22/politics/video/nikki-haley-support-donald-trump-2024-presidential-election-digvid,neutral,1.0,
7,"Biden, Trump rematch: Here's how the presidential election may disrupt the stock market - CNBC",2024-05-22,https://www.cnbc.com/2024/05/22/biden-trump-rematch-how-the-presidential-election-may-disrupt-the-stock-market.html,positive,0.093,
7,Nikki Haley says she‚Äôs voting for Trump in November - CNN,2024-05-22,https://www.cnn.com/2024/05/22/politics/nikki-haley-donald-trump/index.html,positive,0.061,
7,Kentucky Democratic and Republican primary election results and maps 2024 - CNN,2024-05-22,https://www.cnn.com/election/2024/primaries-and-caucuses/results/kentucky,neutral,1.0,
15,US Government Urges Federal Contractors to Strengthen Encryption - Bloomberg,2024-05-21,https://www.bloomberg.com/news/articles/2024-05-21/us-government-urges-federal-contractors-to-strengthen-encryption,positive,0.23,
11,UK Artificial Intelligence (AI) Statistics And Trends In 2024 - Forbes,2024-05-21,https://www.forbes.com/uk/advisor/business/software/uk-artificial-intelligence-ai-statistics-2023/,positive,0.122,
4,Is Real Estate Still A Safe Investment? Tips For Today's Market - Forbes,2024-05-21,https://www.forbes.com/sites/fredhubler/2024/05/21/is-real-estate-still-a-safe-investment-tips-for-todays-market/,positive,0.199,
9,"Trump-allied Republicans are changing the GOP's approach to labor, free markets and regulation - CNBC",2024-05-21,https://www.cnbc.com/2024/05/21/trump-republicans-shift-gop-approach-to-labor-free-markets-and-regulation.html,positive,0.149,
5,Supply Chain Latest: Fed Survey Sees 'Troubling' Sign in Supply Chains - Bloomberg,2024-05-21,https://www.bloomberg.com/news/newsletters/2024-05-21/supply-chain-latest-fed-survey-sees-troubling-sign-in-supply-chains,positive,0.23,
7,Voters Fear Trump Won‚Äôt Leave If He Wins 2024 Presidential Election - Bloomberg,2024-05-21,https://www.bloomberg.com/news/features/2024-05-21/voters-fear-trump-won-t-leave-if-he-wins-2024-presidential-election,positive,0.23,
10,ASML and TSMC Can Disable Chip Machines If China Invades Taiwan - Bloomberg,2024-05-21,https://www.bloomberg.com/news/articles/2024-05-21/asml-tsmc-can-disable-chip-machines-if-china-invades-taiwan,positive,0.23,
23,Opinion | Will deepfakes impact the 2024 election outcome? - The Washington Post - The Washington Post,2024-05-21,https://www.washingtonpost.com/opinions/2024/05/21/2024-election-generative-ai-deepfakes/,positive,0.16,
13,"World is ill-prepared for breakthroughs in AI, say experts - The Guardian",2024-05-21,https://www.theguardian.com/technology/article/2024/may/20/world-is-ill-prepared-for-breakthroughs-in-ai-say-experts,positive,0.108,
2,Safest Banks In The U.S. Of May 2024 - Forbes,2024-05-21,https://www.forbes.com/advisor/banking/safest-banks-in-the-us/,positive,0.096,
7,"AI could offer ‚Äòenhanced opportunities‚Äô to interfere in 2024 election, DHS warns - CNN",2024-05-21,https://www.cnn.com/2024/05/21/politics/ai-2024-election-interference-dhs-warns/index.html,positive,0.128,
13,World‚Äôs first major law for artificial intelligence gets final EU green light - CNBC,2024-05-21,https://www.cnbc.com/2024/05/21/worlds-first-major-law-for-artificial-intelligence-gets-final-eu-green-light.html,positive,0.157,
12,CBD Gummies For Pain In 2024 ‚Äì Forbes Health - Forbes,2024-05-20,https://www.forbes.com/health/cbd/best-cbd-gummies-for-pain/,positive,0.129,
17,Navigating Uncertain Waters: China's E-CNY Expansion Overseas And The Quest For Global Payment Influence - Forbes,2024-05-20,https://www.forbes.com/sites/digital-assets/2024/05/20/navigating-uncertain-waters-chinas-e-cny-expansion-overseas-and-the-quest-for-global-payment-influence/,positive,0.096,
13,Will Artificial Intelligence Diminish Our Humanity? - Forbes,2024-05-20,https://www.forbes.com/sites/timbajarin/2024/05/20/will-artificial-intelligence-diminish-our-humanity/,neutral,1.0,
13,Should The Federal Government Regulate Artificial Intelligence? - Forbes,2024-05-20,https://www.forbes.com/sites/aldenabbott/2024/05/20/should-the-federal-government-regulate-artificial-intelligence/,positive,0.088,
7,Dominican Republic president declares himself winner in election - CNN,2024-05-20,https://www.cnn.com/2024/05/20/americas/dominican-republic-election-luis-abinader-intl-latam/index.html,positive,0.211,
23,"Deepfakes, AI-Manipulated Audio, and Hijacked Social Media Surge in 2024 - PR Newswire",2024-05-14,https://www.prnewswire.com/news-releases/deepfakes-ai-manipulated-audio-and-hijacked-social-media-surge-in-2024-302144256.html,negative,-0.183,
13,"US, China meet in Geneva to discuss AI risks - Reuters",2024-05-14,https://www.reuters.com/technology/us-china-meet-geneva-discuss-ai-risks-2024-05-13/,neutral,0.0,
17,"In Profile: Nicolai Chamizo, Founder and CEO at Incore Invest - The Fintech Times",2024-05-14,https://thefintechtimes.com/in-profile-nicolai-chamizo-founder-and-ceo-at-incore-invest/,neutral,0.0,
23,72% of consumers worry daily about being fooled by a deepfake - Security Magazine,2024-05-14,https://www.securitymagazine.com/articles/100658-72-of-consumers-worry-daily-about-being-fooled-by-a-deepfake,positive,0.07,
6,Temasek Hunts For Domestic Bets With Geopolitical Tension Rising - Bloomberg,2024-05-14,https://www.bloomberg.com/news/articles/2024-05-14/temasek-hunts-for-domestic-bets-with-geopolitical-tension-rising,positive,0.23,
23,The Battle For Truth In Election Seasons: AI-Generated Deepfakes - Forbes,2024-05-14,https://www.forbes.com/sites/emilsayegh/2024/05/14/the-battle-for-truth-in-election-seasons-ai-generated-deepfakes/,negative,-0.123,
11,Explainer: Why are meme stocks rallying again? - Reuters,2024-05-14,https://www.reuters.com/markets/us/why-are-meme-stocks-rallying-again-2024-05-14/,neutral,0.0,
11,GameStop hits 2021 high as return of 'Roaring Kitty' rekindles meme stock mania - Reuters,2024-05-14,https://www.reuters.com/technology/gamestop-amc-surge-evokes-2021-meme-stocks-saga-2024-05-14/,neutral,0.0,
9,US financial regulators propose anti-money laundering rules for fund advisers - Reuters,2024-05-13,https://www.reuters.com/world/us/us-financial-regulators-propose-anti-money-laundering-rules-fund-advisers-2024-05-13/,neutral,0.0,
7,"Why It Matters: Wayne County, Michigan, and the Presidential Election | America 2024 | U.S. News - U.S. News & World Report",2024-05-13,https://www.usnews.com/news/elections/articles/why-it-matters-wayne-county-michigan-and-the-presidential-election,positive,0.036,
7,Donald Trump leads Joe Biden across crucial 2024 swing states - Financial Times,2024-05-13,https://www.ft.com/content/4b00a5ee-c1b3-4af1-8064-8aac0f454a76,negative,-0.074,
7,Lithuania's Nauseda wins first round of presidential election - Reuters,2024-05-13,https://www.reuters.com/world/europe/lithuanian-presidential-hopefuls-vow-stand-up-russian-threat-2024-05-12/,neutral,0.0,
13,"Artificial intelligence hitting labour forces like a ""tsunami"" - IMF Chief - Reuters",2024-05-13,https://www.reuters.com/technology/artificial-intelligence-hitting-labour-forces-like-tsunami-imf-chief-2024-05-13/,neutral,0.0,
10,"Without firing a shot: China focuses on non-military ways to take Taiwan, reports warn - Washington Times",2024-05-13,https://www.washingtontimes.com/news/2024/may/13/china-focuses-on-non-military-ways-to-take-taiwan-/,negative,-0.082,
23,Surge of new AI firms claim to offer hyperaccurate deepfake detection - The Washington Post,2024-05-12,https://www.washingtonpost.com/technology/2024/05/12/ai-deepfakes-detection-industry/,positive,0.097,
7,Listen to Republicans on whether they'll accept 2024 election results - Axios,2024-05-12,https://www.axios.com/2024/05/12/trump-republicans-2024-election-accept-results,positive,0.17,
