ENTERPRISE_RISK_ID,SEARCH_TERMS,TITLE,SUMMARY,KEYWORDS,PUBLISHED_DATE,LINK,SOURCE,SOURCE_URL,SENTIMENT,POLARITY
8,Bird Flu,"As pace and severity of human H5N1 cases accelerate, NIH leaders call for more action on bird flu - CNN","CNN —Most human cases of bird flu in North America have been mild, a fact that’s underscored by a new study of the first 46 confirmed human H5N1 infections in the United States this year.
With the number of cases continuing to grow, leaders from the National Institutes of Health are calling for more action to tackle the bird flu outbreak.
The teen was infected with a newer variant of the H5N1 virus, D1.1, which is carried by wild birds.
Taken together, she writes, the new reports of human cases show that the pace of human H5N1 infections has been accelerating.
Although the overall number of human infections related to H5N1 has been low, the continued drip, drip, drip of human and animal detections is not a good sign.","['infections', 'virus', 'cases', 'leaders', 'human', 'nih', 'bird', 'number', 'infection', 'teen', 'dr', 'h5n1', 'ill', 'pace', 'action', 'flu', 'severity']",2024-12-31,https://www.cnn.com/2024/12/31/health/human-h5n1-bird-flu-cases/index.html,CNN,https://www.cnn.com,negative,-0.093
8,Bird Flu,California egg shortage drives prices to nearly $9 per dozen - San Francisco Chronicle,,[],2024-12-31,https://www.sfchronicle.com/bayarea/article/california-egg-prices-bird-flu-20008918.php,San Francisco Chronicle,https://www.sfchronicle.com,neutral,0.0
3,Cryptocurrency,Should you forget Bitcoin and buy Solana instead? - USA TODAY,"Could one of those tokens be Solana (CRYPTO: SOL), which trades at about $190 with a market cap of $90 billion?
Solana and other PoS tokens are usually valued by the speed of their blockchains and the growth of their developer ecosystems.
It could be smart to invest in both Bitcoin and Solana, but investors should be aware of their differences.
The Motley Fool has positions in and recommends Alphabet, Bitcoin, Ethereum, PayPal, Render Token, Shopify, Solana and Visa.
Offer from the Motley Fool: Before you buy stock in Solana, consider this:The Motley Fool Stock Advisor analyst team just identified what they believe are the 10 best stocks for investors to buy now… and Solana wasn’t one of them.","['crypto', 'fool', 'investors', 'motley', 'instead', 'solana', 'forget', 'pos', 'blockchain', 'bitcoin', 'buy', 'price', 'tokens']",2024-12-31,https://www.usatoday.com/story/money/investing/2024/12/31/bitcoin-solana-investing-cryptocurrency/77212026007/,USA TODAY,https://www.usatoday.com,positive,+0.101
3,Fintech,US files complaint against fintech app Dave and its CEO - Reuters,,[],2024-12-31,https://www.reuters.com/legal/us-announces-civil-enforcement-action-against-fintech-app-dave-its-ceo-2024-12-30/,Reuters,https://www.reuters.com,neutral,0.0
5,U.S. Department of the Treasury,"US to issue hydrogen credit rule this week, with path for nuclear, sources say - Reuters",,[],2024-12-31,https://www.reuters.com/sustainability/climate-energy/us-issue-hydrogen-credit-rule-this-week-with-path-nuclear-sources-say-2024-12-31/,Reuters,https://www.reuters.com,neutral,0.0
5,U.S. Department of the Treasury,‘Major incident’: China-backed hackers breached US Treasury workstations - CNN,"“There is no evidence indicating the threat actor has continued access to Treasury systems or information,” the Treasury spokesperson said.
Treasury officials plan to hold a classified briefing about the breach next week with staffers from the House Financial Services Committee, a senior committee staffer told CNN.
“With access to the stolen key, the threat actor was able to override the service’s security, remotely access certain Treasury [Departmental Office] user workstations, and access certain unclassified documents maintained by those users,” the Treasury letter said.
However, the Treasury spokesperson said in the statement that “several” Treasury user workstations were accessed.
Hardikar said in the letter that based on Treasury policy, intrusions attributed to advanced persistent threat actors are considered a “major cybersecurity incident.” Treasury officials are required to provide an update in a 30-day supplemental report.","['access', 'chinabacked', 'spokesperson', 'actor', 'workstations', 'breached', 'hackers', 'incident', 'officials', 'letter', 'service', 'threat', 'treasury']",2024-12-31,https://www.cnn.com/2024/12/30/investing/china-hackers-treasury-workstations/index.html,CNN,https://www.cnn.com,positive,+0.158
2,Malware,New Google Spyware Warning—750 Million Android Users Must Now Act - Forbes,"New Android warning hits 750 million users.
But the ecosystem is far from protected, and there are now more than 750 million devices vulnerable to attack.
The fragmented nature of Android updates across vendors and carriers may impact these security enhancements' effectiveness by increasing the number of bugs that can be exploited.”According to StatCounter, while 56% of Android phones are running Android 13 or newer, one in four are running Android 11 and 12, with 10% on Android 9 and 10.
Google ended support for Android 9 in 2021, Android 10 in 2023 and Android 11 in February this year.
Android is changing—the days of aged versions of the OS running endlessly are coming to an end.","['google', 'users', 'android', 'devices', 'running', 'threat', 'spyware', 'act', 'million', 'mobile', 'versions', 'warning750', 'os']",2024-12-31,https://www.forbes.com/sites/zakdoffman/2024/12/31/new-android-spyware-warning-750-million-users-must-now-act/,Forbes,https://www.forbes.com,positive,+0.092
2,Nation-state actors,U.S. Treasury says it was hacked by China-backed intruder - The Washington Post,,[],2024-12-31,https://www.washingtonpost.com/technology/2024/12/30/treasury-hack-china-national-security/,The Washington Post,https://www.washingtonpost.com,neutral,0.0
5,U.S. Department of the Treasury,US Treasury says Chinese hackers stole documents in 'major incident' - Reuters,,[],2024-12-31,https://www.reuters.com/technology/cybersecurity/us-treasurys-workstations-hacked-cyberattack-by-china-afp-reports-2024-12-30/,Reuters,https://www.reuters.com,neutral,0.0
2,Data breach,US Treasury says Chinese hackers stole documents in 'major incident' - Reuters,,[],2024-12-31,https://www.reuters.com/technology/cybersecurity/us-treasurys-workstations-hacked-cyberattack-by-china-afp-reports-2024-12-30/,Reuters,https://www.reuters.com,neutral,0.0
5,U.S. Department of the Treasury,US Treasury says it was hacked by China in 'major incident' - BBC.com,"US Treasury says it was hacked by China in 'major incident'China denied any involvement, calling the accusation ""baseless"" and saying it ""consistently opposes all forms of hacking"".
The Treasury Department deemed the breach a ""major incident"" after disclosing it via a letter notifying lawmakers to the incident.
There was no evidence to suggest the hacker had continued to access to Treasury Department information since, the statement continued.
""In accordance with Treasury policy, intrusions attributable to an APT are considered a major cybersecurity incident,"" Treasury Department officials said.
""China consistently opposes all forms of hacking and firmly rejects the dissemination of false information targeting China for political purposes.""","['major', 'department', 'hack', 'officials', 'hacked', 'incident', 'hackers', 'china', 'systems', 'thirdparty', 'treasury', 'security']",2024-12-31,https://www.bbc.com/news/articles/c3weye2j0e7o,BBC.com,https://www.bbc.com,negative,-0.111
5,U.S. Department of the Treasury,U.S. Treasury says it was hacked by China-backed intruder - The Washington Post,,[],2024-12-31,https://www.washingtonpost.com/technology/2024/12/30/treasury-hack-china-national-security/,The Washington Post,https://www.washingtonpost.com,neutral,0.0
5,U.S. Department of the Treasury,What to know about string of US hacks blamed on China - BBC.com,"What to know about string of US hacks blamed on ChinaGetty ImagesUS officials say hackers linked to the Chinese government are responsible for breaching security at major telecommunications companies and US agencies.
For instance the group behind the telecoms hack is most commonly known by Salt Typhoon, the name given to it by researchers at Microsoft.
And millions of Americans may have had their data breached by the attacks on telecoms companies.
FBI Director Christopher Wray recently said that Salt Typhoon's hack of telecoms companies was China's ""most significant cyber-espionage campaign in history"".
EPA Outgoing FBI director Christopher Wray highlighted the threat from Chinese hackers in a farewell speechHow have Western allies responded?","['know', 'companies', 'hacks', 'chinese', 'hack', 'hackers', 'string', 'china', 'targeted', 'linked', 'blamed', 'telecoms', 'security']",2024-12-31,https://www.bbc.com/news/articles/c86w2evj05do,BBC.com,https://www.bbc.com,negative,-0.076
2,Quantum Computing,China is catching up with America in quantum technology - The Economist,"I n a SMALL shop in the eastern Chinese city of Hefei, one of the rarest pieces of technology in the world is on display.
The quantum computer in the showroom of Origin, a Chinese startup, looks ready to be plucked from the shelf and fired up.
Only 20 such devices are produced globally each year.
It is unclear what in the showroom is for sale, but none of it is supposed to be seen by foreigners.
During your correspondent’s visit, which was agreed on in advance, the company panicked at the sight of a foreigner, abruptly cancelled interviews and notified the police.","['america', 'visit', 'unclear', 'technology', 'chinese', 'startup', 'catching', 'showroom', 'sight', 'china', 'world', 'small', 'supposed', 'quantum']",2024-12-31,https://www.economist.com/business/2024/12/31/china-is-catching-up-with-america-in-quantum-technology,The Economist,https://www.economist.com,negative,-0.092
5,U.S. Department of the Treasury,Beijing denies involvement in US treasury cyber-attack - The Guardian,"Beijing has hit back at accusations that a China state-sponsored actor was behind a cyber breach at the US treasury department, calling the claims “groundless”.
Hackers were able to gain access to a key used by the vendor to override certain parts of the system, according to a letter the treasury department sent to lawmakers on Monday.
According to the treasury, the incident happened earlier this month, when the actor was able to remotely access workstations and some unclassified documents.
“Treasury takes very seriously all threats against our systems, and the data it holds,” the spokesperson added.
Beijing rejects the allegations, and has previously said that it opposes and cracks down on all forms of cyber-attack.","['access', 'involvement', 'department', 'cyberattack', 'spokesperson', 'actor', 'hackers', 'beijing', 'china', 'systems', 'breach', 'denies', 'information', 'treasury']",2024-12-31,https://www.theguardian.com/technology/2024/dec/31/beijing-denies-involvement-in-us-treasury-cyber-attack,The Guardian,https://www.theguardian.com,positive,+0.085
6,Chicago Board Options Exchange (CBOE),Financial Fresh Start - Forbes,"For alternative investments, a general rule is to maintain a 20% allocation to your liquid net worth.
Don’t overlook the unique characteristics of alternative investments, including their limited transparency and liquidity, and be sure to leverage the insights of your financial advisor to stay well-informed.
Alternative investments can help defer capital gains if you sell “winners” and don’t have enough “losers” to offset the gains.
Risk Management: Managing risk in alternatives requires careful attention to liquidity, lock-up periods, and changing economic conditions.
Most alternative investments are only available through financial advisors, and good financial advisors know the ""scuttlebutt"" of what's really going on.","['portfolio', 'start', 'investment', 'management', 'performance', 'financial', 'alternative', 'risk', 'fresh', 'information', 'public', 'investments', 'sponsor']",2024-12-31,https://www.forbes.com/sites/fredhubler/2024/12/31/financial-fresh-start/,Forbes,https://www.forbes.com,positive,+0.139
5,U.S. Department of the Treasury,"US imposes sanctions on entities in Iran, Russia over election interference - Reuters",,[],2024-12-31,https://www.reuters.com/world/us-issues-fresh-iran-russia-sanctions-over-election-interference-treasury-dept-2024-12-31/,Reuters,https://www.reuters.com,neutral,0.0
7,Misinformation,TikTok has opened the door to a new age of medical misinformation – and I’m seeing the results in A&E - The Guardian,"In the age of the internet, Googling symptoms and treatments has been common practice for patients, and sometimes even doctors.
This is because magnesium deficiency presents often with nonspecific symptoms, but medical professionals know it is uncommon in healthy people.
The Joe Rogan Experience, which is considered the most popular podcast in the world, has had a plethora of health misinformation scandals.
I am also glad that for every pseudo-influencer, there are great health content creators such as Dr Karan Rajan, who uses his platform to help provide an evidence-based approach to viewers who have concerns about their health.
Ultimately, TikTok and podcasts have the potential to be a source for effective and useful health guidance, but currently it is not quite there.","['results', 'misinformation', 'im', 'content', 'opened', 'door', 'guests', 'seeing', 'online', 'videos', 'patients', 'butt', 'levels', 'tiktok', 'rise', 'medical', 'health', 'ammad']",2024-12-30,https://www.theguardian.com/commentisfree/2024/dec/30/tiktok-online-influencers-medical-misinformation,The Guardian,https://www.theguardian.com,positive,+0.192
3,Retail investor fraud,Indian Stocks Set for Record Yearly Flows From Retail Investors - Bloomberg,"Why did this happen?
Please make sure your browser supports JavaScript and cookies and that you are not blocking them from loading.
For more information you can review our Terms of Service and Cookie Policy.","['terms', 'review', 'policy', 'sure', 'robot', 'javascript', 'loading', 'service', 'happenplease', 'information', 'supports']",2024-12-30,https://www.bloomberg.com/news/articles/2024-12-30/indian-stocks-set-for-record-yearly-flows-from-retail-investors,Bloomberg,https://www.bloomberg.com,positive,+0.23
7,Misinformation,Opinion | Misinformation. A preventable disease. These 7 Carter op-eds resonate today. - The Washington Post,,[],2024-12-30,https://www.washingtonpost.com/opinions/2024/12/30/jimmy-carter-op-eds/,The Washington Post,https://www.washingtonpost.com,neutral,0.0
5,U.S. Department of the Treasury,"China Hacked Treasury Dept. in ‘Major’ Breach, U.S. Says - The New York Times","One of China’s intelligence agencies hacked the U.S. Treasury Department, gaining access to the workstations of government employees and unclassified documents, the Biden administration said on Monday, the latest in a series of embarrassing surveillance operations against major American institutions.
It was unclear from the Treasury’s limited first account of the episode exactly what the hackers were seeking.
In a letter informing lawmakers of the episode, the Treasury Department said it had been notified on Dec. 8 by a third-party software service company, BeyondTrust, that the hacker had obtained a security key that allowed it to gain remote access to certain Treasury workstations and documents on them.
“Based on available indicators, the incident has been attributed to a China state-sponsored Advanced Persistent Threat (APT) actor,” the letter said.
“In accordance with Treasury policy, intrusions attributable to an APT are considered a major cybersecurity incident.”","['major', 'access', 'episode', 'intelligence', 'documents', 'dept', 'department', 'workstations', 'hacked', 'incident', 'china', 'breach', 'letter', 'treasury']",2024-12-30,https://www.nytimes.com/2024/12/30/us/politics/china-hack-treasury.html,The New York Times,https://www.nytimes.com,positive,+0.14
3,Fintech,U.S. files complaint against fintech app Dave and its CEO - CNBC,"Jason Wilk, chief executive officer of Dave, during TechCrunch Disrupt in San Francisco, California, US, on Monday, Oct. 28, 2024.
The U.S. Justice Department filed a complaint and announced a civil enforcement action on Monday against financial technology company Dave Inc and its CEO Jason Wilk for alleged violations of federal law.
The Justice Department and the Federal Trade Commission alleged the company lured users to its personal finance app by advertising cash advances of up to $500 that many never receive.
The complaint, filed by the Justice Department, seeks unspecified amounts of consumer redress and monetary civil penalties from the defendants and a permanent injunction to prohibit them from engaging in future violations, the Justice Department said.
The complaint filed on Monday amends and replaces an earlier complaint that the FTC filed in November, which had named only Dave as a defendant and did not seek any civil penalties.","['penalties', 'wilk', 'complaint', 'department', 'ceo', 'app', 'dave', 'files', 'justice', 'filed', 'jason', 'violations', 'civil', 'fintech']",2024-12-30,https://www.cnbc.com/2024/12/30/us-files-complaint-against-fintech-app-dave-and-its-ceo-.html,CNBC,https://www.cnbc.com,positive,+0.105
3,Options contracts,Inside the Unprecedented Boom in Options Trading - The Wall Street Journal,,[],2024-12-30,https://www.wsj.com/livecoverage/stock-market-today-dow-sp500-nasdaq-live-12-30-2024/card/inside-the-unprecedented-boom-in-options-trading-H0inicz2e85FvJC3YkYD,The Wall Street Journal,https://www.wsj.com,neutral,0.0
3,Market manipulation,Meme stocks had their moment – again – in 2024 - The Washington Post,,[],2024-12-30,https://www.washingtonpost.com/business/2024/12/30/meme-stock-faq-2024/,The Washington Post,https://www.washingtonpost.com,neutral,0.0
11,"Diversity, equity, and inclusion (DEI)",Costco Doubled Down On DEI As A Business Case: What We Can All Learn - Forbes,"During their upcoming shareholder meeting, the Costco board of directors will be asked to vote on a shareholder proposal to address the risk of their DEI efforts.
“PROPOSAL 4: SHAREHOLDER PROPOSAL REQUESTING REPORT ON THE RISKS OF MAINTAINING DEI EFFORTSThe following shareholder proposal has been submitted to the Company for action at the Annual Meeting by the National Center for Public Policy Research.
COLCHESTER, VERMONT - APRIL 3: A customer moves through the check out lane with his groceries at a ... [+] Costco Wholesale store on April 3, 2024 in Colchester, Vermont.
(Photo by Robert Nickelsberg/Getty Images) Getty ImagesOur success at Costco Wholesale has been built on service to our critical stakeholders: employees, members, and suppliers.
And by watching companies like Costco tackle these issues in the boardroom, we can see why DEI is worth defending.","['dei', 'case', 'wholesale', 'trillion', 'proposal', 'board', 'diversity', 'costco', 'learn', 'shareholder', 'business', 'employees', 'doubled', 'power']",2024-12-30,https://www.forbes.com/sites/dougmelville/2024/12/30/costco-doubled-down-on-dei-as-a-business-case-what-we-can-all-learn/,Forbes,https://www.forbes.com,positive,+0.055
2,Nation-state actors,US Treasury Says It Was Breached by Chinese-Backed Hacker - Bloomberg,"Why did this happen?
Please make sure your browser supports JavaScript and cookies and that you are not blocking them from loading.
For more information you can review our Terms of Service and Cookie Policy.","['terms', 'review', 'policy', 'sure', 'robot', 'javascript', 'loading', 'service', 'happenplease', 'information', 'supports']",2024-12-30,https://www.bloomberg.com/news/articles/2024-12-30/us-treasury-says-it-was-hacked-by-chinese-state-sponsored-actor,Bloomberg,https://www.bloomberg.com,positive,+0.23
2,Quantum Computing,The Quantum Cybersecurity Revolution: Arguably The Biggest Startup Opportunity In 2025 - Forbes,"Among the most affected fields is cybersecurity, because the threat of quantum decryption makes many of the current cybersecurity systems obsolete.
The Problem: The Threat Of Quantum DecryptionThe most direct impact of quantum computing on cybersecurity is its ability to undermine current encryption methods.
Quantum Computing For Cyber DefenseQuantum computing is not just a threat to cybersecurity but also a potential tool for defense.
The Growing Importance Of CollaborationAddressing the cybersecurity implications of quantum computing requires global collaboration among governments, academia, and the private sector.
Startups also play a key role, as they often pioneer specialized solutions in encryption, threat detection, and secure communication.","['computers', 'arguably', 'computing', 'companies', 'cybersecurity', 'startup', 'data', 'biggest', 'systems', 'methods', 'opportunity', 'revolution', '2025', 'threat', 'quantum', 'encryption']",2024-12-30,https://www.forbes.com/sites/abdoriani/2024/12/30/the-quantum-cybersecurity-revolution-arguably-the-biggest-startup-opportunity-in-2025/,Forbes,https://www.forbes.com,positive,+0.153
2,Cyberattacks,New Windows Security Warning As Russian Cyberattacks Confirmed - Forbes,"Paper Werewolf target Word users.
Forbes Critical Gmail Warning—Don’t Click Yes To These Google Security AlertsThe Windows Werewolf Attack MethodologyLike so many other attack campaigns, Paper Werewolf uses phishing emails and brand impersonation to distribute its malicious payload.
These messages contain an encrypted Microsoft Word document that prompts the recipient to enable macros, yes, I know, in order to read it.
The threat intelligence analysts said that, in some instances, they observed the use of PowerRAT, a remote access trojan, enabling the attackers to execute commands and carry out reconnaissance.
I would also strongly recommend all readers go and read this fascinating discussion about what really has to change if we are ever to stop the email phishing threat.","['microsoft', 'warning', 'word', 'phishing', 'intelligence', 'paper', 'target', 'werewolf', 'confirmed', 'windows', 'threat', 'cyberattacks', 'russian', 'security', 'attack']",2024-12-30,https://www.forbes.com/sites/daveywinder/2024/12/30/windows-werewolf-warning-as-7-russian-spy-attacks-confirmed/,Forbes,https://www.forbes.com,negative,-0.147
8,Bird Flu,CDC scientist responds to Dr. Birx raising alarm over handling of bird flu - CNN,"How relevant is this ad to you?
Video player was slow to load content Video content never loaded Ad froze or did not finish loading Video content did not start after ad Audio on ad was too loud Other issues","['player', 'relevant', 'scientist', 'cdc', 'ad', 'flu', 'bird', 'birx', 'alarm', 'loading', 'loud', 'responds', 'slow', 'start', 'raising', 'handling', 'content', 'dr', 'youvideo', 'video']",2024-12-30,https://www.cnn.com/2024/12/30/health/video/cdc-bird-flu-response-reaction-digvid,CNN,https://www.cnn.com,neutral,1.0
5,U.S. Department of the Treasury,U.S. Treasury says Chinese hackers stole documents in 'major incident' - CNBC,"The U.S. Treasury Department said a state-sponsored Chinese hacking operation was able to access third-party software to tap into desktop computers of Treasury employees in what the department is calling ""a major incident.""
In a letter seen by NBC News, Aditi Hardikar, assistant secretary for management of the U.S. Department of the Treasury, wrote that the office was notified on Dec. 8 of the breach.
The information accessed by the ""threat actor"" included unclassified documents, according to the letter.
With this access, the ""threat actor"" was able to override certain security measures and get into the department's user workstations.
Fellow agencies helped the U.S. Treasury deduce that the breach came from a Chinese hackers, according to the letter.","['computers', 'major', 'access', 'service', 'actor', 'chinese', 'department', 'wrote', 'hacked', 'incident', 'used', 'letter', 'thirdparty', 'threat', 'treasury']",2024-12-30,https://www.cnbc.com/2024/12/30/us-treasury-says-chinese-hackers-stole-documents-in-major-incident-.html,CNBC,https://www.cnbc.com,positive,+0.091
8,Bird Flu,"Raw food for pets is all the rage. Is the fad worth the risk of bird flu, salmonella? - USA TODAY","In recent weeks, at least three house cats died after eating raw foods contaminated with bird flu: one in Oregon fed raw turkey and two in California given raw milk.
Raw food diets began becoming popular around 10 years ago and took off during the pandemic, she said.
Raw pet food contamination fuels multiple recallsU.S. Food and Drug Administration studies dating back to 2012 have found that raw pet foods are far more likely to carry disease.
""There's been heavy marketing to make consumers think that raw food diets are healthier but that’s not necessarily the case,"" Sykes said.
The 'raw food diet' is an online fad.But, can dogs eat raw meat?","['foods', 'company', 'fad', 'raw', 'pets', 'diet', 'bird', 'worth', 'rage', 'risk', 'food', 'pet', 'diets', 'health', 'turkey', 'salmonella', 'flu']",2024-12-30,https://www.usatoday.com/story/news/nation/2024/12/30/raw-pet-food-recall-deaths-what-to-know/77245033007/,USA TODAY,https://www.usatoday.com,negative,-0.036
