ENTERPRISE_RISK_ID,SEARCH_TERMS,TITLE,SUMMARY,KEYWORDS,PUBLISHED_DATE,LINK,SOURCE,SOURCE_URL,SENTIMENT,POLARITY
2,Conti,New Orleans new year celebrations turn to terror and tragedy - BBC.com,"The rev of an engine and then screams - how revelry turned to mayhem in New OrleansPeople run to escape amid New Orleans truck attackNew Orleans was in full swing in the early morning hours of New Year's Day.
""We just heard this squeal, the rev of an engine and a huge, loud impact,"" Kimberly Stricklen, a visitor to New Orleans, told Reuters.
Who were the victims of New Orleans attack?
The barriers put in place years ago to prevent vehicles from entering Bourbon Street were in the process of being replaced so there were gaps.
Reuters A woman leaves flowers near the site of the attack in New Orleans.","['terror', 'vehicles', 'vehicle', 'told', 'albert', 'orleans', 'car', 'bourbon', 'tragedy', 'street', 'attack', 'truck', 'celebrations', 'turn']",2025-01-02,https://www.bbc.com/news/articles/cdjg0r2p49xo,BBC.com,https://www.bbc.com,negative,-0.09
3,Fintech,"Regulation, Deals and Crypto: Fintech Themes to Watch in 2025 - Bloomberg","Why did this happen?
Please make sure your browser supports JavaScript and cookies and that you are not blocking them from loading.
For more information you can review our Terms of Service and Cookie Policy.","['terms', 'review', 'policy', 'sure', 'robot', 'javascript', 'loading', 'service', 'happenplease', 'information', 'supports']",2025-01-01,https://www.bloomberg.com/news/articles/2025-01-01/regulation-deals-and-crypto-fintech-themes-to-watch-in-2025,Bloomberg,https://www.bloomberg.com,positive,+0.23
8,Bird Flu,‘Worrisome’ mutations found in H5N1 bird flu virus isolated from Canadian teenager - Los Angeles Times,"A California Department of Food and Agriculture technician perform tests on chickens for bird flu in 2006 at the Best Live Poultry & Fish store in Sylmar.
The fate of a Canadian teenager who was infected with H5N1 bird flu in early November, and subsequently admitted to an intensive care unit, has finally been revealed: She has fully recovered.
AdvertisementThere have been a total of 66 reported human cases of H5N1 bird flu in the U.S. in 2024.
She tested negative for the predominant human seasonal influenza viruses — but had a high viral loads of influenza A, which includes the major human seasonal flu viruses, as well as H5N1 bird flu.
This finding prompted her caregivers to test for bird flu; she tested positive.","['virus', 'isolated', 'bird', 'human', 'days', 'worrisome', 'tested', 'h5n1', 'teenager', 'mutations', 'disease', 'severe', 'canadian', 'flu', 'nov']",2025-01-01,https://www.latimes.com/environment/story/2024-12-31/worrisome-mutations-found-in-h5n1-bird-flu-virus-isolated-from-canadian-teenager,Los Angeles Times,https://www.latimes.com,negative,-0.141
8,Bird Flu,Another raw pet food H5N1 bird flu recall. More sick cats in L.A. County - Los Angeles Times,"After another raw pet food recall and a cluster of H5N1 bird-flu-infected cats, Los Angeles county public health officials are re-upping their warning to pet owners: Stop feeding your dogs and cats raw pet food.
A recall has been issued on San Jacinto-based Monarch Raw Pet Food, whose raw poultry products are sold at several farmers markets in California.
The recall came after H5N1 bird flu was detected in product samples.
AdvertisementThe announcement comes on the heels of several warnings regarding pet cats and bird flu in the county.
There have been no human cases of bird flu identified yet as associated with exposure to these cats.","['la', 'raw', 'sick', 'county', 'bird', 'cats', 'food', 'pet', 'h5n1', 'health', 'public', 'recall', 'products', 'flu']",2025-01-01,https://www.latimes.com/environment/story/2024-12-31/another-raw-pet-food-h5n1-bird-flu-recall-more-sick-cats-in-la-county,Los Angeles Times,https://www.latimes.com,negative,-0.144
8,Bird Flu,"Bird flu, brain rot and booze – the health issues you’ll be hearing more about in 2025 - The Guardian","So first with the not so cheery news: bird flu will continue its worrying prominence.
California has also issued a state of emergency over the growing number of humans infected with the disease and concerns it could mutate further.
Linked to mental health, I bet we will see more regulation of social media use by adolescents in the coming year.
We now have scientific evidence that extended periods of screen time, especially on social media platforms, is detrimental to mental health.
This year is likely to bring more evidence on the harmful effects alcohol has on our bodies, especially cancer risk.","['good', 'booze', 'humans', 'hearing', 'cancer', 'evidence', 'alcohol', 'flu', 'infected', 'social', 'youll', 'brain', 'malaria', 'devi', 'sridhar', 'issues', 'media', 'rot', 'health']",2025-01-01,https://www.theguardian.com/commentisfree/2025/jan/01/bird-flu-public-health-issues-2025-pandemic-social-media-alcohol,The Guardian,https://www.theguardian.com,negative,-0.185
3,Cryptocurrency,‘This Will Be Priceless’—Elon Musk Just Quietly Blew Up The Price Of This Bitcoin Rival - Forbes,"The bitcoin price has dropped back from its post-election peak of almost $110,000 per bitcoin, with the price predicted to be just weeks away from a ""major"" move.
Now, as Musk issues a stark U.S. bankruptcy warning, the Tesla billionaire has changed his name on X—sending the price of a small bitcoin rival surging by around 2,000%.
Musk's post quoted the Adrian Dittmann account that some have speculated could be controlled by Musk, though he has denied this.
""Imagine you're a journalist who's writing about Elon on X and it goes: 'Elon Musk, aka 'Kekius Maximus' on X...,'"" Dittmann posted.
Musk's name change on X sent the price of the cryptocurrency kekius maximus, created in mid-December following a Musk X post, up by around 2,000%, highlighting Musk's out sized influence over the bitcoin and crypto market.","['cryptocurrency', 'x', 'crypto', 'pricelesselon', 'musk', 'tesla', 'bitcoin', 'rival', 'maximus', 'elon', 'price', 'kekius', 'quietly', 'blew']",2025-01-01,https://www.forbes.com/sites/digital-assets/2025/01/01/this-will-be-priceless-elon-musk-just-quietly-blew-up-the-price-of-this-bitcoin-rival/,Forbes,https://www.forbes.com,negative,-0.038
3,Fintech,"Regulation, Deals and Crypto: Fintech Themes to Watch in 2025 - Bloomberg","Why did this happen?
Please make sure your browser supports JavaScript and cookies and that you are not blocking them from loading.
For more information you can review our Terms of Service and Cookie Policy.","['terms', 'review', 'policy', 'sure', 'robot', 'javascript', 'loading', 'service', 'happenplease', 'information', 'supports']",2025-01-01,https://www.bloomberg.com/news/articles/2025-01-01/regulation-deals-and-crypto-fintech-themes-to-watch-in-2025?utm_source=google&utm_medium=bd&cmpId=google,Bloomberg,https://www.bloomberg.com,positive,+0.23
11,"Diversity, equity, and inclusion (DEI)",Costco Is Caught In The Crosshairs Of The DEI Controversy - Forbes,"Our efforts around diversity, equity and inclusion follow our code of ethics,” Costco Board of Directors stated.
Forbes In Costco’s Defense Of DEI Efforts, Lessons For Business LeadersNow Costco, the nation’s third-largest retailer after number one Walmart and number two Amazon, is embroiled in the politically and emotionally-charged DEI controversy as calls for a Costco boycott are beginning to emerge, according to Newsweek.
Nasdaq Board Diversity Rule VacatedFurther evidence emerged in December when a Federal Court vacated the Securities and Exchange Commission’s (SEC) approval of a proposed Nasdaq board diversity rule.
Risks RealAsking Costco to objectively and rigorously study the risks associated with its DEI policies and practices is compelling.
To which, Costco seems to say, “Bring it on.”Note: Costco did not respond to a request for comment.","['dei', 'controversy', 'risks', 'study', 'proposal', 'caught', 'research', 'shareholders', 'diversity', 'costco', 'board', 'business', 'crosshairs']",2025-01-01,https://www.forbes.com/sites/pamdanziger/2025/01/01/costco-is-caught-in-the-crosshairs-of-the-dei-controversy/,Forbes,https://www.forbes.com,positive,+0.094
4,Fee-based accounts,Looking to sell your extra stuff? Here are the best resale apps and websites so you can make some extra cash - CNBC,"It's a popular platform for selling items in person, and there's also a shipping option — but it isn't free.
However, there are a number of fees that Etsy sellers incur: a listing fee, a payment processing fee and a shipping fee.
Shipping costs Either the buyer or seller can cover the cost of shipping; shipping labels are generated by Mercari and costs depend on the weight and dimensions of your package.
You also don't pay shipping fees since they're the buyer's responsibility.
For the most part, you'll need to pay a variety of fees to sell on these apps and websites.","['cash', 'items', 'looking', 'stuff', 'shipping', 'pay', 'resale', 'best', 'fee', 'sell', 'apps', 'listing', 'fees', 'youll', 'item', 'selling', 'websites', 'extra']",2025-01-01,https://www.cnbc.com/select/best-resale-apps-and-websites/,CNBC,https://www.cnbc.com,negative,-0.048
4,Fee-based accounts,5 best free budgeting tools of January 2025 - CNBC,"How to choose a free budgeting toolWhen choosing a budgeting tool, first decide what your financial goals are.
Pros and cons of budgeting toolsWhile free budgeting tools come with a lot of pros, they also have a few drawbacks.
Pros of budgeting tools Consolidates your finances: Many budgeting tools will allow you to see all your financial info, even across banks, in one simple location.
See our methodology for more information on how we choose the best free budgeting tools.
Our methodologyTo determine which free budgeting tools offer the best user experience, CNBC Select analyzed over a dozen different budgeting tools and looked at their features and user reviews.","['spending', 'users', 'tools', 'expenses', 'accounts', 'money', 'best', 'financial', 'budgeting', '2025', 'free', 'features']",2025-01-01,https://www.cnbc.com/select/best-free-budgeting-tools/,CNBC,https://www.cnbc.com,positive,+0.187
4,Fee-based accounts,Start saving up for your kid's college years today with these top 529 accounts - CNBC,"Bright Start College Savings (Illinois)Bright Start College Savings (Illinois) Learn More Information about Bright Start College Savings has been collected independently by CNBC Select and has not been reviewed or provided by the issuer prior to publication.
New York's 529 College Savings ProgramNew York's 529 College Savings Program Learn More Information about New York's 529 College Savings Program has been collected independently by CNBC Select and has not been reviewed or provided by the issuer prior to publication.
Oregon College Savings PlanOregon College Savings Plan Learn More Information about Oregon College Savings Plan has been collected independently by CNBC Select and has not been reviewed or provided by the issuer prior to publication.
529 college savings plan FAQs529 plan rulesAlthough 529 education savings accounts are traditionally used for covering future college costs, they're not limited to that.
Otherwise, you can open separate 529 college savings accounts for each child.","['529', 'minimum', 'options', 'plan', 'accounts', 'start', 'college', 'today', 'funds', 'investment', 'kids', 'contribution', 'saving', 'savings', 'account']",2025-01-01,https://www.cnbc.com/select/best-529-plans/,CNBC,https://www.cnbc.com,positive,+0.05
4,Fee-based accounts,Best budgeting apps of January 2025 - CNBC,"Pros and cons of budgeting appsPros Convenience : Budgeting apps typically allow you to see all of your financial data in one convenient place.
Privacy: Since budgeting apps often link to your finances, it's important to research data and privacy offerings before entering personal information.
Many budgeting apps come with other services, such as monitoring your savings, investments, debts and/or your credit score.
There are plenty of free budgeting apps on the market if you don't want to invest in one.
See our methodology for more information on how we choose the best budgeting apps.","['yes', 'users', 'expenses', 'accounts', 'best', 'apps', 'app', 'budgeting', '2025', 'bank', 'free', 'features']",2025-01-01,https://www.cnbc.com/select/best-budgeting-apps/,CNBC,https://www.cnbc.com,positive,+0.133
4,Fee-based accounts,Best debit cards that offer rewards in January 2025 - CNBC,"Discover® Cashback Debit Checking is a great choice if you're looking for a straightforward rewards program for your debit card.
Unlike many rewards debit cards that offer cash back with capped limits, there's no limit on the rewards you can earn with this debit card.
You earn rewards on your debit card by spending money with your debit card.
See our methodology for more information on how we choose the best rewards debit cards.
Our methodologyTo determine which rewards debit cards were the best, CNBC Select analyzed some of the most popular rewards debit cards on the market.","['account', 'cards', '2025', 'card', 'debit', 'checking', 'best', 'earn', 'rewards', 'fee', 'deposit', 'fees', 'offer', 'cash']",2025-01-01,https://www.cnbc.com/select/best-debit-cards-that-offer-rewards/,CNBC,https://www.cnbc.com,positive,+0.296
7,Misinformation,UK government hires ‘nudge unit’ to help dispel heat pump myths - The Guardian,"Experts from a “nudge unit” have been hired to help ministers fight misinformation about heat pumps to try to encourage take-up of the devices.
It found that individuals who self-reported that they knew a fair amount or a lot about heat pumps were less likely to want one.
However, people who correctly answered a simple knowledge question about heat pumps were more likely to want one.
In terms of the claims, experts say the majority of households are expected to be able to use heat pumps, rather than just newer ones.
It was also found that, on average, heat pumps were far more efficient than gas boilers, turning one unit of electricity into 2.5-5 units of heat.","['uk', 'unit', 'newsletter', 'misinformation', 'myths', 'media', 'nudge', 'dispel', 'pumps', 'work', 'stakeholders', 'pump', 'privacy', 'help', 'hires', 'heat', 'gas']",2025-01-01,https://www.theguardian.com/environment/2025/jan/01/uk-government-dispel-heat-pump-myths-misinformation-media,The Guardian,https://www.theguardian.com,positive,+0.109
4,Fee-based accounts,12 best CD rates of January 2025: Up to 4.65% APY - CNBC,"Annual Percentage Yield (APY) From 3.10% to 4.15% APYTerms From 3 months to 60 monthsMinimum balance $1,000 minimum depositMonthly fee NoneEarly withdrawal penalty fee Early withdrawal penalty may apply.
Annual Percentage Yield (APY) From 3.80% to 4.50% APYTerms From 1 year to 5 yearsMinimum balance $1,500 minimum depositMonthly fee NoneEarly withdrawal penalty fee Early withdrawal penalty applies.
Annual Percentage Yield (APY) From 2.00% to 4.00% APYTerms From 3 months to 10 yearsMinimum balance N/AMonthly fee NoneEarly withdrawal penalty fee Early withdrawal penalty applies.
Unlike the rates you find with traditional and high-yield savings accounts, CD rates are fixed, meaning they stay the same for the life of the CD term.
Your earnings depend on the CD term length, the amount you deposit, the APY offered when you opened the account and any associated fees.","['465', 'terms', 'withdrawal', 'days', 'apy', 'best', 'months', 'fee', 'cds', 'interest', 'penalty', 'cd', '2025', 'term', 'rates', '12']",2025-01-01,https://www.cnbc.com/select/best-certificates-of-deposits/,CNBC,https://www.cnbc.com,negative,-0.123
4,Fee-based accounts,The best business checking accounts of January 2025 - CNBC,"Best for small businessesBluevine Business Checking Learn More On Bluevine's secure site Special offer Secure a *$300 bonus by applying for a Bluevine Business Checking account using the referral code CNBC300 before 12/31/2024.
Novo Business Checking is worth considering if you want to establish a business presence and separate your personal and business finances.
[ Jump to more details ]Best for ATM accessAxos Basic Business Checking Learn More Special offer Business owners get up to $400 welcome bonus!
Nearly anyone with a side hustle or small business can qualify for a business checking account — not just large corporations.
Our methodologyTo determine which business checking accounts offer the most convenience, CNBC Select analyzed dozens of U.S. business checking accounts offered nationwide by online banks as well as those with physical branches.","['minimum', 'open', 'monthly', 'accounts', 'checking', 'best', 'balance', 'fee', 'apy', 'deposit', '2025', 'business', 'account']",2025-01-01,https://www.cnbc.com/select/best-business-checking-accounts/,CNBC,https://www.cnbc.com,positive,+0.227
4,Fee-based accounts,Best high-yield savings accounts of January 2025 - CNBC,"[ Jump to more details ]Find the right savings account for youMore on our top high-yield savings accountsWestern Alliance Bank Savings AccountThe Western Alliance Bank High-Yield Savings Account is powered by Raisin, meaning accounts are opened and managed through the Raisin.com platform.
Compare the best high-yield savings accounts Savings account Minimum deposit Monthly fee Withdrawal/transfer limit ATM card with savings account?
Ally Bank Savings Account None None Unlimited No American Express High Yield Savings Account $0 $0 Unlimited No Bask Bank Mileage Savings Account None None Up to 6/month No Capital One 360 Performance Savings None None Up to 6/month No CIT Bank Platinum Savings $100 None Up to 6/month No Jenius Bank None None Unlimited No LendingClub LevelUp Savings None None Unlimited Yes Marcus by Goldman Sachs High-Yield Online Savings Account None None Unlimited No Newtek Bank Personal High Yield Savings $0.01 None Up to 6/month No Openbank High Yield Savings $500 None Unlimited No SoFi Checking and Savings None None Up to 6/month Yes Synchrony Bank High Yield Savings None None Up to 6/month Yes UFB Secure Savings None None Up to 6/month Yes Varo Online Savings Account $0.01 None Up to 6/month No Western Alliance Bank High-Yield Savings Account $1 None Up to 6/month NoWhat is a high-yield savings account?
The main difference between high-yield savings accounts and traditional savings accounts is that high-yield savings accounts offer higher interest rates, which in turn allow your money to grow faster.
Also, unlike traditional savings accounts, high-yield savings accounts are generally offered by online banks that don't have physical branch locations.","['minimum', 'monthly', 'accounts', 'best', 'apy', 'fee', 'transactions', 'deposit', 'highyield', '2025', 'bank', 'savings', 'account']",2025-01-01,https://www.cnbc.com/select/best-high-yield-savings-accounts/,CNBC,https://www.cnbc.com,positive,+0.089
3,Fintech,The Dangerous Disconnect Between Fintech Hype And Reality - Forbes,"The collapse of fintech companies like Synapse and Tally highlights a harsh truth about fintech failure: ""new"" solutions are often just dressed-up versions of outdated systems.
These failures exposed a critical flaw in the fintech world: the disconnect between consumer-facing promises and the opaque, outdated systems powering these solutions.
The Hidden Pitfalls of Fintech: Evolve and Synapse’s FailuresSynapse, a fintech, partnered with Evolve, a small to open accounts and issue debit cards to consumers.
Getty ImagesThe Synapse collapse highlights a fatal flaw in fintech innovation.
To succeed, fintech solutions must be built on solid foundations - not just flashy promises.","['accounting', 'evolve', 'human', 'fintech', 'solutions', 'synapse', 'dangerous', 'customers', 'financial', 'reality', 'highlights', 'hype', 'innovation', 'disconnect']",2025-01-01,https://www.forbes.com/sites/ilonalimonta-volkova/2025/01/01/the-dangerous-disconnect-between-fintech-hype-and-reality/,Forbes,https://www.forbes.com,negative,-0.196
11,Wage Growth,"‘Hopefully, I’ll pay off my Covid debt’: what Britons want for their finances in 2025 - The Guardian","Ashley, 33, a marketing specialist from Leicester‘Hopefully, I’ll pay off my Covid debt’I’m hoping to finally pay off the hideous debt load I was put in during Covid.
But income tax, council tax and utility bill rises, as well as increased student loan contributions, mean that I’m still around £60 per month worse off than this time last year.
I’m generally happy with how my finances are, have zero debt outside of mortgage and monthly credit card usage, which is low.
A 38-year-old paramedic from Leicestershire‘I hope to secure full-time work to support my family’View image in fullscreen Rachel, from Edinburgh, with her four-year-old son.
Having to pay for medical treatment [because of untenable waits to be seen on the NHS] blows a huge hole into financial planning.","['income', 'tax', 'secure', 'finances', 'pay', 'debt', 'buy', 'hope', 'student', 'britons', 'working', 'covid', 'work', 'able', '2025', 'ill', 'hopefully']",2024-12-31,https://www.theguardian.com/money/2024/dec/31/what-britons-want-for-their-finances-in-2025,The Guardian,https://www.theguardian.com,positive,+0.185
5,Senate Banking Committee,U.S. Treasury says it was hacked by China-backed intruder - The Washington Post,,[],2024-12-31,https://www.washingtonpost.com/technology/2024/12/30/treasury-hack-china-national-security/,The Washington Post,https://www.washingtonpost.com,neutral,0.0
8,Bird Flu,"France reports bird flu on two farms, losing disease-free status - Reuters",,[],2024-12-31,https://www.reuters.com/business/healthcare-pharmaceuticals/france-reports-bird-flu-two-farms-losing-disease-free-status-2024-12-31/,Reuters,https://www.reuters.com,neutral,0.0
3,Fintech,Fintech's 2025 playbook: Here's what to watch - CNBC,"In this videoShare Share Article via Facebook Share Article via Twitter Share Article via LinkedIn Share Article via EmailFintech's 2025 playbook: Here's what to watchMalcolm Ethridge, managing partner at Capital Area Planning Group, joins CNBC's ‘Halftime Report’ to discuss his 2025 investing playbook.","['playbook', 'partner', 'share', 'fintechs', 'heres', 'report', 'planning', 'article', 'watchmalcolm', 'twitter', 'videoshare', '2025', 'watch']",2024-12-31,https://www.cnbc.com/video/2024/12/31/fintechs-2025-playbook-heres-what-to-watch.html,CNBC,https://www.cnbc.com,positive,+0.184
5,House financial services committee,‘Major incident’: China-backed hackers breached US Treasury workstations - CNN,"“There is no evidence indicating the threat actor has continued access to Treasury systems or information,” the Treasury spokesperson said.
Treasury officials plan to hold a classified briefing about the breach next week with staffers from the House Financial Services Committee, a senior committee staffer told CNN.
“With access to the stolen key, the threat actor was able to override the service’s security, remotely access certain Treasury [Departmental Office] user workstations, and access certain unclassified documents maintained by those users,” the Treasury letter said.
However, the Treasury spokesperson said in the statement that “several” Treasury user workstations were accessed.
Hardikar said in the letter that based on Treasury policy, intrusions attributed to advanced persistent threat actors are considered a “major cybersecurity incident.” Treasury officials are required to provide an update in a 30-day supplemental report.","['access', 'chinabacked', 'spokesperson', 'actor', 'workstations', 'breached', 'hackers', 'incident', 'officials', 'letter', 'service', 'threat', 'treasury']",2024-12-31,https://www.cnn.com/2024/12/30/investing/china-hackers-treasury-workstations/index.html,CNN,https://www.cnn.com,positive,+0.158
11,Wage Growth,U.S. Credit Card Defaults Hit Post-Great Recession High - Forbes,"Understandably why, because about 69% of gross domestic product — GDP, the typical economic measure — is consumer spending.
A red flag of credit card defaults has gone up that should make everyone take much greater care.
Why consumer spending is criticalWithout that seemingly indefatigable consumer spending engine, things would freeze up.
Credit card defaults skyrocketThe Financial Times recently ran an article on how U.S. credit card loan defaults are at their highest level since the 2008 financial crisis.
Maybe people can keep their credit use in safe hands, but with credit card defaults on the rise, concern about the economy is the least people can offer.","['spending', 'economy', 'card', 'loan', 'things', 'inflation', 'consumer', 'defaults', 'financial', 'hit', 'credit', 'recession', 'postgreat', 'high']",2024-12-31,https://www.forbes.com/sites/eriksherman/2024/12/31/us-credit-card-defaults-hit-post-great-recession-high/,Forbes,https://www.forbes.com,positive,+0.148
