ENTERPRISE_RISK_ID,SEARCH_TERMS,TITLE,SUMMARY,KEYWORDS,PUBLISHED_DATE,LINK,SOURCE,SOURCE_URL,SENTIMENT,POLARITY,LAST_RUN_TIMESTAMP
11,Wage Growth,Workers in these states just got a pay raise - CNN,"In turn, labor movement activity has swelled — as have pushes for a $17 federal minimum wage.
The federal minimum wage continues to sit at $7.25 an hour, a rate that hasn’t budged since 2009.
California, on April 1, 2024, implemented a sectoral minimum wage hike for fast food workers in the state, raising their base pay by $4 to $20 an hour.
“Firms offset [minimum wage increases] with new revenues, but workers get substantially larger incomes.”And, for those workers, wage boosts can have an immeasurable effect.
“This goes without saying but $1,500 to a minimum wage worker is a very large change in their earnings.”","['federal', 'california', 'states', 'pay', 'raise', 'increases', 'economic', 'minimum', 'recent', 'wage', 'state', 'workers']",2025-01-02,https://www.cnn.com/2025/01/02/economy/us-states-minimum-wage-2025/index.html,CNN,https://www.cnn.com,positive,+0.027,2025-01-03 19:43:00.708819
7,Deepfakes,"The dangers of deepfakes, how to quiet food noise, movie preview: Catch up on the day’s stories - CNN","Editor’s Note: CNN’s 5 Things newsletter is your one-stop shop for the latest headlines and fascinating stories to start and end your busy day.
3️⃣ ‘An insatiable itch’: You might be familiar with that relentless internal chatter about food that many people experience.
Here’s why some are turning to weight-loss medications to help quiet food noise.
5️⃣ Movie preview: After a year filled with mutants, aliens, gladiators and witches, there’s a new crop of films on the horizon.
Good vibes❤️‍🩹 Parents united: Gabby Petito’s father is turning tragedy into purpose by advocating for missing people of color.","['food', 'parents', 'theyre', 'things', 'space', 'days', 'headlines', 'preview', 'deepfakes', 'catch', 'cnns', 'turning', 'dangers', 'quiet', 'noise', 'thats', 'movie', 'start']",2025-01-02,https://www.cnn.com/2025/01/02/us/5-things-pm-january-2-trnd/index.html,CNN,https://www.cnn.com,positive,+0.117,2025-01-03 19:43:00.708819
7,Deepfakes,Deepfakes can cause long-lasting damage to children - CNN,"Fifteen percent of students and 11% of teachers were aware of deepfakes of people at their school that were intimate or sexually explicit.
With schools often failing to take measures to protect students, parents need to talk to their kids about why they should never create or engage with intimate deepfakes.
Educating kids about the harmsEven when deepfakes aren’t real, parents should discuss that their harms can be.
She said parents should make sure kids know that if they see deepfakes they can come to them for help without worrying about being punished.
Parents can reach out to a lawyer if they or their child are victims, and Lieberman said victims shouldn’t assume they can’t afford one.","['parents', 'need', 'schools', 'know', 'victims', 'lieberman', 'deepfakes', 'social', 'school', 'students', 'kids']",2025-01-02,https://www.cnn.com/2025/01/02/health/deepfakes-social-media-wellness/index.html,CNN,https://www.cnn.com,negative,-0.134,2025-01-03 19:43:00.708819
7,Misinformation,UK government hires ‘nudge unit’ to help dispel heat pump myths - The Guardian,"Experts from a “nudge unit” have been hired to help ministers fight misinformation about heat pumps to try to encourage take-up of the devices.
It found that individuals who self-reported that they knew a fair amount or a lot about heat pumps were less likely to want one.
However, people who correctly answered a simple knowledge question about heat pumps were more likely to want one.
In terms of the claims, experts say the majority of households are expected to be able to use heat pumps, rather than just newer ones.
It was also found that, on average, heat pumps were far more efficient than gas boilers, turning one unit of electricity into 2.5-5 units of heat.","['newsletter', 'pump', 'dispel', 'uk', 'misinformation', 'pumps', 'nudge', 'myths', 'help', 'heat', 'work', 'stakeholders', 'media', 'privacy', 'gas', 'hires', 'unit']",2025-01-01,https://www.theguardian.com/environment/2025/jan/01/uk-government-dispel-heat-pump-myths-misinformation-media,The Guardian,https://www.theguardian.com,positive,+0.109,2025-01-03 19:43:00.708819
4,Fee-based accounts,Looking to sell your extra stuff? Here are the best resale apps and websites so you can make some extra cash - CNBC,"It's a popular platform for selling items in person, and there's also a shipping option — but it isn't free.
However, there are a number of fees that Etsy sellers incur: a listing fee, a payment processing fee and a shipping fee.
Shipping costs Either the buyer or seller can cover the cost of shipping; shipping labels are generated by Mercari and costs depend on the weight and dimensions of your package.
You also don't pay shipping fees since they're the buyer's responsibility.
For the most part, you'll need to pay a variety of fees to sell on these apps and websites.","['resale', 'best', 'items', 'looking', 'apps', 'item', 'pay', 'cash', 'youll', 'stuff', 'websites', 'fee', 'selling', 'sell', 'listing', 'shipping', 'extra', 'fees']",2025-01-01,https://www.cnbc.com/select/best-resale-apps-and-websites/,CNBC,https://www.cnbc.com,negative,-0.048,2025-01-03 19:43:00.708819
3,Fintech,The Dangerous Disconnect Between Fintech Hype And Reality - Forbes,"The collapse of fintech companies like Synapse and Tally highlights a harsh truth about fintech failure: ""new"" solutions are often just dressed-up versions of outdated systems.
These failures exposed a critical flaw in the fintech world: the disconnect between consumer-facing promises and the opaque, outdated systems powering these solutions.
The Hidden Pitfalls of Fintech: Evolve and Synapse’s FailuresSynapse, a fintech, partnered with Evolve, a small to open accounts and issue debit cards to consumers.
Getty ImagesThe Synapse collapse highlights a fatal flaw in fintech innovation.
To succeed, fintech solutions must be built on solid foundations - not just flashy promises.","['solutions', 'synapse', 'dangerous', 'customers', 'disconnect', 'hype', 'highlights', 'fintech', 'financial', 'innovation', 'human', 'evolve', 'accounting', 'reality']",2025-01-01,https://www.forbes.com/sites/ilonalimonta-volkova/2025/01/01/the-dangerous-disconnect-between-fintech-hype-and-reality/,Forbes,https://www.forbes.com,negative,-0.196,2025-01-03 19:43:00.708819
3,Cryptocurrency,‘This Will Be Priceless’—Elon Musk Just Quietly Blew Up The Price Of This Bitcoin Rival - Forbes,"The bitcoin price has dropped back from its post-election peak of almost $110,000 per bitcoin, with the price predicted to be just weeks away from a ""major"" move.
Now, as Musk issues a stark U.S. bankruptcy warning, the Tesla billionaire has changed his name on X—sending the price of a small bitcoin rival surging by around 2,000%.
Musk's post quoted the Adrian Dittmann account that some have speculated could be controlled by Musk, though he has denied this.
""Imagine you're a journalist who's writing about Elon on X and it goes: 'Elon Musk, aka 'Kekius Maximus' on X...,'"" Dittmann posted.
Musk's name change on X sent the price of the cryptocurrency kekius maximus, created in mid-December following a Musk X post, up by around 2,000%, highlighting Musk's out sized influence over the bitcoin and crypto market.","['rival', 'bitcoin', 'kekius', 'elon', 'quietly', 'crypto', 'price', 'cryptocurrency', 'x', 'blew', 'tesla', 'musk', 'maximus', 'pricelesselon']",2025-01-01,https://www.forbes.com/sites/digital-assets/2025/01/01/this-will-be-priceless-elon-musk-just-quietly-blew-up-the-price-of-this-bitcoin-rival/,Forbes,https://www.forbes.com,negative,-0.038,2025-01-03 19:43:00.708819
4,Fee-based accounts,Best debit cards that offer rewards in January 2025 - CNBC,"Discover® Cashback Debit Checking is a great choice if you're looking for a straightforward rewards program for your debit card.
Unlike many rewards debit cards that offer cash back with capped limits, there's no limit on the rewards you can earn with this debit card.
You earn rewards on your debit card by spending money with your debit card.
See our methodology for more information on how we choose the best rewards debit cards.
Our methodologyTo determine which rewards debit cards were the best, CNBC Select analyzed some of the most popular rewards debit cards on the market.","['best', 'card', 'offer', 'debit', 'deposit', '2025', 'cash', 'earn', 'fee', 'rewards', 'account', 'checking', 'cards', 'fees']",2025-01-01,https://www.cnbc.com/select/best-debit-cards-that-offer-rewards/,CNBC,https://www.cnbc.com,positive,+0.296,2025-01-03 19:43:00.708819
4,Fee-based accounts,5 best free budgeting tools of January 2025 - CNBC,"How to choose a free budgeting toolWhen choosing a budgeting tool, first decide what your financial goals are.
Pros and cons of budgeting toolsWhile free budgeting tools come with a lot of pros, they also have a few drawbacks.
Pros of budgeting tools Consolidates your finances: Many budgeting tools will allow you to see all your financial info, even across banks, in one simple location.
See our methodology for more information on how we choose the best free budgeting tools.
Our methodologyTo determine which free budgeting tools offer the best user experience, CNBC Select analyzed over a dozen different budgeting tools and looked at their features and user reviews.","['best', 'tools', 'users', 'features', 'accounts', 'expenses', '2025', 'financial', 'free', 'spending', 'budgeting', 'money']",2025-01-01,https://www.cnbc.com/select/best-free-budgeting-tools/,CNBC,https://www.cnbc.com,positive,+0.187,2025-01-03 19:43:00.708819
4,Fee-based accounts,Best budgeting apps of January 2025 - CNBC,"Pros and cons of budgeting appsPros Convenience : Budgeting apps typically allow you to see all of your financial data in one convenient place.
Privacy: Since budgeting apps often link to your finances, it's important to research data and privacy offerings before entering personal information.
Many budgeting apps come with other services, such as monitoring your savings, investments, debts and/or your credit score.
There are plenty of free budgeting apps on the market if you don't want to invest in one.
See our methodology for more information on how we choose the best budgeting apps.","['best', 'features', 'users', 'yes', 'apps', 'accounts', 'expenses', '2025', 'bank', 'free', 'app', 'budgeting']",2025-01-01,https://www.cnbc.com/select/best-budgeting-apps/,CNBC,https://www.cnbc.com,positive,+0.133,2025-01-03 19:43:00.708819
8,Bird Flu,Another raw pet food H5N1 bird flu recall. More sick cats in L.A. County - Los Angeles Times,"After another raw pet food recall and a cluster of H5N1 bird-flu-infected cats, Los Angeles county public health officials are re-upping their warning to pet owners: Stop feeding your dogs and cats raw pet food.
A recall has been issued on San Jacinto-based Monarch Raw Pet Food, whose raw poultry products are sold at several farmers markets in California.
The recall came after H5N1 bird flu was detected in product samples.
AdvertisementThe announcement comes on the heels of several warnings regarding pet cats and bird flu in the county.
There have been no human cases of bird flu identified yet as associated with exposure to these cats.","['health', 'food', 'cats', 'public', 'bird', 'flu', 'pet', 'products', 'county', 'h5n1', 'recall', 'raw', 'la', 'sick']",2025-01-01,https://www.latimes.com/environment/story/2024-12-31/another-raw-pet-food-h5n1-bird-flu-recall-more-sick-cats-in-la-county,Los Angeles Times,https://www.latimes.com,negative,-0.144,2025-01-03 19:43:00.708819
8,Bird Flu,‘Worrisome’ mutations found in H5N1 bird flu virus isolated from Canadian teenager - Los Angeles Times,"A California Department of Food and Agriculture technician perform tests on chickens for bird flu in 2006 at the Best Live Poultry & Fish store in Sylmar.
The fate of a Canadian teenager who was infected with H5N1 bird flu in early November, and subsequently admitted to an intensive care unit, has finally been revealed: She has fully recovered.
AdvertisementThere have been a total of 66 reported human cases of H5N1 bird flu in the U.S. in 2024.
She tested negative for the predominant human seasonal influenza viruses — but had a high viral loads of influenza A, which includes the major human seasonal flu viruses, as well as H5N1 bird flu.
This finding prompted her caregivers to test for bird flu; she tested positive.","['bird', 'flu', 'days', 'isolated', 'canadian', 'h5n1', 'tested', 'nov', 'severe', 'human', 'mutations', 'virus', 'worrisome', 'disease', 'teenager']",2025-01-01,https://www.latimes.com/environment/story/2024-12-31/worrisome-mutations-found-in-h5n1-bird-flu-virus-isolated-from-canadian-teenager,Los Angeles Times,https://www.latimes.com,negative,-0.141,2025-01-03 19:43:00.708819
3,Variable annuities,The best life insurance companies of January 2025 - CNBC,"Amica Life Insurance Highlights Amica offers a level term life insurance and whole life insurance policies payable for 20 years or until ages 65 or 100.
LEARN MORE Terms Apply Pacific Life Life Insurance Highlights Pacific Life offers term, permanent and no-exam life insurance, with an accelerated death benefit included at no charge.
Whole life insurance Assuming you keep up with payments, whole life insurance policies remain in effect for your entire life.
Universal life insurance Unlike term and whole life insurance, universal life insurance has premiums and a cash value component that fluctuate and death benefits that aren't guaranteed.
Our methodologyTo determine the best life insurance companies, CNBC Select collected data points on dozens of U.S. life insurance companies that write individual policies.","['best', 'universal', 'term', 'insurance', 'life', 'pay', '2025', 'policies', 'available', 'companies', 'policy', 'coverage']",2025-01-01,https://www.cnbc.com/select/best-life-insurance-companies/,CNBC,https://www.cnbc.com,positive,+0.088,2025-01-03 19:43:00.708819
8,Bird Flu,"Bird flu, brain rot and booze – the health issues you’ll be hearing more about in 2025 - The Guardian","So first with the not so cheery news: bird flu will continue its worrying prominence.
California has also issued a state of emergency over the growing number of humans infected with the disease and concerns it could mutate further.
Linked to mental health, I bet we will see more regulation of social media use by adolescents in the coming year.
We now have scientific evidence that extended periods of screen time, especially on social media platforms, is detrimental to mental health.
This year is likely to bring more evidence on the harmful effects alcohol has on our bodies, especially cancer risk.","['humans', 'booze', 'malaria', 'alcohol', 'media', 'health', 'sridhar', 'good', 'rot', 'brain', 'devi', 'evidence', 'youll', 'cancer', 'hearing', 'flu', 'issues', 'infected', 'social']",2025-01-01,https://www.theguardian.com/commentisfree/2025/jan/01/bird-flu-public-health-issues-2025-pandemic-social-media-alcohol,The Guardian,https://www.theguardian.com,negative,-0.185,2025-01-03 19:43:00.708819
4,Fee-based accounts,Best high-yield savings accounts of January 2025 - CNBC,"[ Jump to more details ]Find the right savings account for youMore on our top high-yield savings accountsWestern Alliance Bank Savings AccountThe Western Alliance Bank High-Yield Savings Account is powered by Raisin, meaning accounts are opened and managed through the Raisin.com platform.
Compare the best high-yield savings accounts Savings account Minimum deposit Monthly fee Withdrawal/transfer limit ATM card with savings account?
Ally Bank Savings Account None None Unlimited No American Express High Yield Savings Account $0 $0 Unlimited No Bask Bank Mileage Savings Account None None Up to 6/month No Capital One 360 Performance Savings None None Up to 6/month No CIT Bank Platinum Savings $100 None Up to 6/month No Jenius Bank None None Unlimited No LendingClub LevelUp Savings None None Unlimited Yes Marcus by Goldman Sachs High-Yield Online Savings Account None None Unlimited No Newtek Bank Personal High Yield Savings $0.01 None Up to 6/month No Openbank High Yield Savings $500 None Unlimited No SoFi Checking and Savings None None Up to 6/month Yes Synchrony Bank High Yield Savings None None Up to 6/month Yes UFB Secure Savings None None Up to 6/month Yes Varo Online Savings Account $0.01 None Up to 6/month No Western Alliance Bank High-Yield Savings Account $1 None Up to 6/month NoWhat is a high-yield savings account?
The main difference between high-yield savings accounts and traditional savings accounts is that high-yield savings accounts offer higher interest rates, which in turn allow your money to grow faster.
Also, unlike traditional savings accounts, high-yield savings accounts are generally offered by online banks that don't have physical branch locations.","['best', 'transactions', 'highyield', 'deposit', 'accounts', 'bank', '2025', 'minimum', 'fee', 'apy', 'savings', 'account', 'monthly']",2025-01-01,https://www.cnbc.com/select/best-high-yield-savings-accounts/,CNBC,https://www.cnbc.com,positive,+0.089,2025-01-03 19:43:00.708819
4,Fee-based accounts,The best business checking accounts of January 2025 - CNBC,"Best for small businessesBluevine Business Checking Learn More On Bluevine's secure site Special offer Secure a *$300 bonus by applying for a Bluevine Business Checking account using the referral code CNBC300 before 12/31/2024.
Novo Business Checking is worth considering if you want to establish a business presence and separate your personal and business finances.
[ Jump to more details ]Best for ATM accessAxos Basic Business Checking Learn More Special offer Business owners get up to $400 welcome bonus!
Nearly anyone with a side hustle or small business can qualify for a business checking account — not just large corporations.
Our methodologyTo determine which business checking accounts offer the most convenience, CNBC Select analyzed dozens of U.S. business checking accounts offered nationwide by online banks as well as those with physical branches.","['best', 'open', 'deposit', 'accounts', '2025', 'monthly', 'minimum', 'balance', 'fee', 'apy', 'account', 'checking', 'business']",2025-01-01,https://www.cnbc.com/select/best-business-checking-accounts/,CNBC,https://www.cnbc.com,positive,+0.227,2025-01-03 19:43:00.708819
4,Fee-based accounts,12 best CD rates of January 2025: Up to 4.65% APY - CNBC,"Annual Percentage Yield (APY) From 3.10% to 4.15% APYTerms From 3 months to 60 monthsMinimum balance $1,000 minimum depositMonthly fee NoneEarly withdrawal penalty fee Early withdrawal penalty may apply.
Annual Percentage Yield (APY) From 3.80% to 4.50% APYTerms From 1 year to 5 yearsMinimum balance $1,500 minimum depositMonthly fee NoneEarly withdrawal penalty fee Early withdrawal penalty applies.
Annual Percentage Yield (APY) From 2.00% to 4.00% APYTerms From 3 months to 10 yearsMinimum balance N/AMonthly fee NoneEarly withdrawal penalty fee Early withdrawal penalty applies.
Unlike the rates you find with traditional and high-yield savings accounts, CD rates are fixed, meaning they stay the same for the life of the CD term.
Your earnings depend on the CD term length, the amount you deposit, the APY offered when you opened the account and any associated fees.","['best', '465', 'withdrawal', 'cds', 'term', 'days', 'rates', 'penalty', '2025', 'cd', 'months', 'fee', 'apy', 'interest', 'terms', '12']",2025-01-01,https://www.cnbc.com/select/best-certificates-of-deposits/,CNBC,https://www.cnbc.com,negative,-0.123,2025-01-03 19:43:00.708819
3,Fintech,"Regulation, Deals and Crypto: Fintech Themes to Watch in 2025 - Bloomberg","Why did this happen?
Please make sure your browser supports JavaScript and cookies and that you are not blocking them from loading.
For more information you can review our Terms of Service and Cookie Policy.","['happenplease', 'information', 'robot', 'policy', 'sure', 'javascript', 'service', 'terms', 'review', 'supports', 'loading']",2025-01-01,https://www.bloomberg.com/news/articles/2025-01-01/regulation-deals-and-crypto-fintech-themes-to-watch-in-2025?utm_source=google&utm_medium=bd&cmpId=google,Bloomberg,https://www.bloomberg.com,positive,+0.23,2025-01-03 19:43:00.708819
3,Fintech,"Regulation, Deals and Crypto: Fintech Themes to Watch in 2025 - Bloomberg","Why did this happen?
Please make sure your browser supports JavaScript and cookies and that you are not blocking them from loading.
For more information you can review our Terms of Service and Cookie Policy.","['happenplease', 'information', 'robot', 'policy', 'sure', 'javascript', 'service', 'terms', 'review', 'supports', 'loading']",2025-01-01,https://www.bloomberg.com/news/articles/2025-01-01/regulation-deals-and-crypto-fintech-themes-to-watch-in-2025,Bloomberg,https://www.bloomberg.com,positive,+0.23,2025-01-03 19:43:00.708819
4,Fee-based accounts,Start saving up for your kid's college years today with these top 529 accounts - CNBC,"Bright Start College Savings (Illinois)Bright Start College Savings (Illinois) Learn More Information about Bright Start College Savings has been collected independently by CNBC Select and has not been reviewed or provided by the issuer prior to publication.
New York's 529 College Savings ProgramNew York's 529 College Savings Program Learn More Information about New York's 529 College Savings Program has been collected independently by CNBC Select and has not been reviewed or provided by the issuer prior to publication.
Oregon College Savings PlanOregon College Savings Plan Learn More Information about Oregon College Savings Plan has been collected independently by CNBC Select and has not been reviewed or provided by the issuer prior to publication.
529 college savings plan FAQs529 plan rulesAlthough 529 education savings accounts are traditionally used for covering future college costs, they're not limited to that.
Otherwise, you can open separate 529 college savings accounts for each child.","['funds', '529', 'investment', 'today', 'accounts', 'options', 'plan', 'contribution', 'saving', 'minimum', 'savings', 'account', 'college', 'kids', 'start']",2025-01-01,https://www.cnbc.com/select/best-529-plans/,CNBC,https://www.cnbc.com,positive,+0.05,2025-01-03 19:43:00.708819
11,"Diversity, equity, and inclusion (DEI)",Costco Is Caught In The Crosshairs Of The DEI Controversy - Forbes,"Our efforts around diversity, equity and inclusion follow our code of ethics,” Costco Board of Directors stated.
Forbes In Costco’s Defense Of DEI Efforts, Lessons For Business LeadersNow Costco, the nation’s third-largest retailer after number one Walmart and number two Amazon, is embroiled in the politically and emotionally-charged DEI controversy as calls for a Costco boycott are beginning to emerge, according to Newsweek.
Nasdaq Board Diversity Rule VacatedFurther evidence emerged in December when a Federal Court vacated the Securities and Exchange Commission’s (SEC) approval of a proposed Nasdaq board diversity rule.
Risks RealAsking Costco to objectively and rigorously study the risks associated with its DEI policies and practices is compelling.
To which, Costco seems to say, “Bring it on.”Note: Costco did not respond to a request for comment.","['study', 'board', 'crosshairs', 'shareholders', 'research', 'costco', 'dei', 'proposal', 'controversy', 'risks', 'caught', 'diversity', 'business']",2025-01-01,https://www.forbes.com/sites/pamdanziger/2025/01/01/costco-is-caught-in-the-crosshairs-of-the-dei-controversy/,Forbes,https://www.forbes.com,positive,+0.094,2025-01-03 19:43:00.708819
5,U.S. Department of the Treasury,What to know about string of US hacks blamed on China - BBC.com,"What to know about string of US hacks blamed on ChinaGetty ImagesUS officials say hackers linked to the Chinese government are responsible for breaching security at major telecommunications companies and US agencies.
For instance the group behind the telecoms hack is most commonly known by Salt Typhoon, the name given to it by researchers at Microsoft.
And millions of Americans may have had their data breached by the attacks on telecoms companies.
FBI Director Christopher Wray recently said that Salt Typhoon's hack of telecoms companies was China's ""most significant cyber-espionage campaign in history"".
EPA Outgoing FBI director Christopher Wray highlighted the threat from Chinese hackers in a farewell speechHow have Western allies responded?","['hackers', 'blamed', 'linked', 'know', 'hack', 'chinese', 'companies', 'targeted', 'china', 'security', 'string', 'telecoms', 'hacks']",2024-12-31,https://www.bbc.com/news/articles/c86w2evj05do,BBC.com,https://www.bbc.com,negative,-0.076,2025-01-03 19:43:00.708819
