ENTERPRISE_RISK_ID,SEARCH_TERMS,TITLE,SUMMARY,KEYWORDS,PUBLISHED_DATE,LINK,SOURCE,SOURCE_URL,SENTIMENT,POLARITY,LAST_RUN_TIMESTAMP
2,Quantum Computing,China is catching up with America in quantum technology - The Economist,"I n a SMALL shop in the eastern Chinese city of Hefei, one of the rarest pieces of technology in the world is on display.
The quantum computer in the showroom of Origin, a Chinese startup, looks ready to be plucked from the shelf and fired up.
Only 20 such devices are produced globally each year.
It is unclear what in the showroom is for sale, but none of it is supposed to be seen by foreigners.
During your correspondent’s visit, which was agreed on in advance, the company panicked at the sight of a foreigner, abruptly cancelled interviews and notified the police.","['startup', 'america', 'visit', 'supposed', 'chinese', 'unclear', 'quantum', 'sight', 'technology', 'china', 'catching', 'world', 'showroom', 'small']",2024-12-31,https://www.economist.com/business/2024/12/31/china-is-catching-up-with-america-in-quantum-technology,The Economist,https://www.economist.com,negative,-0.092,2025-01-03 19:43:00.708819
8,Bird Flu,California egg shortage drives prices to nearly $9 per dozen - San Francisco Chronicle,,[],2024-12-31,https://www.sfchronicle.com/bayarea/article/california-egg-prices-bird-flu-20008918.php,San Francisco Chronicle,https://www.sfchronicle.com,neutral,0.0,2025-01-03 19:43:00.708819
2,Nation-state actors,U.S. Treasury says it was hacked by China-backed intruder - The Washington Post,,[],2024-12-31,https://www.washingtonpost.com/technology/2024/12/30/treasury-hack-china-national-security/,The Washington Post,https://www.washingtonpost.com,neutral,0.0,2025-01-03 19:43:00.708819
5,U.S. Department of the Treasury,US Treasury says Chinese hackers stole documents in 'major incident' - Reuters,,[],2024-12-31,https://www.reuters.com/technology/cybersecurity/us-treasurys-workstations-hacked-cyberattack-by-china-afp-reports-2024-12-30/,Reuters,https://www.reuters.com,neutral,0.0,2025-01-03 19:43:00.708819
5,U.S. Department of the Treasury,‘Major incident’: China-backed hackers breached US Treasury workstations - CNN,"“There is no evidence indicating the threat actor has continued access to Treasury systems or information,” the Treasury spokesperson said.
Treasury officials plan to hold a classified briefing about the breach next week with staffers from the House Financial Services Committee, a senior committee staffer told CNN.
“With access to the stolen key, the threat actor was able to override the service’s security, remotely access certain Treasury [Departmental Office] user workstations, and access certain unclassified documents maintained by those users,” the Treasury letter said.
However, the Treasury spokesperson said in the statement that “several” Treasury user workstations were accessed.
Hardikar said in the letter that based on Treasury policy, intrusions attributed to advanced persistent threat actors are considered a “major cybersecurity incident.” Treasury officials are required to provide an update in a 30-day supplemental report.","['officials', 'hackers', 'access', 'spokesperson', 'treasury', 'actor', 'breached', 'incident', 'letter', 'workstations', 'service', 'threat', 'chinabacked']",2024-12-31,https://www.cnn.com/2024/12/30/investing/china-hackers-treasury-workstations/index.html,CNN,https://www.cnn.com,positive,+0.158,2025-01-03 19:43:00.708819
8,Bird Flu,"As pace and severity of human H5N1 cases accelerate, NIH leaders call for more action on bird flu - CNN","CNN —Most human cases of bird flu in North America have been mild, a fact that’s underscored by a new study of the first 46 confirmed human H5N1 infections in the United States this year.
With the number of cases continuing to grow, leaders from the National Institutes of Health are calling for more action to tackle the bird flu outbreak.
The teen was infected with a newer variant of the H5N1 virus, D1.1, which is carried by wild birds.
Taken together, she writes, the new reports of human cases show that the pace of human H5N1 infections has been accelerating.
Although the overall number of human infections related to H5N1 has been low, the continued drip, drip, drip of human and animal detections is not a good sign.","['infections', 'bird', 'flu', 'h5n1', 'dr', 'action', 'nih', 'human', 'cases', 'virus', 'number', 'teen', 'ill', 'pace', 'leaders', 'severity', 'infection']",2024-12-31,https://www.cnn.com/2024/12/31/health/human-h5n1-bird-flu-cases/index.html,CNN,https://www.cnn.com,negative,-0.093,2025-01-03 19:43:00.708819
5,U.S. Department of the Treasury,US Treasury says it was hacked by China in 'major incident' - BBC.com,"US Treasury says it was hacked by China in 'major incident'China denied any involvement, calling the accusation ""baseless"" and saying it ""consistently opposes all forms of hacking"".
The Treasury Department deemed the breach a ""major incident"" after disclosing it via a letter notifying lawmakers to the incident.
There was no evidence to suggest the hacker had continued to access to Treasury Department information since, the statement continued.
""In accordance with Treasury policy, intrusions attributable to an APT are considered a major cybersecurity incident,"" Treasury Department officials said.
""China consistently opposes all forms of hacking and firmly rejects the dissemination of false information targeting China for political purposes.""","['department', 'systems', 'hackers', 'officials', 'hacked', 'hack', 'treasury', 'incident', 'security', 'china', 'major', 'thirdparty']",2024-12-31,https://www.bbc.com/news/articles/c3weye2j0e7o,BBC.com,https://www.bbc.com,negative,-0.111,2025-01-03 19:43:00.708819
6,Chicago Board Options Exchange (CBOE),Financial Fresh Start - Forbes,"For alternative investments, a general rule is to maintain a 20% allocation to your liquid net worth.
Don’t overlook the unique characteristics of alternative investments, including their limited transparency and liquidity, and be sure to leverage the insights of your financial advisor to stay well-informed.
Alternative investments can help defer capital gains if you sell “winners” and don’t have enough “losers” to offset the gains.
Risk Management: Managing risk in alternatives requires careful attention to liquidity, lock-up periods, and changing economic conditions.
Most alternative investments are only available through financial advisors, and good financial advisors know the ""scuttlebutt"" of what's really going on.","['management', 'portfolio', 'public', 'sponsor', 'investment', 'information', 'performance', 'financial', 'investments', 'fresh', 'alternative', 'risk', 'start']",2024-12-31,https://www.forbes.com/sites/fredhubler/2024/12/31/financial-fresh-start/,Forbes,https://www.forbes.com,positive,+0.139,2025-01-03 19:43:00.708819
3,Cryptocurrency,Should you forget Bitcoin and buy Solana instead? - USA TODAY,"Could one of those tokens be Solana (CRYPTO: SOL), which trades at about $190 with a market cap of $90 billion?
Solana and other PoS tokens are usually valued by the speed of their blockchains and the growth of their developer ecosystems.
It could be smart to invest in both Bitcoin and Solana, but investors should be aware of their differences.
The Motley Fool has positions in and recommends Alphabet, Bitcoin, Ethereum, PayPal, Render Token, Shopify, Solana and Visa.
Offer from the Motley Fool: Before you buy stock in Solana, consider this:The Motley Fool Stock Advisor analyst team just identified what they believe are the 10 best stocks for investors to buy now… and Solana wasn’t one of them.","['buy', 'bitcoin', 'blockchain', 'crypto', 'pos', 'tokens', 'price', 'forget', 'fool', 'investors', 'motley', 'instead', 'solana']",2024-12-31,https://www.usatoday.com/story/money/investing/2024/12/31/bitcoin-solana-investing-cryptocurrency/77212026007/,USA TODAY,https://www.usatoday.com,positive,+0.101,2025-01-03 19:43:00.708819
5,U.S. Department of the Treasury,U.S. Treasury says it was hacked by China-backed intruder - The Washington Post,,[],2024-12-31,https://www.washingtonpost.com/technology/2024/12/30/treasury-hack-china-national-security/,The Washington Post,https://www.washingtonpost.com,neutral,0.0,2025-01-03 19:43:00.708819
5,U.S. Department of the Treasury,"US imposes sanctions on entities in Iran, Russia over election interference - Reuters",,[],2024-12-31,https://www.reuters.com/world/us-issues-fresh-iran-russia-sanctions-over-election-interference-treasury-dept-2024-12-31/,Reuters,https://www.reuters.com,neutral,0.0,2025-01-03 19:43:00.708819
11,Wage Growth,U.S. Credit Card Defaults Hit Post-Great Recession High - Forbes,"Understandably why, because about 69% of gross domestic product — GDP, the typical economic measure — is consumer spending.
A red flag of credit card defaults has gone up that should make everyone take much greater care.
Why consumer spending is criticalWithout that seemingly indefatigable consumer spending engine, things would freeze up.
Credit card defaults skyrocketThe Financial Times recently ran an article on how U.S. credit card loan defaults are at their highest level since the 2008 financial crisis.
Maybe people can keep their credit use in safe hands, but with credit card defaults on the rise, concern about the economy is the least people can offer.","['postgreat', 'hit', 'high', 'card', 'things', 'consumer', 'credit', 'financial', 'spending', 'inflation', 'loan', 'economy', 'recession', 'defaults']",2024-12-31,https://www.forbes.com/sites/eriksherman/2024/12/31/us-credit-card-defaults-hit-post-great-recession-high/,Forbes,https://www.forbes.com,positive,+0.148,2025-01-03 19:43:00.708819
8,Bird Flu,"France reports bird flu on two farms, losing disease-free status - Reuters",,[],2024-12-31,https://www.reuters.com/business/healthcare-pharmaceuticals/france-reports-bird-flu-two-farms-losing-disease-free-status-2024-12-31/,Reuters,https://www.reuters.com,neutral,0.0,2025-01-03 19:43:00.708819
2,Data breach,US Treasury says Chinese hackers stole documents in 'major incident' - Reuters,,[],2024-12-31,https://www.reuters.com/technology/cybersecurity/us-treasurys-workstations-hacked-cyberattack-by-china-afp-reports-2024-12-30/,Reuters,https://www.reuters.com,neutral,0.0,2025-01-03 19:43:00.708819
3,Fintech,US files complaint against fintech app Dave and its CEO - Reuters,,[],2024-12-31,https://www.reuters.com/legal/us-announces-civil-enforcement-action-against-fintech-app-dave-its-ceo-2024-12-30/,Reuters,https://www.reuters.com,neutral,0.0,2025-01-03 19:43:00.708819
5,Senate Banking Committee,U.S. Treasury says it was hacked by China-backed intruder - The Washington Post,,[],2024-12-31,https://www.washingtonpost.com/technology/2024/12/30/treasury-hack-china-national-security/,The Washington Post,https://www.washingtonpost.com,neutral,0.0,2025-01-03 19:43:00.708819
11,Wage Growth,"‘Hopefully, I’ll pay off my Covid debt’: what Britons want for their finances in 2025 - The Guardian","Ashley, 33, a marketing specialist from Leicester‘Hopefully, I’ll pay off my Covid debt’I’m hoping to finally pay off the hideous debt load I was put in during Covid.
But income tax, council tax and utility bill rises, as well as increased student loan contributions, mean that I’m still around £60 per month worse off than this time last year.
I’m generally happy with how my finances are, have zero debt outside of mortgage and monthly credit card usage, which is low.
A 38-year-old paramedic from Leicestershire‘I hope to secure full-time work to support my family’View image in fullscreen Rachel, from Edinburgh, with her four-year-old son.
Having to pay for medical treatment [because of untenable waits to be seen on the NHS] blows a huge hole into financial planning.","['buy', 'tax', 'covid', 'britons', 'working', 'work', 'pay', 'secure', '2025', 'income', 'finances', 'debt', 'hope', 'student', 'able', 'hopefully', 'ill']",2024-12-31,https://www.theguardian.com/money/2024/dec/31/what-britons-want-for-their-finances-in-2025,The Guardian,https://www.theguardian.com,positive,+0.185,2025-01-03 19:43:00.708819
5,House financial services committee,‘Major incident’: China-backed hackers breached US Treasury workstations - CNN,"“There is no evidence indicating the threat actor has continued access to Treasury systems or information,” the Treasury spokesperson said.
Treasury officials plan to hold a classified briefing about the breach next week with staffers from the House Financial Services Committee, a senior committee staffer told CNN.
“With access to the stolen key, the threat actor was able to override the service’s security, remotely access certain Treasury [Departmental Office] user workstations, and access certain unclassified documents maintained by those users,” the Treasury letter said.
However, the Treasury spokesperson said in the statement that “several” Treasury user workstations were accessed.
Hardikar said in the letter that based on Treasury policy, intrusions attributed to advanced persistent threat actors are considered a “major cybersecurity incident.” Treasury officials are required to provide an update in a 30-day supplemental report.","['officials', 'hackers', 'access', 'spokesperson', 'treasury', 'actor', 'breached', 'incident', 'letter', 'workstations', 'service', 'threat', 'chinabacked']",2024-12-31,https://www.cnn.com/2024/12/30/investing/china-hackers-treasury-workstations/index.html,CNN,https://www.cnn.com,positive,+0.158,2025-01-03 19:43:00.708819
5,U.S. Department of the Treasury,Beijing denies involvement in US treasury cyber-attack - The Guardian,"Beijing has hit back at accusations that a China state-sponsored actor was behind a cyber breach at the US treasury department, calling the claims “groundless”.
Hackers were able to gain access to a key used by the vendor to override certain parts of the system, according to a letter the treasury department sent to lawmakers on Monday.
According to the treasury, the incident happened earlier this month, when the actor was able to remotely access workstations and some unclassified documents.
“Treasury takes very seriously all threats against our systems, and the data it holds,” the spokesperson added.
Beijing rejects the allegations, and has previously said that it opposes and cracks down on all forms of cyber-attack.","['department', 'beijing', 'hackers', 'involvement', 'systems', 'cyberattack', 'access', 'information', 'spokesperson', 'treasury', 'actor', 'breach', 'china', 'denies']",2024-12-31,https://www.theguardian.com/technology/2024/dec/31/beijing-denies-involvement-in-us-treasury-cyber-attack,The Guardian,https://www.theguardian.com,positive,+0.085,2025-01-03 19:43:00.708819
2,Malware,New Google Spyware Warning—750 Million Android Users Must Now Act - Forbes,"New Android warning hits 750 million users.
But the ecosystem is far from protected, and there are now more than 750 million devices vulnerable to attack.
The fragmented nature of Android updates across vendors and carriers may impact these security enhancements' effectiveness by increasing the number of bugs that can be exploited.”According to StatCounter, while 56% of Android phones are running Android 13 or newer, one in four are running Android 11 and 12, with 10% on Android 9 and 10.
Google ended support for Android 9 in 2021, Android 10 in 2023 and Android 11 in February this year.
Android is changing—the days of aged versions of the OS running endlessly are coming to an end.","['warning750', 'users', 'devices', 'mobile', 'google', 'os', 'million', 'android', 'act', 'running', 'versions', 'spyware', 'threat']",2024-12-31,https://www.forbes.com/sites/zakdoffman/2024/12/31/new-android-spyware-warning-750-million-users-must-now-act/,Forbes,https://www.forbes.com,positive,+0.092,2025-01-03 19:43:00.708819
3,Fintech,Fintech's 2025 playbook: Here's what to watch - CNBC,"In this videoShare Share Article via Facebook Share Article via Twitter Share Article via LinkedIn Share Article via EmailFintech's 2025 playbook: Here's what to watchMalcolm Ethridge, managing partner at Capital Area Planning Group, joins CNBC's ‘Halftime Report’ to discuss his 2025 investing playbook.","['heres', 'fintechs', 'report', 'partner', 'share', '2025', 'watch', 'watchmalcolm', 'twitter', 'videoshare', 'planning', 'playbook', 'article']",2024-12-31,https://www.cnbc.com/video/2024/12/31/fintechs-2025-playbook-heres-what-to-watch.html,CNBC,https://www.cnbc.com,positive,+0.184,2025-01-03 19:43:00.708819
3,Spoofing,"Azerbaijan demands Russia admit guilt for downing plane, pay compensation - The Washington Post",,[],2024-12-30,https://www.washingtonpost.com/world/2024/12/29/azerbaijan-plane-crash-russia/,The Washington Post,https://www.washingtonpost.com,neutral,0.0,2025-01-03 19:43:00.708819
11,"Diversity, equity, and inclusion (DEI)",Costco Doubled Down On DEI As A Business Case: What We Can All Learn - Forbes,"During their upcoming shareholder meeting, the Costco board of directors will be asked to vote on a shareholder proposal to address the risk of their DEI efforts.
“PROPOSAL 4: SHAREHOLDER PROPOSAL REQUESTING REPORT ON THE RISKS OF MAINTAINING DEI EFFORTSThe following shareholder proposal has been submitted to the Company for action at the Annual Meeting by the National Center for Public Policy Research.
COLCHESTER, VERMONT - APRIL 3: A customer moves through the check out lane with his groceries at a ... [+] Costco Wholesale store on April 3, 2024 in Colchester, Vermont.
(Photo by Robert Nickelsberg/Getty Images) Getty ImagesOur success at Costco Wholesale has been built on service to our critical stakeholders: employees, members, and suppliers.
And by watching companies like Costco tackle these issues in the boardroom, we can see why DEI is worth defending.","['case', 'doubled', 'board', 'trillion', 'costco', 'dei', 'proposal', 'employees', 'wholesale', 'power', 'shareholder', 'diversity', 'learn', 'business']",2024-12-30,https://www.forbes.com/sites/dougmelville/2024/12/30/costco-doubled-down-on-dei-as-a-business-case-what-we-can-all-learn/,Forbes,https://www.forbes.com,positive,+0.055,2025-01-03 19:43:00.708819
8,AWS outage,How Networks Of Competence Achieve Superior Competitive Advantage - Forbes,"Initially, they were to be small “two-pizza teams,” although ultimately some teams became larger “single-threaded teams.” Teams were to be entrepreneurial in spirit, with minimal managerial supervision.
Networks Of Competence In Other SectorsAmazon was an early leader in creating a network of competence.
In networks of competence, the possibility emerges of organizations establishing superiority in most, if not all, the dimensions of competitive advantage.
“The Competition From Networks Is Unfair”It’s true that successful networks of competence represent a problem for traditional hierarchies of authority.
And read also:Understanding Why Networks Of Competence Crush Hierarchies Of AuthorityHow Networks Of Competence Are Crushing Hierarchies Of Authority","['network', 'superior', 'amazons', 'competitive', 'advantage', 'achieve', 'networks', 'firm', 'amazon', 'competence', 'hierarchies', 'bezos', 'teams']",2024-12-30,https://www.forbes.com/sites/stevedenning/2024/12/29/how-networks-of-competence-achieve-superior-competitive-advantage/,Forbes,https://www.forbes.com,positive,+0.164,2025-01-03 19:43:00.708819
3,Retail investor fraud,Indian Stocks Set for Record Yearly Flows From Retail Investors - Bloomberg,"Why did this happen?
Please make sure your browser supports JavaScript and cookies and that you are not blocking them from loading.
For more information you can review our Terms of Service and Cookie Policy.","['happenplease', 'information', 'robot', 'policy', 'sure', 'javascript', 'service', 'terms', 'review', 'supports', 'loading']",2024-12-30,https://www.bloomberg.com/news/articles/2024-12-30/indian-stocks-set-for-record-yearly-flows-from-retail-investors,Bloomberg,https://www.bloomberg.com,positive,+0.23,2025-01-03 19:43:00.708819
3,Fintech,U.S. files complaint against fintech app Dave and its CEO - CNBC,"Jason Wilk, chief executive officer of Dave, during TechCrunch Disrupt in San Francisco, California, US, on Monday, Oct. 28, 2024.
The U.S. Justice Department filed a complaint and announced a civil enforcement action on Monday against financial technology company Dave Inc and its CEO Jason Wilk for alleged violations of federal law.
The Justice Department and the Federal Trade Commission alleged the company lured users to its personal finance app by advertising cash advances of up to $500 that many never receive.
The complaint, filed by the Justice Department, seeks unspecified amounts of consumer redress and monetary civil penalties from the defendants and a permanent injunction to prohibit them from engaging in future violations, the Justice Department said.
The complaint filed on Monday amends and replaces an earlier complaint that the FTC filed in November, which had named only Dave as a defendant and did not seek any civil penalties.","['department', 'filed', 'complaint', 'ceo', 'fintech', 'dave', 'wilk', 'files', 'penalties', 'app', 'civil', 'violations', 'jason', 'justice']",2024-12-30,https://www.cnbc.com/2024/12/30/us-files-complaint-against-fintech-app-dave-and-its-ceo-.html,CNBC,https://www.cnbc.com,positive,+0.105,2025-01-03 19:43:00.708819
11,Wage Growth,Another judge blocks Biden rule expanding overtime pay - Reuters,,[],2024-12-30,https://www.reuters.com/legal/litigation/another-judge-blocks-biden-rule-expanding-overtime-pay-2024-12-30/,Reuters,https://www.reuters.com,neutral,0.0,2025-01-03 19:43:00.708819
3,Options contracts,Inside the Unprecedented Boom in Options Trading - The Wall Street Journal,,[],2024-12-30,https://www.wsj.com/livecoverage/stock-market-today-dow-sp500-nasdaq-live-12-30-2024/card/inside-the-unprecedented-boom-in-options-trading-H0inicz2e85FvJC3YkYD,The Wall Street Journal,https://www.wsj.com,neutral,0.0,2025-01-03 19:43:00.708819
2,Cyberattacks,New Windows Security Warning As Russian Cyberattacks Confirmed - Forbes,"Paper Werewolf target Word users.
Forbes Critical Gmail Warning—Don’t Click Yes To These Google Security AlertsThe Windows Werewolf Attack MethodologyLike so many other attack campaigns, Paper Werewolf uses phishing emails and brand impersonation to distribute its malicious payload.
These messages contain an encrypted Microsoft Word document that prompts the recipient to enable macros, yes, I know, in order to read it.
The threat intelligence analysts said that, in some instances, they observed the use of PowerRAT, a remote access trojan, enabling the attackers to execute commands and carry out reconnaissance.
I would also strongly recommend all readers go and read this fascinating discussion about what really has to change if we are ever to stop the email phishing threat.","['attack', 'phishing', 'windows', 'confirmed', 'werewolf', 'paper', 'word', 'intelligence', 'microsoft', 'security', 'cyberattacks', 'russian', 'threat', 'target', 'warning']",2024-12-30,https://www.forbes.com/sites/daveywinder/2024/12/30/windows-werewolf-warning-as-7-russian-spy-attacks-confirmed/,Forbes,https://www.forbes.com,negative,-0.147,2025-01-03 19:43:00.708819
8,Bird Flu,CDC scientist responds to Dr. Birx raising alarm over handling of bird flu - CNN,"How relevant is this ad to you?
Video player was slow to load content Video content never loaded Ad froze or did not finish loading Video content did not start after ad Audio on ad was too loud Other issues","['scientist', 'responds', 'raising', 'bird', 'alarm', 'relevant', 'cdc', 'birx', 'video', 'content', 'ad', 'slow', 'youvideo', 'handling', 'start', 'loading', 'player', 'flu', 'dr', 'loud']",2024-12-30,https://www.cnn.com/2024/12/30/health/video/cdc-bird-flu-response-reaction-digvid,CNN,https://www.cnn.com,neutral,1.0,2025-01-03 19:43:00.708819
5,U.S. Department of the Treasury,Treasury small business ownership rule on hold as court eyes constitutionality - CNBC,"Janet Yellen, U.S. Treasury secretary, on a tour of the Financial Crimes Enforcement Network (FinCEN) in Vienna, Virginia, on Jan. 8, 2024.
An upcoming Treasury Department deadline for millions of small businesses to fulfill a new reporting requirement on ""beneficial ownership information"" was delayed again, following a court order that suspended enforcement.
The regulation, which would require small businesses to disclose the identity of people who directly or indirectly own a control a company, is designed to prevent criminals from hiding illicit activity conducted through shell companies or opaque ownership structures, the Treasury said.
Circuit Court of Appeals issued an order late on Dec. 26 that halted enforcement while the court ""considers the parties' weighty substantive arguments"" on the constitutionality of the Corporate Transparency Act, which created the BOI reporting requirement, the order said.
In the interim, businesses aren't required to file BOI reports to the Financial Crimes Enforcement Network, known as FinCEN, which is part of the Treasury.","['reporting', 'ownership', 'order', 'saidthe', 'hold', 'court', 'treasury', 'eyes', 'requirement', 'businesses', 'small', 'rule', 'enforcement', 'business', 'constitutionality']",2024-12-30,https://www.cnbc.com/2024/12/30/treasury-delays-beneficial-ownership-reporting-deadline-for-small-businesses.html,CNBC,https://www.cnbc.com,positive,+0.106,2025-01-03 19:43:00.708819
